node_1,node_2,edge
data poisoning methods,adversarial training,Recent work has focused on developing better data poisoning methods that are robust against adversarial training at larger adversarial training radius ⇢a.
adversarial training,different perturbation radii,Adversarial training involves training models with different perturbation radii to improve robustness against attacks.
adversarial training,pgd attack,Adversarial training involves using PGD attack with a step-size to enhance model robustness.
adversarial training,clean data,Comparison between the performance of adversarial training on clean data and adversarial training with perturbations.
data poisoning methods,adversarial training,Data poisoning methods are sensitive to adversarial training even with smaller training radii.
data poisoning methods,poisoning radius,Effectiveness of data poisoning methods is affected by the relative sizes of training and poisoning radii.
trade-off,standard test accuracy,"There exists a trade-off between standard test accuracy and robust test accuracy, which can be influenced by the training radius."
poisons,adversarial training radius,The effectiveness of poisons decreases as the adversarial training radius increases.
poisons,ar perturbations,AR perturbations remain effective at smaller radii compared to other poisons.
poisoning performance,clean data,Evaluation of poisoning performance using different proportions of clean and poisoned data.
poisons,clean data,Poisons are considered effective if the addition of poisoned data impacts test accuracy compared to training only on clean data.
poisons,clean data,Poisons remain effective compared to other poisons even when clean data is mixed in. AR poisons are much more effective when a small portion of the data is clean.
poisons,data,Using an additional 95% of AR data leads to a ~9% decrease in test set generalization.
poisons,network,AR poisoned data is worse than useless for training a network.
data,clean data,AR perturbations make effective poisons for preventing a network from generalizing to the clean test distribution.
ar poisoning,dataset,AR poisoning does not need access to a broader dataset or surrogate network parameters.
ar poisoning,networks,AR poisons are more potent when training using a new network architecture.
ar poisoning,data augmentations,"AR poisons are more potent when training using strong data augmentations like Cutout, CutMix, and Mixup."
ar poisoning,defenses,AR poisoning is competitive or among the best against defenses like adversarial training.
datasets,test performance,AR processes are able to degrade the test performance of networks trained on three different 10 class datasets.
poisons,ar poisoned data,AR poisoned data is worse than useless when it is mixed with clean data.
