node_1,node_2,edge
reward shaping framework,proximal policy optimization (ppo) algorithm,"The reward shaping framework is evaluated using the PPO algorithm, showcasing a connection between the two terms."
reward shaping method,algorithm agnostic,"The reward shaping method is mentioned to be algorithm agnostic, indicating a relationship between the two terms."
framework,"ppo without reward shaping, ella and ride","The framework is compared to PPO without reward shaping, ELLA, and RIDE, indicating a relationship between the terms."
ride,exploration method,"RIDE is an exploration method addressing the sparse reward problem, showcasing a connection between the two terms."
eager,ella,"EAGER is mentioned to require less expert human intervention than ELLA, indicating a relationship between the two terms."
nvidia tesla v100,10 cores,"Nvidia Tesla V100 is used with 10 cores to train the model, indicating a relationship between the two terms."
experiments,4 seeds,"4 seeds are used in each experiment, showcasing a relationship between the two terms."
"eager, ella, and ride",table 1,"Table 1 describes the assumptions and expert knowledge required by EAGER, ELLA, and RIDE, showing a connection between the terms."
human expert intervention,automated parts done by the agent,"Human expert intervention involves manual input and decision-making, while automated parts refer to the tasks performed by the AI agent without human intervention."
eager,ride,"EAGER outperforms RIDE in tasks like PutNextTo and Unlock, achieving better results without expert knowledge. It also performs better than ELLA in tasks like PutNext and Sequence."
eager,ella,"EAGER achieves better results than ELLA in tasks like Unlock-Medium, where the goal is to open the color door by picking up the corresponding key, demonstrating superior performance without expert knowledge."
eager,performance,EAGER reaches better performance without the need for expert knowledge
eager,sample efficiency,EAGER gets a similar or better sample efficiency for most tasks
sequence task,temporal constraint,The Sequence task adds a temporal constraint by chaining two tasks using 'before' or 'after' together
eager,ell,Both EAGER and ELLA decompose the goal into auxiliary objectives
eager,performance,"EAGER retains strong performance, doing better than RIDE and ELLA"
eager,qa module,The slow progress of EAGER at the beginning can be attributed to the time when the agent is not good enough to efficiently trigger an intrinsic reward signal from the QA module
eager,qa performance,Is EAGER robust to QA performance?
qa,method,the reliability of the QA looks crucial to our method
qa,environments,the QA could be difficult to train in some environments e.g. if you want the QA to learn to answer in a large set
qa,answers,QA learns to answer in a large set of answers from example trajectories
sr,qa,SR determines the success rate of the QA during training
qa,agent,Agent is trained using reward shaping from QA
agent,training,Agent learns faster due to receiving rewards for meaningful answers during training
agent,qa,The agent is trained with QA having different success rates after pre-training.
figure 4,average reward,Figure 4 shows the average reward in tasks PutNextTo and Sequence for two distributions of bot trajectories used to train QA.
figure 4,bot trajectories,Figure 4 shows the average reward in tasks PutNextTo and Sequence for two distributions of bot trajectories used to train QA.
sr,pre-training sr,The SR converges to pre-training SR once the agent learns to complete the trajectory leading to the extrinsic reward.
trajectory distribution,noise,Noise is added to bot trajectories to compensate for a too narrow trajectory distribution.
training curves,environments,Figure 4 shows training curves for two environments for QA trained on wide trajectory distribution (WD) and narrow distribution (ND).
reward shaping method,wd,The reward shaping method trained on (WD) learns faster because they efficiently reward the agent early in training.
design choices,qa module,How design choices on the QA module affect EAGER’s performance.
intrinsic reward,qa module,We made two choices for the QA module and the associated intrinsic reward.
no_answer response,associated intrinsic reward,"We added a ""no_answer"" response as a design choice for the associated intrinsic reward."
confidence,answer,We rewarded each answer by the confidence the agent had in its own answer.
no_answer,suppressed,both the use of 'no_answer' and the non-binary reward independently boost sample efficiency
reward shaping method,learning agent,learning agent generates its own questions from the goal and rewards itself for correctly answering them
reward shaping method,ella,contrast between reward shaping method and ELLA where expert knowledge is required for choosing auxiliary objectives
reward shaping method,oracle,contrast between reward shaping method and methods calling upon an oracle for getting linguistic description of environment states
eager,qa system,EAGER assumes the QA system was pre-trained using a pre-existing set of example trajectories
method,babyai,"method tested on BabyAI, a 2D environment with synthetic language"
method,more realistic environments,future work to test method on more realistic environments with true human language
jean zay supercomputer,genci grant a0091011996,The Jean Zay supercomputer is associated with the Genci grant A0091011996.
jean zay supercomputer,anr deepcuriosity ai chair project,The Jean Zay supercomputer benefited from the ANR DeepCuriosity AI chair project.
jean zay supercomputer,horizon 2020 pillar-robots project,The Jean Zay supercomputer has been supported by the Horizon 2020 PILLAR-robots project.
genci grant a0091011996,anr deepcuriosity ai chair project,The Genci grant A0091011996 is associated with the ANR DeepCuriosity AI chair project.
genci grant a0091011996,horizon 2020 pillar-robots project,The Genci grant A0091011996 has been supported by the Horizon 2020 PILLAR-robots project.
anr deepcuriosity ai chair project,horizon 2020 pillar-robots project,The ANR DeepCuriosity AI chair project is a part of the Horizon 2020 PILLAR-robots project.
