node_1,node_2,edge
autonomous systems,legal and regulatory framework,Autonomous systems require a legal and regulatory framework to address potential harms.
autonomous systems,harm,The growing need for regulations is due to the potential harm caused by autonomous systems.
philosophy literature,harm,"There have been attempts within philosophy to define harm, without success in dealing with many examples."
harm,causality,Definitions of harm in philosophy often involve causality to some extent.
causal models,actual causality,"Although definitions of harm involve causality, they do not make use of causal models or actual causality."
qualitative notion of harm,causal models,The formal definition of harm in this paper is based on causal models to handle examples from literature.
harm,contrastive causation,The definition of harm introduced in the paper is based on contrastive causation.
default utility,actual outcomes,The concept of harm introduced in the paper compares actual outcomes to a default utility.
medical profession’s hippocratic oath,harm,The Hippocratic Oath in the medical profession emphasizes the principle of doing no harm.
harm,law,The concept of avoiding harm is a critical element in the legal system.
patients,harm,"Patients may be subjected to harm in various contexts, especially when considering legal and regulatory aspects. Harm is a critical element in the law and is becoming increasingly important with autonomous systems becoming more prevalent."
harm,causality,"The notion of harm often involves causality at some level, as observed in attempts to define harm in the philosophy literature. Most explanations of harm include a discussion on causing harm through causal relationships."
harm,comparative account,"The most widely discussed account for defining harm, the comparative account, faces counterexamples that seem fatal. Alternative accounts have not gained currency, indicating the challenges in defining harm through comparative means."
harm,ai systems,"The new proposal for Europe's AI act contains references to harm in relation to AI systems, particularly in classifying them as high-risk based on their potential harm to health, safety, or fundamental rights of individuals. Harm is a crucial consideration as autonomous systems become more prevalent."
europe's ai act,harm,"The European Commission's proposal for Europe's AI act contains references to harm and harmful aspects, emphasizing the importance of considering harm in relation to AI systems. Harm plays a crucial role in determining the risk associated with AI systems in terms of health, safety, and fundamental rights."
harm,european commission,The European Commission recognized the importance of defining harm carefully
harm,manufacturers,"If harm occurs, it is caused by the manufacturers"
manufacturers,driver,Manufacturers recommend that the driver does not even have to pay attention while driving
driver,autonomous car,The driver of autonomous car should react within 10 seconds when notified by the car
autonomous car,stationary car,An autonomous car detects an unexpected stationary car in front of it on a highway
driver,bob,The autonomous car could alert the driver Bob to react within 10 seconds
car,stationary car,"The autonomous car is directed to crash into the stationary car, resulting in a collision."
autonomous car,bob,"Bob claims that he was harmed by the autonomous car, suggesting a potential relationship between the two entities."
bob,algorithm,"Bob claims that if he had been alerted, he could have found a better solution than the algorithm-directed crash, indicating a potential conflict or difference in decision-making."
bob,injured,"Bob claims he was injured by the car, highlighting a direct impact on him."
injured,autonomous car,"The autonomous car caused harm resulting in Bob being injured, indicating a causal relationship."
autonomous systems,human users,Autonomous systems interact with human users in various domains
uav,military,UAV is used by the military
uav,target,UAV has to decide whether to bomb a suspected enemy encampment
target,camps,The target is not clearly identified as there are two camps close to each other
civilian refugees,rebel group,"One camp consists of civilian refugees, another consists of a rebel group"
rebels group,refugee camp,Rebel group is about to launch a deadly attack on the refugee camp
uav,refugees,The UAV's decision is based only on the expected utility of the refugees
camp,refugees,The UAV bombs the camp which was that of the refugees
refugees,uav,The UAV harmed the refugees despite the fact that both actions would have led to all the refugees being killed
event,outcome,Examples in which one event (the bombing) preempts another event (the attack) from causing an outcome are known as Late Preemption examples in the causality literature
healthcare domain,autonomous systems,Autonomous systems are used in the healthcare domain for classifying MRI brain images suspected of containing a tumor
mri brain images,tumor,Autonomous systems classify MRI brain images suspected of containing a tumor
image,tumor,"If an image is classified as having a tumor, the system decides whether to recommend a surgery"
accuracy,humans,The overall accuracy of the system is superior to that of humans
system,tumor,In some instances the system overlooks an operable tumor
patient,tumor,Imagine a patient who has a tumor
system,tumor,"The system overlooks an operable tumor, leading to a dispute between the patient’s family and the hospital regarding harm caused to the patient."
patient,tumor,A patient with a tumor dies from brain cancer due to not undergoing surgery.
patient,surgery,The patient dies from brain cancer as a result of not undergoing surgery.
patient,family,A dispute arises between the patient’s family and the hospital regarding harm caused to the patient.
hospital,system,"The hospital might claim that using the system is the optimal policy, leading to a dispute with the patient’s family."
outcomes,policy,The actual outcomes should be compared to those that could have occurred under the policy.
tools,notion of harm,The formal tools available are used to develop a formal notion of harm in the paper.
concepts,notion of harm,"A formal definition of harm is provided in the paper, dealing with all concerns, intuition matching, and connecting closely to decision theory and utility."
counterfactuals,causality,"Using counterfactuals and causality can lead to similar problems, which can be addressed with standard approaches in defining causality."
halpern,actual causality,"Halpern provides a definition of actual causality, which is used to address whether failing to take an action can be viewed as causing harm."
action,causing harm,"Failing to take an action can be viewed as causing harm, according to the standard definition of causality."
"richens, beard, and thompson",causality,"Richens, Beard, and Thompson observe that using causality appropriately could solve some problems in the harm literature."
rbt,causal models,"RBT gives a formal definition of harm that uses causal models, although it does not utilize a sophisticated definition of actual causality like Halpern's."
harm,quantitative aspects,"RBT focus on the more quantitative, probabilistic aspects of harm."
quantitative account,qualitative account,The quantitative account generalizes the qualitative account developed here in several ways.
event,default utility,One key step taken is to assume the existence of a default utility.
event,harm,An event is defined to cause harm whenever it causes the utility of the outcome to be lower than the default utility.
event,outcome,An event is defined based on its outcome causing harm depending on the utility.
default utility,context-dependent,The default utility may be context-dependent.
default utility,disagreement,There may be disagreement about what the default utility should be.
doctor,patient,"A doctor euthanizing a patient in great pain may cause harm, with disagreements on whether it actually causes harm."
doctor,harm,There can be disagreement about whether a doctor causing harm to a patient in great pain is appropriate.
dispute,family,The dispute between the family and the hospital can be seen as a disagreement about the right default utility.
dispute,hospital,The dispute between the family and the hospital can be seen as a disagreement about the right default utility.
utility,discount factor,"Utility issues, such as discount factors applied to future generations, can be connected to issues of harm."
causal models,harm,Causal models play a critical role in defining harm.
variables,values,Variables in the model are described in terms of their values.
exogenous variables,structural equations,"Exogenous variables are determined by factors outside the model, influencing other variables through structural equations."
exogenous variables,endogenous variables,"Exogenous variables are determined by factors outside the model, while endogenous variables are ultimately determined by the exogenous variables."
structural equations,values,Structural equations describe how values are determined within the model.
causal model m,"signature (s, f)",A causal model M consists of a signature (S) and a set of structural equations (F) that describe the relationships between variables.
signature s,"tuple (u, v, r)","A signature S is a tuple consisting of sets of exogenous variables (U), endogenous variables (V), and possible values associated with each variable (R)."
endogenous variable x,function fx,Each endogenous variable has a corresponding function (FX) that determines its value based on the values of other variables in the model.
causal model,m,"The new causal model denoted M (cid:126)X←(cid:126)x is identical to M, except for the equations for (cid:126)X in F being replaced by (cid:126)X = (cid:126)x."
causal model,probabilistic causal model,"Probabilistic causal model is a tuple M = (S, F, Pr), where (S, F) is a causal model, and Pr is a probability on contexts. Deterministic models suffice for offering a qualitative notion of harm, while probabilistic causal models are used for a quantitative generalization."
probabilistic causal model,causal model,"Probabilistic causal model is a tuple M = (S, F, Pr), where (S, F) is a causal model, and Pr is a probability on contexts. Deterministic models suffice for offering a qualitative notion of harm, while probabilistic causal models are used for a quantitative generalization."
causal model,dependencies,"The dependencies between variables in a causal model M = ((U, V, R), F) can be described using a causal network (or causal graph)."
dependencies,causal model,"The dependencies between variables in a causal model M = ((U, V, R), F) can be described using a causal network (or causal graph)."
causal network,causal model,"A causal network (or causal graph) is used to describe the dependencies between variables in a causal model M = ((U, V, R), F)."
causal network,causal model,"A causal network (or causal graph) is used to describe the dependencies between variables in a causal model M = ((U, V, R), F)."
x,y,The value of X in a setting results in a variation in the value of Y.
causal model,causal graph,A causal model M is recursive (or acyclic) if its causal graph is acyclic.
acyclic causal model,context,"If M is an acyclic causal model, given a context (cid:126)u for the exogenous variables in U, the values of all the other variables are determined."
causal model,context,"A pair (M, (cid:126)u) consisting of a causal model M and a context (cid:126)u is called a (causal) setting."
causal formula,setting,A causal formula ψ is true or false in a setting.
causal models,actual causation,"Causal models are used to define actual causation, explaining what it means for one specific event to cause another specific event."
actual causation,event,Actual causation focuses on defining the relationship between events and how one event can cause another.
actual causation,models,Various definitions of actual causation have been proposed for acyclic models.
models,definitions,Different definitions of actual causation exist for acyclic models.
primitive events,boolean combinations,"Events that can be causes are arbitrary conjunctions of primitive events, while events that can be caused are arbitrary Boolean combinations."
primitive events,events,Primitive events form the basis of events that can be causes or caused.
causality,(contrastive) definition,The definition of causality is related to the contrastive definition of harm in the context.
definition,actual causality,The definition of actual causality is contrasted to the definition of harm.
contrastive variant,actual causality,"A contrastive variant of the definition of actual causality is presented, focusing on the differentiation between different causes."
three conditions,actual cause,The three conditions for determining an actual cause of an event are outlined.
ac1,m,AC1 specifies the condition where the interpretation M applied to u entails X equaling x and some formula φ.
ac2,variables,"AC2 states the existence of a set W of variables in V and a setting w of variables in W such that M applied to u satisfies W equaling w and the formula [X ← x, W ← w]φ, where φ implies ¬φ is valid."
ac3,x is minimal,"AC3 emphasizes that X is minimal, meaning there is no strict subset of X that can replace X = x and still hold true for the conditions mentioned."
ac1,x = x,AC1 clarifies that X = x should not be considered a cause of φ unless both X = x and φ actually occur.
ac3,a cause,AC3 describes a minimality condition for a cause to have no irrelevant conjuncts.
ac2,but-for condition,"AC2 captures the standard but-for condition, indicating that X = x instead of X = x(cid:48) is considered a cause of φ if, given a different X value, φ would not have occurred."
conjuncts,x = x,conjuncts are part of a cause of X = x
x = x,cause,X = x is part of a cause of φ
x = x,φ,X = x is an actual cause of φ according to the standard non-contrastive deﬁnition
x = x,actual cause,X = x is an actual cause of φ rather than φ(cid:48)
state of affairs,event e,event e causes the state of affairs to obtain
state of affairs,harm,state of affairs is a harm for an agent if event e causes it to obtain
cause,harm,"In the context, the term 'cause' is used in relation to the term 'Harm'. The concept of cause is discussed in the context of defining harm, where harm is not always formally defined. Various accounts like causal-intrinsic badness account, causal-counterfactual account, and contrastive causal-counterfactual account are mentioned in relation to defining harm."
harm,ag,"The concept of harm is linked to 'ag' in the context. Harm for an agent 'ag' is defined based on different accounts like causal-intrinsic badness account, causal-counterfactual account, and contrastive causal-counterfactual account."
harm,event e,"The term 'Harm' is associated with the concept of 'event e' in the context. The definition of harm in relation to an event causing harm to a person 'ag' is discussed, taking into account different states of affairs and outcomes."
harm,utility,"The concept of 'Harm' is connected to 'utility' in the context. A formal definition of harm is provided which involves outcomes associated with utilities, reflecting a standard model in decision theory."
decision-theoretic view,work done on utility,The choice of decision-theoretic view allows us to benefit from all the work done on utility by decision theorists.
harm,outcome,"To define harm formally in the framework, causal models need to be extended and specialized with an endogenous variable O for outcome."
action,outcome,An action is seen to affect many variables that together constitute the outcome.
complete outcomes,interventions,"Interventions are allowed only on complete outcomes, not on individual variables making up the outcome."
utility value,outcomes,Causal models are extended by assigning a utility value to outcomes and having a default utility.
causal utility model,causal model,"A causal utility model is defined as M = ((U, V, R), F, u, d), where (U, V, R), F) is a causal model with an endogenous variable O, u is a utility function on outcomes and d is a default utility."
utility,causal utility model,A causal utility model involves the concept of utility and is used to define harm relative to a setting.
event,harm,"The occurrence of an event can lead to harm for an agent in a specific setting, depending on the utility function and default value chosen."
parent,child,Deciding whether harm is caused by a parent not giving a child ice cream may involve using the parent's definition of utility.
default value,model,"The choice of a default value in a model, including utility function and default value, plays a crucial role in justifying harm ascription."
bontly’s definition,outcome o,"Outcome o is a key concept in Bontly’s definition, where it is required that the utility of outcome o to be lower than the default utility."
ag,outcome o,"In Bontly’s definition, it is stated that ag is worse off in outcome o than in outcome o(cid:48), emphasizing the importance of outcome o."
default utility,outcome o,"The utility of outcome o must be lower than the default utility according to the context, highlighting the significance of default utility in determining outcomes."
(cid:126)x = (cid:126)x harms ag,(cid:126)x(cid:48),The concept of harm to ag is related to (cid:126)x(cid:48) as it is mentioned that harm occurs if (cid:126)x(cid:48) results in a worse outcome than o.
u(o = o),d,u(O = o) is less than d
o(cid:48),r(o),o(cid:48) belongs to R(O)
(cid:126)x,(cid:126)x,(cid:126)X is equal to (cid:126)x rather than (cid:126)X is equal to (cid:126)x(cid:48)
(cid:126)x,(cid:126)x,"(cid:126)X = (cid:126)x strictly harms ag in (M, (cid:126)u)"
(cid:126)x,(cid:126)x,(cid:126)X = (cid:126)x causes ag’s utility to be lower than the default
o(cid:48)(cid:48),r(o),o(cid:48)(cid:48) belongs to R(O)
(cid:126)x,(cid:126)x(cid:48),(cid:126)X ← (cid:126)x(cid:48)](O = o(cid:48)(cid:48))
(cid:126)x,(cid:126)x,(cid:126)X = (cid:126)x causes harm
o,three values,O should have at least three values
u(o = o(cid:48)(cid:48)),u(o = o),u(O = o(cid:48)(cid:48)) is less than u(O = o)
u(o = o(cid:48)(cid:48)),u(o = o),u(O = o(cid:48)(cid:48)) is less than u(O = o)
causality,dp-complete,causality is at least as hard as DP-complete based on the context
causal models,few variables,causal models for harm will have few variables according to the context
causal models,few possible values,causal models for harm will take on few possible values based on the context
causal models,many individuals,causal models for harm can involve many individuals according to the context
deﬁnition,counterfactual comparative account,comparison between deﬁnition and counterfactual comparative account of harm is useful as stated in the context
counterfactual harms,ag,counterfactual harms ag in the given conditions as per the context
counterfactually harms ag,actual happening,counterfactually harms ag if what actually happens is different based on the context
counterfactually harms ag,higher utility,ag gets higher utility from one outcome compared to the other as described in the context
but-for causality,default value,but-for causality takes into account default value unlike C3 as per the context
c1,c2,C1 and C2 essentially amount to but-for causality
c3,our conditions,C3 differs from our conditions by not taking into account the default value
deﬁnition 3,ac3,Deﬁnition 3 has no analogue of AC3 but examples focus on cases where X is actually a singleton so AC3 is trivially satisfied
examples,next section,examples in the next section show how critical distinctions are and reflect the key point from counterfactual comparative account considering only but-for causality
rbt,formal account of harm,RBT recently developed a formal account of harm using causal models
account,probabilistic and quantitative,their account is probabilistic and quantitative
account,special case,their account can be considered the special case where everything is deterministic and qualitative
rbt,deﬁnition 3,RBT offer a more general account that brings their account somewhat closer to Deﬁnition 3
rbt,limitations,RBT offer a more general account to deal with the limitations of but-for causality
rbt,section 5.6,RBT's account is different from ours in some significant respects; see Section 5.6 Examples
examples,illustrate,we now analyze several examples to illustrate how our definition handles the most prominent issues
problem of preemption,distinguishing harm from merely failing to benefit,The problem of preemption and the problem of distinguishing harm from merely failing to benefit are identified as serious issues in the literature on harm.
lewis,examples of preemption,Lewis used examples of preemption to argue for causation without counterfactual dependence.
event,harm,An event can cause harm even though the agent's well-being does not counterfactually depend on it.
counterfactual comparative account of harm,failures for causality,The counterfactual comparative account of harm and failures for causality both show that a counterfactual approach is not sufficient for determining causation or harm.
formal definition of causation,problems like preemption,"The formal definition of causation handles problems like preemption well, indicating a comprehensive approach to causation."
death,body,The body is hit by a flaming cannonball after his death.
death,batman,The heart attack would have killed Batman if he had still been alive.
death,heart attack,The heart attack was not harmful to Batman according to the counterfactual account.
death,harmful,"Intuitively, the heart attack was harmful to Batman."
heart attack,batman,The heart attack did not make things worse for Batman.
heart attack,cannonball,The heart attack was not actually harmful regardless of the fact that Batman would have been harmed by the cannonball.
h,batman,"In the formal definition, H represents whether Batman has a heart attack."
c,batman,C represents if Batman is hit by a cannonball.
d,batman,D represents whether Batman dies.
(cid:126)u,context,(cid:126)u is the context where H = 1.
h,batman,"(M, (cid:126)u)"
h,cannonball,Batman would have died even if he did not have a heart attack as he would have been hit by the cannonball.
c3,batman,C3 does not hold as the outcome is the same whether or not Batman has a heart attack.
causal account,variables,"The standard causal account introduces two new variables, K and S, to handle the problem with the temporal asymmetry between death due to a heart attack and death due to a cannonball."
temporal asymmetry,death,The temporal asymmetry between death due to a heart attack and death due to a cannonball is taken into account by introducing new variables.
time-stamped variables,temporal information,time-stamped variables deal with the incorporation of temporal information
time-stamped variables,variables,time-stamped variables are a type of variables
batman,alive,Batman is alive
equations,causal model,equations are part of the causal model
d,s,D is equal to S or K
d,k,D is equal to S or K
s,h,S is equal to H
k,s,K is equal to not S and C
batman,heart attack,Batman has a heart attack
batman,death,Batman's heart attack causes him to be alive rather than dead
m,(cid:126)u,"[M, (cid:126)u] entails H equals 1 and D equals 1"
k,cannonball,the cannonball does not kill Batman
cannonball,batman,cannonball hits Batman
batman,utility,Batman prefers being alive to being dead
default utility,alive,default utility is that of him being alive
batman,harm,"Batman's heart attack caused his death, causing the utility to be lower than the default"
batman,death,Batman's heart attack caused his death
batman,utility,Batman's death caused the utility to be lower than the default
preemption,causal models,Analysis of preemption suggests using causal models to resolve issues in the literature on harm
causal models,deﬁnitions of causation,Causal models allow for a more precise and explicit representation of the relevant causal structure along with the definitions of causation
causal models,modeling choices,Causal models force a modeler to make modeling choices to resolve ambiguity in causal scenarios
debate,causal models,A debate on harm cannot be had without explicit use of causal models
harm,beneﬁt,Distinguishing harm from merely failing to benefit is one of the central challenges in defining harm
authors,beneﬁt,Authors commonly define benefit as the symmetric counterpart to harm
batman,robin,"Batman contemplates giving a set of golf clubs to Robin, but eventually decides to keep them. If he had not decided to keep them, he would have given the clubs to Robin, which would have made Robin better off."
robin,batman,"By keeping the golf clubs, Batman clearly failed to make Robin better off."
robin,batman,"Although H2 holds in our account of harm (for the same reason that C1–C3 hold), we avoid the counterintuitive conclusion by assuming that the default utility is u(O = 0), so H1 does not hold."
robin,golf clubs,"Robin has been purchasing a set of golf clubs at the start of every past season, indicating a relation between Robin and golf clubs."
batman,golf clubs,"If Batman is a professional golfer, it is plausible for Robin to receive a set of golf clubs from Batman, indicating a relation between Batman and golf clubs."
h1,default utility,"The default utility affects the conclusion of whether Robin has been harmed or not, indicating a relation between H1 and default utility."
robin,harmed,"The deﬁnition concludes that Robin has been harmed based on the default utility, indicating a relation between Robin and harmed."
batman,waiter,"Batman contemplates giving a tip to the waiter, indicating a relation between Batman and the waiter."
