node_1,node_2,edge
waiter,better off,"If Batman had given the tip to the waiter, the waiter would have been better off, indicating a relation between the waiter and being better off."
batman,waiter,"It is suggested that Batman harmed the waiter by deciding to keep the extra money for himself, indicating a relation between Batman and the waiter."
default utility,receiving a tip,"The default utility can be that of receiving a tip, which affects whether the waiter is harmed or not in the example."
waiter,batman,Batman not giving a tip harms the waiter in the example provided.
countries in europe,tip,"In countries in Europe where a tip would not be expected, it is reasonable to take the default utility to be that of not receiving a tip."
examples 3 and 4,causal structure,"Examples 3 and 4 are isomorphic in terms of causal structure, allowing the utilities to be considered the same."
agent,default utility,The choice of default utility determines whether the agent is harmed in a particular scenario.
outcome,alternative,The alternative results in an even worse outcome.
outcome,injury,O = 0.5 stands for the injury resulting from crashing into the safety fence.
injury,stationary car,A potentially more severe injury resulting from crashing into the stationary car is captured by O = 0.
outcome,manufacturer,"From the perspective of the car manufacturer, this is going on in our starting Example 1."
bob,outcome,Let O be a three-valued variable capturing the outcome for Bob.
bob,injury,Bob not being injured is O = 1.
manufacturer,standard,Recall that the system has the built-in standard that the driver’s reaction time is 10 seconds.
system,manufacturer,Imagine the manufacturer implemented this standard by restricting the system’s actions in such cases.
action,system,This means that the causal structure is very similar to our Late Preemption example.
stationary car,collision,Hitting the fence preempts the collision with the stationary car.
variable,asymmetry,We therefore add a variable to capture the asymmetry between hitting the fence and hitting the stationary car.
stationary car,autonomous car,The autonomous car drives towards the fence only because there is a stationary car.
hitting the fence,prevents hitting the car,The fact that hitting the fence prevents hitting the car is captured in the equation for CH: CH = C ∧ ¬F H.
system,bob,"Did the system harm Bob? According to Carlson et al., the system did not harm Bob in a similar example."
intervening,causing bob being mildly injured,Our definition of causation considers the system's hitting the fence rather than not intervening to cause Bob being mildly injured.
taking,(cid:126)w,"taking (cid:126)W to be CH, we get that F = 1 rather than F = 0 causes O = 0.5 rather than O = 1"
h1,bob,conditions H1 and H2 are satisﬁed and there is harm
h2,bob,conditions H1 and H2 are satisﬁed and there is harm
f = 1,bob,"F = 1 rather than F = 0 is also a but-for cause of O = 0.5 rather than O = 0, that is, Bob’s being mildly injured rather than severely injured counterfactually depends on the system’s action"
h3,h3 kicks in,condition H3 kicks in: it ensures that we do not consider there to be strict harm caused if the alternative would have resulted in an even worse outcome
action,bob,Bob’s being mildly injured counterfactually depends on the system’s action
car manufacturer,bob,"the car manufacturer could make the case that although their policy harmed Bob, it was justiﬁed in doing so"
(cid:126)x = (cid:126)x,cases,"cases where (cid:126)X = (cid:126)x rather than (cid:126)X = (cid:126)x(cid:48) causes harm but not strict harm, the alternative event would have resulted in strict harm"
(cid:126)x = (cid:126)x(cid:48),cases,cases where (cid:126)X = (cid:126)x(cid:48) rather than (cid:126)X = (cid:126)x would have caused strict harm
someone,cases,"someone to argue that they were justiﬁed in causing harm, as the alternative would have been worse"
bob,bob,Bob believes he has been strictly harmed
bob,three-valued variable f,Bob's disagreement is captured by stating that he is using a three-valued variable F instead of a binary one.
bob,model,Variable F is incorporated into the model assuming that Bob is correct regarding his driving skills.
bob,o,Analyzing the model shows that F = 1 rather than F = 2 causes O = 0.5 rather than O = 1.
h3,bob,"H3 is satisfied for the contrast values where F = 1 rather than F = 2, causing the system's action to strictly harm Bob."
analysis,disagreement,"The analysis does not resolve the disagreement, but allows for a precise formulation of its source."
contrastive definition,causal-counterfactual definition,The rationale for considering a contrastive definition over a causal-counterfactual one is explained in the supplementary material.
approach,rbt,A comparison is made between the approach discussed and RBT in the supplementary material.
agent,default action,RBT focuses on choices made by an agent and compares them to a default action.
default action,no harm,"According to RBT's definition, if the agent performs the default action, there is no harm."
agent,default action,"The definition states that if the agent performs the default action, there is no harm."
doctor,patient,"The example discusses a doctor prescribing medication to a patient, and the patient suffering harm due to an allergic reaction."
medication,rare allergic reaction,"The patient suffers a rare allergic reaction to the medication, causing harm."
doctor,patient,The doctor is believed to have harmed the patient in the given situation.
rbt,default action,RBT mentions following 'clinical guidelines' as an example of a default action.
utility,default action,"Although a default utility is used, it does not necessarily need to be the utility of a default action to avoid problems according to the definition."
rbt,causal models,"RBT uses causal models, but they do not use a sophisticated definition of actual causality like the one given by Halpern."
rbt,actual causality,"RBT's definition of actual causality, based on but-for causality, is not comprehensive enough to handle more complex examples where a broader notion of causality is required."
rbt,path-dependent causality,"RBT generalizes their concept of causality to include path-dependent causality in Deﬁnition 9, although they do not specify the criteria for choosing which paths to consider."
causality,paths,"The context mentions the concept of causality and paths, emphasizing the importance of choosing appropriate paths to simulate the effects of AC2."
paths,ac2,Paths are related to AC2 as they are used to simulate the effects of AC2 in the context.
variables,values,The context discusses the concept of variables being fixed to their actual values.
variables,set,Variables are mentioned in relation to a set (cid:126)W in the context.
halpern’s deﬁnition,actual causality,The results obtained by Halpern’s deﬁnition of actual causality are compared to the results obtained in the context.
modeler,paths,The modeler has the ability to determine harm relative to some choice of paths in the context.
modeler,results,"The modeler has the ability to tailor the results obtained, giving them a significant extra degree of freedom."
choice,paths,There needs to be a more principled analysis of how to go about choosing paths in the context.
notion of harm,problematic examples,A qualitative notion of harm is discussed in relation to dealing well with problematic examples in the philosophy literature.
notion of harm,regulatory frameworks,The concept of a qualitative notion of harm is expected to be widely applicable in regulatory frameworks for autonomous systems according to the context.
practical applications,quantify harm,"For practical applications, the need for quantifying harm is mentioned in the context."
harm,quantitative notion,The concept of harm is quantified through a quantitative notion as mentioned in reference [2].
individual,harm,The degree of harm to an individual is discussed in relation to harm calculations involving multiple people.
people,individual harms,"When considering harm to multiple individuals, the sum of individual harms weighted by probability is questioned for its appropriateness."
alternatives,probability,Various alternatives to summing individual harms are discussed while taking probabilities into account.
decision-theory literature,work,Works from the decision-theory literature are drawn upon to discuss alternatives in harm calculations.
