node_1,node_2,edge
image classifier,success rate,The image classifier gives a success rate in classification tests for images.
image-fmri model,results,Results of the comparison are made with an image-fMRI model by Chen et al. (2023).
image,groundtruth,"An image is produced for each fMRI, with samples shown having the 'walking man' as the groundtruth."
hemodynamic response,lag,A lag is observed due to the hemodynamic response in the results.
subject,size of rois,"Each subject varies in the size of ROIs, with Subject 1, 2, and 3 having different voxel sizes."
subject 3,batch size,Subject 3 has only half the voxels. A larger batch size can be used during contrastive learning.
subject 3,contrastive learning,"A larger batch size can be used during contrastive learning for Subject 3, which may lead to better results."
contrastive learning,results,A larger batch size can lead to better results during contrastive learning.
objects,animals,"Semantics in video reconstruction include objects, animals, persons, and scenes."
persons,scenes,Semantics in video reconstruction include persons and scenes.
objects,motions,"Semantics in video reconstruction include objects, animals, persons, scenes, motions, and scene dynamics."
fmri,information,fMRI contains enough information to recover semantics mentioned in the video reconstruction.
video frames,single class,Video frames usually cannot be described with a single class.
event,gt class,A successful event is declared if the test succeeds with any of the GT class.
method,samples,Our method generates samples that are more semantically meaningful and match with the ground truth.
motions,scenes,"Various motions, scenes, persons, and animals can be correctly recovered in reconstruction diversity."
ablation study,window sizes,The ablation study conducted in the context explores the impact of different window sizes on the performance of the model. The relationship between these two concepts lies in evaluating the effect of varying window sizes on the overall performance.
ablation study,multimodal contrastive learning,The ablation study also delves into the role of multimodal contrastive learning in enhancing the model's performance. This relationship signifies the evaluation of the impact of multimodal contrastive learning on the model.
ablation study,adversarial guidance (ag),The ablation study further investigates the influence of adversarial guidance (AG) on the model's behavior. This connection indicates the assessment of the effect of adversarial guidance on the model's performance.
window sizes,full model,"The window sizes are directly linked to the Full Model, where different window sizes are evaluated for their impact on the overall model performance. This correlation signifies the importance of selecting an optimal window size for the model."
multimodal contrastive learning,adversarial guidance (ag),Multimodal contrastive learning and adversarial guidance (AG) are closely related in the context as both methodologies are examined for their role in enhancing the model's performance. This relationship highlights the evaluation of these two techniques in improving the model's functionality.
full model,video-based semantic-level,"The Full Model is associated with the Video-based Semantic-level analysis, where the model's performance is assessed based on semantic understanding derived from videos. This connection indicates the evaluation of semantic-level processing in the context of the Full Model."
full model,frame-based semantic-level,"The Full Model is also linked to the Frame-based Semantic-level analysis, where the model's performance is evaluated based on semantic understanding at the frame level. This relationship signifies the assessment of semantic-level processing in relation to individual frames within the Full Model."
hemodynamic response,scan windows,The hemodynamic response usually will not be longer than two scan windows.
hemodynamic response,multimodal contrastive learning,Testing the effectiveness of multimodal contrastive learning.
generation quality,multimodal contrastive learning,"Without contrastive learning, the generation quality degrades significantly."
modalities,contrastive learning,Performance is inferior when two modalities are used compared to full modalities used in contrastive learning.
reconstructed videos,full model,The reconstructed videos are visually worse than the full model.
adversarial guidance,reconstruction results,Reconstruction results decrease substantially without adversarial guidance.
negative guidance,distinguishability of fmri embeddings,Negative guidance is critical in increasing the distinguishability of fMRI embeddings.
attention analysis,normalized attention,Summarizing the attention analysis by presenting the sum of the normalized attention.
networks,bar charts,Networks are visualized in the bar charts.
networks,voxel-wise attention value,The Voxel-wise attention value is associated with networks.
bar charts,voxel-wise attention value,Voxel-wise attention value is displayed in bar charts.
voxel-wise attention value,brain flat map,The Voxel-wise attention value is shown on a brain flat map.
brain flat map,structural attention,Brain flat map reveals comprehensive structural attention.
structural attention,region,Structural attention is throughout the whole region.
average attention,testing samples,Average attention of all testing samples is computed.
average attention,attention heads,Average attention across all testing samples and attention heads.
visual cortex,influential region,Visual cortex emerges as the most influential region.
visual cortex,central visual field,Visual cortex encompasses both central visual field (VisCent).
visual cortex,peripheral visual field,Visual cortex encompasses both peripheral visual field (VisPeri).
visual cortex,attention,Visual cortex consistently attracts highest attention.
visual cortex,visual spatiotemporal information,Visual cortex plays a vital role in processing visual spatiotemporal information.
dorsal attention network,voluntary visuospatial attention control,Dorsal attention network is involved in voluntary visuospatial attention control.
default mode network,thoughts and recollections,Default mode network is associated with thoughts and recollections.
higher cognitive networks,visual perceptions process,Higher cognitive networks contribute to visual perceptions process.
layers,fmri encoder function,Layers of fMRI encoder function in a hierarchical manner.
layers,structural information,"In early layers, there is a focus on structural information."
brain regions,attention values,Different brain regions are segmented by attention values.
visual processing hierarchy,deeper layers,"The visual processing hierarchy is aligned with deeper layers, indicating a relationship between the two in the context of information segmentation."
deeper layers,holistic and abstract visual features,"Deeper layers show a shift towards learning more holistic and abstract visual features, implying a transition in the learned information."
video generation model,co-training,"The video generation model is co-trained with the fMRI encoder, as mentioned in the context while discussing the learning progress."
video generation model,attention,"The attention increases in higher cognitive networks and decreases in the visual cortex as the video generation model is co-trained, indicating a change in focus."
encoder,semantic information,"The encoder assimilates more semantic information as it progresses through learning stages, as described while analyzing the first-layer attention."
fmri signals,mind-video,"MinD-Video reconstructs high-quality videos from brain activities represented by fMRI signals, suggesting a relationship between the two in the context of video reconstruction."
learning stages,bar charts,"Learning stages (B) are associated with bar charts in the context, implying a visual representation of data at different learning phases."
brain networks,brain surface map,"Brain networks are marked on a brain surface map, indicating the visualization of brain connections and activities on a 2D map."
attention values,normalized attention values,"Normalized attention values are shown in the context, indicating the relative focus or importance assigned to different elements."
fmri encoder,sliding time window of fmri,"The fMRI encoder learns features from a sliding time window of fMRI, suggesting the extraction of relevant information from dynamic brain scans."
augmented stable diffusion,video generations,"An augmented stable diffusion is used for video generations in the context, highlighting the process of enhancing and stabilizing the generation of video content."
fmri encoder,mind-video,"The fMRI encoder is co-trained with MinD-Video using fMRI adversarial guidance, showcasing the utilization of brain scan data to improve video recovery."
attention maps,trained model decodes fmri,"Attention maps are used to demonstrate how the trained model decodes fMRI data, showing the process of translating brain activity into meaningful information."
pixel-level accuracy,visual samples,"Pixel-level accuracy is discussed in relation to visual samples, indicating the level of detail and precision in reconstructed visual content."
brain recordings,visual description,"Multi-scale information from brain recordings is fused to provide a more detailed visual description for generations, emphasizing the use of brain data to enhance visual content."
inter-subject generalization ability,intra-subject level,"The limitation of inter-subject generalization ability is mentioned, indicating that the method is focused on intra-subject analysis and has not been tested for broader generalization among different individuals."
method,voxels,"The method mentioned in the context only uses less than 10% of the voxels from the cortex for reconstructions, indicating a direct relationship between them."
method,whole brain data,"The method mentioned in the context uses less than 10% of the voxels from the cortex for reconstructions, while the whole brain data remains unexploited, showing a contrast between them."
brain decoding,brain-computer interfaces,"Brain decoding is stated to have promising applications in brain-computer interfaces, indicating a relationship between them."
governmental regulations,privacy,"Governmental regulations and efforts from research communities are required to ensure the privacy of one’s biological data, indicating a relationship between governmental regulations and privacy."
