node_1,node_2,edge
human vision,brain activities,"Human vision is reconstructed from brain activities, helping to understand the cognitive process."
static images,non-invasive brain recordings,Static images are reconstructed from non-invasive brain recordings in recent research.
mind-video,spatiotemporal information,MinD-Video learns spatiotemporal information from continuous fMRI data of the cerebral cortex through various techniques.
videos,continuous fmri data,Continuous visual experiences in the form of videos are recovered from continuous fMRI data.
videos,mind-video,High-quality videos of arbitrary frame rates can be reconstructed with MinD-Video using adversarial guidance.
semantic classification tasks,structural similarity index (ssim),Semantic classification tasks achieve an average accuracy of 85% and 0.19 in structural similarity index (SSIM) in evaluating recovered videos.
model,physiological processes,"The model is biologically plausible and interpretable, reflecting established physiological processes."
brain,moviegoer,The brain is depicted as a moviegoer engrossed in the film of experience.
brain,cognitive neuroscience,Understanding the information hidden within brain activities is a puzzle in cognitive neuroscience.
brain,human vision,Recreating human vision from brain recordings is a difficult task.
brain,neuroimaging data,Acquisition of neuroimaging data is a complex process.
brain,fmri,Deep learning has achieved significant results in visual class detections using fMRI.
fmri,image reconstruction,Deep learning and representation learning have advanced static image reconstruction using fMRI.
fmri,dynamic visual experience,Recovering dynamic visual experience from fMRI scans is a challenge due to the nature of fMRI.
fmri,blood oxygenation level dependent signals,fMRI measures blood oxygenation level dependent signals to capture brain activity snapshots.
fmri scan,brain activity,"The fMRI scan captures snapshots of brain activity every few seconds, representing an 'average' of brain activity during the snapshot."
fmri scan,visual experience,"The proposed progressive learning approach aims to recover continuous visual experience from fMRI scans, reconstructing high-quality videos with accurate semantics and motions."
fmri scan,hemodynamic response,"The Hemodynamic response refers to the lags between neuronal events and activation in BOLD signals, which are captured by the fMRI scan."
hemodynamic response,neuronal events,"The Hemodynamic response refers to the lags between neuronal events and activation in BOLD signals, indicating a relationship between Hemodynamic response and neuronal events."
hemodynamic response,bold signals,"The lags between neuronal events and activation in BOLD signals are captured by the Hemodynamic response, showing an interrelation between Hemodynamic response and BOLD signals."
fmri scan,mind-video,"The MinD-Video pipeline is designed to bridge the gap between image and video brain decoding, progressively learning from fMRI scans to decode videos."
video brain decoding,model,The model learns from brain signals in the context of video brain decoding
model,semantic space,The model gains a deeper understanding of the semantic space through multiple stages
model,brain signals,The model progressively learns from brain signals
model,fmri features,The model leverages unsupervised learning to learn general visual fMRI features
fmri encoder,contrastive language-image pre-training (clip) space,The fMRI encoder is trained in the CLIP space with contrastive learning
machine learning model,brain signals,The machine learning model learns from brain signals
model,visual fmri features,The model learns general visual fMRI features
features,co-training,The learned features are fine-tuned through co-training
features,augmented stable diffusion model,The learned features are finetuned with an augmented stable diffusion model
fmri encoder,video generation,The fMRI encoder is specifically tailored for video generation under fMRI guidance
brain features,multiple stages,The brain features are learned through multiple stages
encoder,brain features,The encoder learns brain features
stable diffusion model,scene-dynamic video generation,The diffusion model is augmented for scene-dynamic video generation
attention,spatiotemporal attention,Multimodal contrastive learning includes spatiotemporal attention for windowed fMRI
diffusion model,video generation,The diffusion model is tailored for video generation
videos,accurate semantics,High-quality videos are recovered with accurate semantics
semantic metrics,pixel metrics,"Semantic and pixel metrics are evaluated at video and frame levels, achieving an accuracy of 85% in semantic metrics."
semantic metrics,previous state-of-the-art approaches,Semantic metrics outperform the previous state-of-the-art approaches by 45%.
attention analysis,visual cortex,Attention analysis reveals mapping to the visual cortex.
attention analysis,higher cognitive networks,Attention analysis suggests mapping to higher cognitive networks.
model,biologically plausible,The model is biologically plausible according to attention analysis.
model,interpretable,The model is interpretable according to attention analysis.
image reconstruction,fmri,Image reconstruction from fMRI enables decoding hierarchical image features and semantic classes.
fmri,participants,fMRI data is collected from participants when they are looking at a static visual stimulus.
separable autoencoder,self-supervised learning,A separable autoencoder enables self-supervised learning in fMRI and images.
self-supervised learning,fmri dataset,Self-supervised learning is performed on a large-scale fMRI dataset using masked data modeling.
diffusion model,pre-trained fmri features,A stable diffusion model and pre-trained fMRI features are used to reconstruct high-fidelity images with high semantic correspondence.
video reconstruction,video reconstruction,"Video reconstruction is formulated as multiple image reconstructions, improving frame rates and consistency."
fmri,video stimulus,fMRI features can be decoded from fMRI collected with video stimulus.
fmri,video stimulus,fMRI encoder is trained with video stimulus.
fmri,videos,fMRI representations are encoded with a linear layer as conditions to generate higher quality videos.
videos,conditional video gan,Higher quality and frame rate videos can be generated with a conditional video GAN.
conditional video gan,data scarcity,Results of conditional video GAN are limited by data scarcity.
conditional video gan,large amount of data,Conditional video GAN generally requires a large amount of data for training.
separable autoencoder,self-supervised learning,The separable autoencoder enables self-supervised learning.
mice neural data,latent embeddings,Contrastive learning derives latent embeddings from mice neural data.
latent embeddings,generation of videos,Videos can be generated based on latent embeddings derived from contrastive learning.
mbm masked brain modeling,gpt,"MBM is similar to GPT in trying to recover masked data from the remaining fMRI data, enabling self-supervised learning."
mbm masked brain modeling,mae,"MBM is similar to MAE in trying to recover masked data from the remaining fMRI data, enabling self-supervised learning."
mbm masked brain modeling,downstream task,The knowledge gained from MBM can be distilled and transferred to a downstream task with limited data and a few-step tuning.
clip contrastive language-image pre-training,shared latent space,The training of CLIP aims to build a shared latent space for images and natural languages through large-scale contrastive learning.
clip contrastive language-image pre-training,clip space,The shared latent space (CLIP space) contains rich semantic information on both images and texts.
stable diffusion diffusion models,stable diffusion,"As a variant, stable diffusion generates a compressed version of the data (data latent) instead of generating the data directly."
stable diffusion diffusion models,data latent space,"Stable diffusion works in the data latent space, reducing the computational requirement and enabling generation of higher-quality images with more details."
mind-video,fmri encoder,MinD-Video is decoupled into two modules: an fMRI encoder and a video generative model.
mind-video,video generative model,MinD-Video is decoupled into two modules: an fMRI encoder and a video generative model.
fmri encoder,video generative model,"Illustrated in Fig. 2, fMRI encoder and video generative model are trained separately and then finetuned together."
encoder,fmri,The encoder in the first module transfers the pre-processed fMRI into embeddings.
fmri,bold signals,fMRI captures whole-brain activity with BOLD signals (voxels).
bold signals,voxels,Each voxel is assigned to a region of interest (ROI) for focused analysis.
roi,visual stimuli,"Here, we concentrate on voxels activated during visual stimuli."
roi,voxels,ROIs are defined by voxels that are activated during visual stimuli.
roi,parcellation,One way to define ROIs is through a pre-defined parcellation.
roi,statistical tests,Another way to define ROIs is by using statistical tests to identify activated voxels during stimuli.
parcellation,visual cortex,The parcellation method is used to obtain the visual cortex as the ROI.
visual cortex,activated regions,The activated regions within the visual cortex are determined by correlating fMRI data across multiple viewings.
activated regions,z-scores,The correlation coefficients are converted to z-scores to determine the statistical significance of the activated regions.
voxels,visual cortex,Most of the identified activated voxels are located in the visual cortex.
progressive learning,fmri encoder,Progressive learning is used to train the fMRI Encoder efficiently by first learning general knowledge and then refining to more task-specific knowledge.
progressive learning,visual decoding,A progressive learning pipeline is designed to generate meaningful embeddings specific for visual decoding by learning fMRI features through multiple stages.
features,stages,"The features are organized through multiple stages, starting from general features to more specific and semantic-related features."
progressive learning process,evolution,The progressive learning process is reflected biologically in the evolution of fMRI attention maps.
large-scale pre-training,mbm,A large-scale pre-training with masked brain modeling (MBM) is used to learn general features of the visual cortex.
autoencoder,asymmetric vision-transformer-based,An asymmetric vision-transformer-based autoencoder is trained on the Human Connectome Project with the visual cortex defined by [22].
visual cortex,3d,fMRI data of the visual cortex is rearranged from 3D into 1D space in the order of visual processing hierarchy.
patches,size,The patches of the visual cortex data will be divided into patches of the same size.
encoder,decoder,A simple decoder aims to recover the masked tokens from the unmasked token embeddings generated by the encoder in the autoencoder architecture.
mbm,token embeddings,"If the training objective can be achieved with high accuracy using a simple decoder in MBM, the token embeddings generated by the encoder will be a rich and compact description of the original fMRI data."
spatiotemporal attention,windowed fmri,"For the purpose of image reconstruction, spatiotemporal attention is applied to windowed fMRI data."
fmri,image reconstruction,fMRI data is used for image reconstruction in the spatiotemporal attention process
fmri,spatial information,fMRI data is processed with attention to spatial information in the encoding process
fmri,video reconstruction,"fMRI data can be mapped to video frames for reconstruction, where each set corresponds to 6 frames"
visual stimulus,fmri data,lag occurs between the presented visual stimulus and the recorded fMRI data due to hemodynamic response delay
hemodynamic response function (hrf),neural activity,HRF is used to model the relationship between neural activity and BOLD signals in fMRI data
signal y(t),stimulus function s(t),signal y(t) is the convolution of stimulus function s(t) and the hemodynamic response function h(t)
basis functions,matrix form,The basis functions can be combined into a matrix form represented as Y = Xβ + e
y,observed data,Y represents the observed data in the matrix form Y = Xβ + e
y,x,Y is related to X in the equation Y = Xβ + e
x,β,X is multiplied by β in the equation Y = Xβ + e
β,regression coefficients,β is a vector of regression coefficients in the matrix form Y = Xβ + e
e,unexplained error values,e represents the vector of unexplained error values in the matrix form Y = Xβ + e
individuals,sessions,Variations in e occur across individuals and sessions
age,cognitive state,Age and cognitive state influence the variations in e
specific visual stimuli,firing rate,Visual stimuli influence the firing rate which is affected by variations in e
onset latency,neuronal activity duration,Onset latency and neuronal activity duration are impacted by variations in e
bold signal,hemodynamic response,The BOLD signal lags behind the visual stimulus due to hemodynamic response
fmri,stimulus,There is a discrepancy between fMRI and the stimulus due to the lag in BOLD signal
individual variations,personalized hrf models,Individual variations can be addressed using personalized HRF models
algorithms,participant,Developing algorithms that adapt to each participant helps address individual variations
algorithms,flexibility,Algorithms that adapt to participants provide superior flexibility
algorithms,robustness,Algorithms that adapt to participants have robustness in addressing individual variations
scan window,hr,The scan window needs to decode each window and account for the hemodynamic response
spatiotemporal attention layer,fmri frames,The attention layer processes multiple fMRI frames in a sliding window
xt,token embeddings,xt represents the token embeddings of the fMRI
xt,rn×w×p×b,xt has dimensions Rn×w×p×b in the sliding window representation
attn,softmax,The attention is calculated using the softmax function
xt,window size,"xt is defined as xt∈Rn×w×p×b, where w represents the window size."
attention,softmax,Attention is calculated using softmax function.
spatial attention,network inflation trick,"To calculate spatial attention, the network inflation trick is used to merge the first two dimensions of xt."
query,key,Query and key are calculated together using Eq. (1).
temporal attention,sliding window,"To calculate temporal attention, the sliding window of fMRI is considered."
spatial attention,fmri tokens,Spatial attention learns correlations among fMRI tokens.
temporal attention,fmri,Temporal attention learns the correlations of fMRI from the sliding window.
fmri encoder,visual cortex,The fMRI encoder is pre-trained to learn general features of the visual cortex.
temporal attention heads,sliding window,Temporal attention heads are used to process a sliding window of fMRI.
fmri embeddings,clip space,fMRI embeddings are pulled closer to a shared CLIP space containing rich semantic information.
generative model,text conditioning,The generative model is usually pre-trained with text conditioning.
generative model,text conditioning,"The generative model is usually pre-trained with text conditioning, indicating a relationship between the two concepts."
fmri embeddings,text-image shared space,Pulling the fMRI embeddings closer to the text-image shared space ensures its understandability by the generative model during conditioning.
videos,training set,"Videos in the training set are downsampled to a smaller frame rate (3FPS), showing a relationship between the two concepts."
frame,captioned with blip,"Each frame is captioned with BLIP [31], illustrating the relationship between the two concepts."
image encoder,clip text encoder,"With the CLIP text encoder and image encoder being fixed, the CLIP loss [18] is calculated for fMRI-image and fMRI-text, respectively, suggesting a relationship between the two concepts."
embt,embf,"Denote the pooled text embedding, image embedding, and fMRI embedding by embt, embi, embf ∈Rn×b, emphasizing a connection between the two concepts."
clip text encoder,fmri embeddings,"The CLIP loss [18] is calculated for fMRI-image and fMRI-text, respectively, indicating a relationship between the two concepts."
image embedding,fmri embedding,"The CLIP loss [18] is calculated for fMRI-image and fMRI-text, respectively, highlighting a connection between the two concepts."
contrastive language-image-fmri loss,lclip,"The contrastive language-image-fMRI loss is given by L=(LCLIP(embf, embt)+LCLIP(embf, embi))/2, where LCLIP(a, b)=CrossEntropy(ϵa·bT, [0,1,...,n]), showcasing a relationship between the two concepts."
batch size,better contrastive pairs,"Extra care is needed to reduce similar frames in a batch for better contrastive pairs, indicating a connection between the two concepts."
stable diffusion model,generative model,"The Stable Diffusion model [21] is used as the base generative model considering its excellence in generation quality, computational requirements, and weights availability, showing a relationship between the two concepts."
image-generative model,stable diffusion model,"However, as the stable diffusion model is an image-generative model, temporal constraints need to be applied in order for video generation, illustrating a connection between the two concepts."
scene-dynamic sparse causal (sc) attention authors,network inflation trick,"Authors in [30] use a network inflation trick with sparse, indicating a relationship between the two concepts."
sparse causal attention,network inflation trick,Authors in [30] use a network inflation trick with sparse temporal attention to adapt the stable diffusion to a video generative model.
sparse causal attention,sc attention,"The SC attention is calculated with the query, key, and value given by Q=WQ·zvi, K =WK·[zvi−2, zvi−1], V =WV·[zvi−2, zvi−1]."
sparse causal attention,adversarial guidance,Eq. (5) can be changed to an adversarial guidance version [21].
network inflation trick,sparse temporal attention,Authors in [30] use a network inflation trick with sparse temporal attention to adapt the stable diffusion to a video generative model.
sparse temporal attention,sc attention,"The SC attention is calculated with the query, key, and value given by Q=WQ·zvi, K =WK·[zvi−2, zvi−1], V =WV·[zvi−2, zvi−1]."
adversarial guidance,conditional sampling,Guidance is widely used in the conditional sampling of diffusion models for its flexibility and generation diversity.
generated contents,positive guidance,Generated contents can be controlled through what to generate (positive guidance).
generated contents,negative guidance,Generated contents can be controlled through what not to generate (negative guidance).
negative condition,averaged fmri,"The averaged fMRI is used as the negative condition for generating diverse videos for different fMRI, guaranteeing the distinguishability of the inputs."
fmri encoder,unpooled token embedding,The fMRI encoder generates an unpooled token embedding x for each fMRI input.
unpooled token embedding,latent channel number,The unpooled token embedding x is denoted by the latent channel number l.
noise update function,regular classifier-free guidance,"When the negative condition is null, the noise update function falls back to the regular classifier-free guidance."
fmri encoder,fmri-video pairs,The second phase involves tuning the encoder and part of the generative model together with fMRI-video pairs.
query projectors,different modality,"In this case, the whole self-attention, cross-attention, and temporal-attention heads are tuned instead of only the query projectors, as a different modality is used for conditioning."
encoder progressive learning,token embeddings,The last stage of encoder progressive learning results in the generation of token embeddings that contain rich semantic information and are easy to understand by the generative model.
encoder progressive learning,brain decoding,"Learning from the brain extends beyond decoding and reconstruction, aiming to understand the biological principles of the decoding process."
encoder progressive learning,attention maps,"Visualizing average attention maps from different layers of the fMRI encoder can help in observing the transition from capturing local relations to recognizing more global, abstract features."
attention maps,brain surface maps,"By projecting attention back to brain surface maps, it is possible to visualize each brain region's contributions and the learning progress through each stage of the models"
dataset,human connectome project (hcp) 1200 subject release,The pre-training dataset employed for the upstream pre-training includes resting-state and task-evoked fMRI data from the Human Connectome Project (HCP) 1200 Subject Release.
dataset,fmri-video dataset,A publicly available benchmark fMRI-video dataset comprising fMRI and video clips was used for the experiments.
fmri,video clips,fMRI data was collected using video clips as stimuli
fmri,3t mri scanner,fMRI data was collected using a 3T MRI scanner for scanning
fmri,subjects,fMRI data was collected from three subjects
training data,video clips,training data included segments of video clips for analysis
training data,paired training examples,training data yielded paired training examples for the study
test data,video clips,test data comprised segments of video clips for evaluation
test data,fmris,test data included fMRIs for testing purposes
video stimuli,animals,video stimuli included diverse content such as animals
video stimuli,humans,video stimuli included diverse content such as humans
video stimuli,natural scenery,video stimuli included diverse content such as natural scenery
frames,fmri frame,frames per fMRI frame after downsampling
fmri encoder,patch size,fMRI encoder utilized a patch size of 16
fmri encoder,depth,fMRI encoder had a depth of 24
fmri encoder,embedding dimension,fMRI encoder had an embedding dimension of 1024
encoder,mask ratio,encoder was pre-trained with a mask ratio of 0.75
encoder,projection head,encoder was augmented with a projection head
stable diffusion v1-5,resolution,Stable Diffusion V1-5 was trained at the resolution of 512x512
stable diffusion,video generations,Stable Diffusion was tuned for video generations
resolution of 512×512,augmented stable diffusion,"The resolution of 512×512 is used, but augmented Stable Diffusion is tuned for video generations"
resolution of 256×256,3 fps,"At the resolution of 256×256 with 3 FPS, FPS and image are downsampled for efficient experiments"
image,downsampled,FPS and image are downsampled for efficient experiments
fmri encoder,pre-training,All parameters in the fMRI encoder pre-training are the same as [7] with eight RTX3090
fmri encoder,pre-training,"The fMRI encoder pre-training on a large-scale dataset is the most resource-consuming part, but only one pre-training is needed for different subjects"
parameters,rtx3090,All parameters in the fMRI encoder pre-training are the same as [7] with eight RTX3090
fmri encoder,pre-training,"The fMRI encoder pre-training on a large-scale dataset is the most resource-consuming part, but only one pre-training is needed for different subjects, contrasting with other downstream stages"
multimodal contrastive learning,co-training,Multimodal contrastive learning and co-training are performed for each subject individually due to individual variability
inference,ddim [34] steps,Inference is performed with 200 DDIM [34] steps
evaluation metrics,frame-based metrics,"Following prior studies, we utilize both frame-based and video-based metrics for evaluation"
frame-based metrics,pixel-level metrics,"Frame-based metrics are divided into two classes, pixel-level and semantics-level metrics"
frame-based metrics,semantics-level metrics,"Frame-based metrics are divided into two classes, pixel-level and semantics-level metrics"
pixel-level metrics,structural similarity index measure (ssim),Structural similarity index measure (SSIM) is used as the pixel-level metric
structural similarity index measure (ssim),pixel-level metric,SSIM is used as the pixel-level metric in the context
test accuracy,classification test,Test accuracy is calculated with respect to the groundtruth frame in the classification test
groundtruth frame,ssim,SSIM and classification test accuracy are calculated with respect to the groundtruth frame
groundtruth (gt),predicted frame (pf),Comparison is made between the classification results of groundtruth and predicted frame using an ImageNet classifier
gt class,top-k probability,GT class within the top-K probability of PF classification results from N randomly picked classes is considered a successful trial
video semantics,classification test,Video-based metric measures video semantics using the classification test
video classifier,videomae,Video classifier based on VideoMAE is used for video semantics classification
annotated video dataset,kinetics-400,"Video classifier trained on Kinetics-400, an annotated video dataset with 400 classes"
high-quality videos,semantically meaningful content,Videos generated are aimed to have both high-quality visuals and semantically meaningful content.
subject 1,testing video,Subject 1 is evaluated with the first testing video.
ssim,subject 1,SSIM of Subject 1 is evaluated to achieve a score of 0.186.
kupershmidt et al. (2022),test videos,Comparison is made with Kupershmidt et al. (2022) by evaluating all test videos for different subjects.
semantic-level metrics,success rate,"Using semantic-level metrics, the method achieves a success rate in classification tests."
video classifier,success rate,The video classifier gives a success rate in classification tests for videos.
