node_1,node_2,edge
function approximation,recent results on stochastic on-policy sampling,Function approximation can be combined with recent results on stochastic on-policy sampling for agnostic learning.
function approximation,algortithm design,Investigating new global convergence conditions for function approximation might be used to achieve better representation learning in algorithm design.
new global convergence conditions,algorithm design,New global convergence conditions could be applied in algorithm design to achieve better representation learning.
non-linear transforms,activation functions,Non-linear transforms (activation functions) interact with low-dimensional features through gradient descent in scenarios like neural networks.
non-linear transforms,gradient descent,Non-linear transforms interact with low-dimensional features through gradient descent in various scenarios.
activation functions,low-dimensional features,Activation functions interact with low-dimensional features in the context of neural networks.
activation functions,gradient descent,Activation functions interact with low-dimensional features through gradient descent in various scenarios.
neural networks,gradient descent,Non-linear transforms (activation functions) interact with low-dimensional features through gradient descent in scenarios like neural networks.
neural networks,non-linear transforms,Non-linear transforms (activation functions) interact with low-dimensional features through gradient descent in scenarios like neural networks.
neural networks,activation functions,Activation functions interact with low-dimensional features in the context of neural networks.
