node_1,node_2,edge
procedures,inferring α∗,Devising procedures for inferring α∗ based on observable variables or deriving theoretical upper bounds on α∗ are interesting directions for future work.
evaluation,α∗,Focus on empirical evaluation of α∗ in semi-synthetic experiments.
method,previous work,Detailed comparison between our method and previous work is provided in Appendix B.5 Experiments
ites,datasets,True ITEs are never observed in real-world datasets so conducting numerical experiments using synthetic and semi-synthetic datasets is common practice.
synthetic datasets,data-generation process,Consider a variant of the data-generation process in Section 3.6 in [1] for creating synthetic datasets.
µ1,ζ,"The function µ1(x) is modeled as ζ(x1) · ζ(x2), where ζ is defined as 1/(1 + exp(−12(x − 0.5)))"
µ0,ζ,"The function µ0(x) is modeled as γζ(x1) · ζ(x2), where γ ∈ [0, 1] is a parameter controlling the treatment effect, and ζ is defined as 1/(1 + exp(−12(x − 0.5)))"
ζ,γ,The parameter γ in the model controls the treatment effect where ζ is a function given by 1/(1 + exp(−12(x − 0.5)))
wcp,cm,"In the context, WCP stands for weighted CP and CM stands for conformal meta-learners"
pos,y,The POs are sampled from the distribution Y (w)
setup a,ζ = 1,Setup A refers to a situation where the treatment has no effect denoted by ζ = 1
setup b,ζ = 0,Setup B refers to a scenario where the treatment effects are heterogeneous denoted by ζ = 0
nlsm,ihdp,The National Study of Learning Mindsets (NLSM) dataset and the IHDP benchmark dataset are well-known semi-synthetic datasets involving real covariates and simulated outcomes
baseline models,predictive intervals,Baseline models are considered that provide valid predictive intervals for Individual Treatment Effects (ITEs)
state-of-the-art methods,weighted conformal prediction (wcp),State-of-the-art methods are based on weighted conformal prediction (WCP) proposed in [1].
wcp variants,naïve wcp,Three variants of WCP in [1]: (1) Naïve WCP which combines the PO intervals using Bonferroni correction.
wcp variants,exact nested wcp,Three variants of WCP in [1]: (2) Exact Nested WCP which applies WCP to plug-in estimates of ITEs in treatment and control groups followed by a secondary CP procedure.
wcp variants,inexact nested wcp,Three variants of WCP in [1]: (3) Inexact Nested WCP follows the same steps of the exact version but replaces the secondary CP with conditional quantile regression.
baseline models,gradient boosting,The same model (Gradient Boosting) is used for nuisance and pseudo-outcome modeling for all baselines.
baseline models,conformal quantile regression method,The conformal quantile regression method in [25] is used to construct predictive intervals for all baselines.
ipw- and dr-learners,fosd,IPW- and DR-learners demonstrate a robust Fraction of Strongly Discardables (FOSD) in the majority of experiments.
dr-learner,point estimation accuracy and interval efficiency,DR-learner exhibits superior point estimation accuracy and interval efficiency in most experiments compared to all other baselines.
conformal meta-learners,discrepancy between the cdfs,The effectiveness of conformal meta-learners depends on the discrepancy between the Cumulative Distribution Functions (CDFs).
conformal meta-learners,effectiveness,The effectiveness of conformal meta-learners is dependent on the discrepancy between the CDFs of conformity scores and oracle scores.
effectiveness,cdfs,The effectiveness of conformal meta-learners is related to the CDFs of conformity scores and oracle scores.
effectiveness,discrepancy,The effectiveness of conformal meta-learners depends on the discrepancy between the CDFs of conformity scores and oracle scores.
pseudo-outcome transformations,thicker tails,Pseudo-outcome transformations that induce thicker tails in conformity scores can cause conformal meta-learners to under-perform.
figure 4(a),empirical cdf,Figure 4(a) depicts the empirical CDF of the conformity scores Vφ and oracle scores V ∗ for the three meta-learners under study.
meta-learners,cdfs,The CDFs are averaged over 100 runs of Setups A and B of the synthetic generation process.
meta-learners,runs,The CDFs are averaged over 100 runs of Setups A and B of the synthetic generation process.
meta-learners,synthetic generation process,The CDFs are averaged over 100 runs of Setups A and B of the synthetic generation process.
coverage,naïve,"Coverage is represented as 0.89 (0.02), 0.99 (0.00), 0.61 (0.04) for Naïve."
coverage,inexactx,Coverage is represented as 0.65 (0.04) for InexactX.
coverage,ipw,Coverage is represented as 0.99 (0.00) for IPW.
coverage,dr,Coverage is represented as 0.96 (0.01) for DR.
ihdpavg. len.,baselines,IHDPAvg. len. corresponds to the performance of all baselines in semi-synthetic datasets.
rmse,baselines,RMSE values correspond to the performance of all baselines in semi-synthetic datasets.
nlsmavg. len.,baselines,NLSMAvg. len. corresponds to the performance of all baselines in semi-synthetic datasets.
figure 5,stochastic orders,Figure 5 depicts stochastic orders in IHDP/NLSM evaluated across all runs.
fosd,oracle scores,"FOSD (Vφ ⪰(1) V ∗) implies the weaker conditions of Vφ ⪯(2) V ∗ and Vφ ⪰mcx V ∗, demonstrating the stochastic dominance condition achieved in practice is stronger than the theoretical guarantee provided by oracle scores."
fosd,x-learner,"The conformity scores of the X-learner are dominated by oracle scores in the FOSD sense, as indicated by Theorem 2."
x-learner,stochastic order,Theorem 2 indicates that X-learners do not guarantee a distribution-free stochastic order.
ipw-learners,ite,"Empirical stochastic orders predict that IPW- and DR-learners will cover ITEs, while the X-learner will not achieve coverage."
ipw-learners,dr-learners,"IPW- and DR-learners satisfy a stronger FOSD condition, indicating their range of validity spans all levels of coverage."
ipw-learners,theorem 2,A stronger version of Theorem 2 outlining the conditions under which IPW- and DR-learners achieve FOSD could be possible.
predictive inference procedure,"coverage, efficiency, point estimation accuracy","The performance of a predictive inference procedure can be characterized in terms of three metrics: achieved coverage for true ITEs, expected efficiency, and point estimation accuracy."
procedure,metrics,"Procedure can be characterized in terms of three metrics: achieved coverage for true ITEs, expected length of predictive intervals, and root-mean-square error (RMSE) in CATE estimates."
metrics,achieved coverage,Metrics include achieved coverage for true ITEs.
metrics,expected length,Metrics include expected length of predictive intervals.
metrics,rmse,Metrics include root-mean-square error (RMSE) in CATE estimates.
dr-learner,metrics,"In most experiments, we find that the DR-learner strikes a balance between the three metrics."
dr-learner,valid wcp procedures,"In Figure 4(b), the DR-learner outperforms the valid WCP procedures in terms of RMSE and interval length."
dr-learner,x-learner,The DR-learner outperforms the X-learner in terms of RMSE and interval efficiency based on experiments.
inexact wcp baseline,performance trends,"The inexact WCP baseline's performance trends show competitive efficiency and calibration, but lack consistency in RMSE performance under different inductive biases."
meta-learners,poor performance,The semi-synthetic experiments on IHDP and NLSM datasets shed light on when meta-learners may perform poorly.
dr-learner,ihdp dataset,"The DR-learner outperforms all baselines on the IHDP dataset in terms of RMSE, interval efficiency, and achieves the desired coverage of 90%."
performance,conformity scores,Empirical performance depends on how closely the CDF of conformity scores matches the oracle CDF.
learner performance,conformity scores,learner performance deteriorates when conformity scores have 'very strong' dominance over oracle scores
conformity scores,oracle scores,"conformity scores have a closer lower bound on the oracle CDF, the DR-learner performance is competitive"
pseudo-outcome transformation,regression targets,"significant variability in regression targets induced by pseudo-outcome transformation will result in a lower CDF, poorer accuracy of pseudo-outcome regression, and longer predictive intervals"
dr-learner,ipw-learner,DR-learner consistently outperforms the IPW-learner as it provides a closer approximation of the oracle CDF
pseudo-outcome transformation,oracle score cdfs,future work could focus on analyzing the gap between pseudo-outcome and oracle score CDFs and designing pseudo-outcome transformations that optimize efficiency while preserving stochastic orders
treatment effects,causal effects,estimation and inference of treatment effects is challenging because causal effects are not directly observable
conformal meta-learners,machine learning model,"developed a general framework for inference of treatment effects, dubbed conformal meta-learners, that is compatible with any machine learning model"
conformal prediction,model-agnostic meta-learners,framework inherits the model- and distribution-free validity of conformal prediction as well as the estimation accuracy of model-agnostic meta-learners of treatment effects
theoretical framework,method,introduce a new theoretical framework based on stochastic ordering to assess the validity of our method
framework,stochastic ordering,The framework is based on stochastic ordering to assess the validity of our method.
framework,method,The framework guides the development of new models optimized for both accurate estimation and valid inference.
stochastic ordering,method,Stochastic ordering is used in the method to assess its validity.
