node_1,node_2,edge
mask,defect location,A mask is used to indicate the defect location in the context
anomalies,anomaly detection,The goal is to detect and localize anomalies in the context
object category,performance,Performance is measured by AUC computed per object category in the context
energy function,multi-modal data distribution,The energy function should reflect the multi-modal data distribution in the context
preprocessing protocol,image transformation,Each image is transformed using a pre-trained EfficientNet-b4 according to the preprocessing protocol in the context
spatial coordinate,energy value,Each spatial coordinate is treated independently for the energy value in the context
energy function,energy value,The energy function is used to evaluate the energy value of spatial features in the context
max pooling,anomaly detection,Max pooling is used for anomaly detection in the context
bilinear interpolation,anomaly localization,Bilinear interpolation is used for anomaly localization in the context
autoencoder architecture,energy function,An autoencoder architecture is employed for the energy function in the context
reconstruction error,energy,The reconstruction error of a sample is treated as its energy in the context
diffusion model,five-step time-conditioned mlps,The diffusion model and the value function are represented as five-step time-conditioned MLPs in the context
diffusion models,dxmi,"Unlike conventional diffusion models, DxMI allows for a flexible choice of π(x0) in the context"
initial distribution,sampler,The initial distribution for the sampler is set to the data distribution applied with noise in the context
anomaly classification,localization performance,DxMI demonstrates strong anomaly classification and localization performance in the context
dxmi,anomaly classification and localization performance,DxMI demonstrates strong anomaly classification and localization performance
dxmi,table 5,"DxMI demonstrates strong anomaly classification and localization performance, as shown in Table 5"
entropy maximization,τ = 0,"When entropy maximization is disabled by τ = 0, the diffusion model fails to explore and only exploits regions of minimum energy, resulting in poor performance"
moderate level of τ = 0.1,sampler and the energy function,"We observe that a moderate level of τ = 0.1 benefits both the sampler and the energy function, as it encourages exploration and provides a suitable level of diversity in negative samples"
generation steps in diffusion models,sample quality,Significant effort has been dedicated to reducing the number of generation steps in diffusion models during sampling while preserving sample quality
diffusion model,noise schedule,One popular approach is to keep the trained diffusion model unchanged and improve the sampling phase independently by tuning the noise schedule
neural network,short-run sampling,The sample quality can be further improved when the neural network is directly tuned for short-run sampling
distillation methods,faster diffusion sampler,"Distillation methods train a faster diffusion sampler using training signal from a longer-run diffusion model, showing strong performance"
distilled model,teacher model,"A distilled model usually cannot outperform the teacher model, but adversarial or IRL methods may exceed full-length"
adversarial methods,irl methods,Adversarial or IRL methods may exceed full-length diffusion models.
adversarial methods,hybrid methods,Hybrid methods combine distillation with adversarial loss.
adversarial methods,denoising step,Adversarial training is applied to each denoising step.
dxmi,sft-pg,DxMI and SFT-PG rely fully on adversarial training for final samples.
rl,diffusion model,RL is often employed to fine-tune diffusion models for a reward function.
reward signal,computer program,The source of the reward signal can be a computer program.
reward signal,human evaluator,The source of the reward signal can be a human evaluator.
dxmi,log data density,DxMI focuses on a setting where the estimated log data density is the reward.
rl,diffusion models,"When RL is applied to diffusion models, the policy gradient is the dominant choice."
dxmi,policy gradient,DxMI offers a value function-based approach as an alternative to the policy gradient.
entropy rl,diffusion models,Maximum entropy RL for diffusion models is investigated but only in the continuous-time setting.
dxdp,discrete-time setting,"DxDP investigates the discrete-time setting, which is more suitable for accelerating generation speed."
dxmi,diffusion model,DxMI provides a method of utilizing a diffusion model to eliminate the need for MCMC.
ebm training algorithms,mcmc,"Many existing EBM training algorithms rely on MCMC, which is computationally expensive and difficult to optimize for hyperparameters."
hyperparameters,optimization,Hyperparameters are expensive and difficult to optimize for.
ebm,generative model,Joint training of an EBM with a separate generative model is a widely employed strategy to avoid MCMC.
ebm,normalizing flow,EBMs can be trained jointly with a normalizing flow.
ebm,generator,EBMs can be trained jointly with a generator.
ebm,diffusion model,EBMs can be trained jointly with a diffusion model.
dxmi,prior works in ebm,DxMI shares the objective function with several prior works in EBM.
entropy-regularized irl,convergence guarantees,"The convergence guarantees of entropy-regularized IRL are provided in [91, 92] under certain assumptions."
entropy-regularized rl,diffusion models,More focused analysis on entropy regularized RL for diffusion models is provided.
maxent rl,entropy regularized rl,"Theoretical analyses have been conducted on MaxEnt RL under finite state and action spaces, which is relevant for the discrete version of entropy-regularized RL."
sequential decision making,generative modeling,"In this paper, we leverage techniques from sequential decision making to tackle challenges in generative modeling."
generative modeling,connection,Generative modeling reveals a significant connection between these two fields.
connection,algorithmic innovations,The connection between generative modeling and another field may spur a variety of algorithmic innovations.
connection,practical applications,The connection between generative modeling and another field may find numerous practical applications.
generative models,fairness issues,Generative models trained solely using DxMI may possess fairness issues.
models,harm,The models created during our experiments are not capable enough to cause realistic harm.
dxmi,hyperparameters,"Training multiple components simultaneously, DxMI introduces several hyperparameters."
dxmi,training,"DxMI is not directly applicable to training a single-step generator. However, a diffusion model fine-tuned by DxMI can be distilled to a single-step generator."
dxmi,flexibility,DxMI does not offer the flexibility of using a different value of generation steps T during the test time.
models,deep neural networks,Theoretical analysis that rationalizes the empirical results will be an important direction for future work related to models built on deep neural networks.
s. yoon,funding,S. Yoon is supported by a KIAS Individual Grant (AP095701) via the Center for AI and Natural Sciences at Korea Institute for Advanced Study and IITP/MSIT (RS-2023-00220628).
h. hwang,funding,H. Hwang and F. Park are supported in part by IITP-MSIT grant RS-2021-II212068 (SNU AI Innovation.
iitp-msit grant rs-2021-ii212068,snu ai innovation hub,Supported in part by the IITP-MSIT grant RS-2021-II212068 (SNU AI Innovation Hub)
iitp-msit grant 2022-220480,training and inference methods for goal oriented ai agents,Supported in part by the IITP-MSIT grant 2022-220480 (Training and Inference Methods for Goal Oriented AI Agents)
rs-2022-ii220480,training and inference methods for goal oriented ai agents,Supported in part by the RS-2022-II220480 (Training and Inference Methods for Goal Oriented AI Agents)
msit,"ministry of science, ict","Supported in part by the Ministry of Science, ICT (MSIT)"
global research support program in the digital field program(rs-2024-00436680),iitp,"Supervised by the Global Research Support Program in the Digital Field program(RS-2024-00436680), which is supervised by the IITP (Institute for Information & Communications Technology Planning & Evaluation)"
kiat grant p0020536,hrd program for industrial innovation,Partially supported by the KIAT grant P0020536 (HRD Program for Industrial Innovation)
srrc nrf grant rs-2023-00208052,snu-aiis,Supported in part by the SRRC NRF grant RS-2023-00208052 (SNU-AIIS)
snu-ipai,snu-iamd,Supported in part by SNU-IPAI and SNU-IAMD
snu bk21+ program in mechanical engineering,snu institute for engineering research,Supported in part by the SNU BK21+ Program in Mechanical Engineering and SNU Institute for Engineering Research
microsoft research asia,snu interdisciplinary program in artificial intelligence,Supported in part by Microsoft Research Asia and the SNU Interdisciplinary Program in Artificial Intelligence
national research foundation of korea (nrf),korea government (msit),Partially supported by the National Research Foundation of Korea funded by the Korea government (MSIT)
posco science fellowship,posco tj park foundation,Partially supported by the POSCO Science Fellowship of POSCO TJ Park Foundation
y.-k. noh,nrf/msit (no.rs-2024-00421203),Partly supported by Y.-K. Noh and NRF/MSIT (No.RS-2024-00421203)
y.-k. noh,iitp/msit (2020-0-01373),Partly supported by Y.-K. Noh and IITP/MSIT (2020-0-01373)
