node_1,node_2,edge
comparison frameworks,moon,"MOON is one of the frameworks compared in the Comparison Frameworks section, showing a comparison relationship between the two terms."
comparison frameworks,fedsr,"FedSR is one of the frameworks compared in the Comparison Frameworks section, indicating a comparison relationship between the two terms."
comparison frameworks,fpl,"FPL is one of the frameworks compared in the Comparison Frameworks section, showing a comparison relationship between the two terms."
comparison frameworks,feddrop,"FedDrop is one of the frameworks compared in the Comparison Frameworks section, indicating a comparison relationship between the two terms."
comparison frameworks,fedprox,"FedProx is one of the frameworks compared in the Comparison Frameworks section, showing a comparison relationship between the two terms."
comparison frameworks,fedmp,"FedMP is one of the frameworks compared in the Comparison Frameworks section, indicating a comparison relationship between the two terms."
fl frameworks,classical or focus on addressing system heterogeneity,FL frameworks can either be classical or focus on addressing system heterogeneity
fl frameworks,domain shifts issues,FL frameworks can focus on addressing domain shifts issues
fl frameworks,comparison frameworks,FL frameworks are compared with other frameworks in detail
hyper-parameters,global settings and local training hyper-parameters,Global settings and local training hyper-parameters of FL are set to identical values for fair evaluations
hyper-parameters,framework-specific hyper-parameters,Default settings of framework-specific hyper-parameters are used for fair evaluations
performance,global model,Performance of the global model is evaluated using the average Top-1 accuracy across all domains
resource consumption,clients,Resource consumption of clients is evaluated using total number of parameters and Floating-Point Operations (FLOPs) of the local model
model accuracy,digits and office caltech benchmarks,Detailed analysis of model accuracy is provided for Digits and Office Caltech benchmarks
model accuracy,digits benchmark,Model accuracy on the Digits benchmark is a key metric mentioned in the context.
model accuracy,office caltech benchmark,Model accuracy on the Office Caltech benchmark is a key metric mentioned in the context.
system heter.,system heterogeneity,System Heter. is an indicator mentioned in the context which shows whether the framework supports system heterogeneity.
dapperfl,runner-up,DapperFL achieves the highest global accuracy compared to the runner-up on both Digits and Office Caltech benchmarks.
global accuracy,model,DapperFL's global accuracy is reported and compared with other models in the context.
domain generalization,global model,The global model learned by DapperFL is mentioned to possess better domain generalization in the context.
dar module,encoder,The DAR module of DapperFL encourages the encoder to learn domain-invariant representations.
dapperfl,specific domain(s),DapperFL is unlikely to over-fit on specific domains and possesses better domain generalization ability.
heterogeneous clients,pruning ratio ρ,DapperFL tolerates heterogeneous clients through a personalized pruning ratio ρ for adaptive resource consumption reductions.
reductions,clients,"The reductions in resource consumption are provided for clients C2, C3, C4, and C5 showing the effectiveness of the MFP module of DapperFL."
reductions,comparison fl frameworks,The reductions in resource consumption are compared to other FL frameworks supporting heterogeneous clients.
mfp module,resource consumption,The MFP module of DapperFL reduces resource consumption for clients with domain shifts.
global and domain accuracies,learning curves,Learning curves for both global and domain accuracies are provided for a comprehensive analysis in Appendix C.
resource constraints,model footprints,"Resource constraints on clients result in limited model footprints, impacting model performance."
model footprints,model performance,The impact of model footprints on model performance is investigated by comparing DapperFL with other SOTA FL frameworks with adaptive pruning techniques.
pruning ratio,number of parameters and flops,The pruning ratio determines the reduction in the number of parameters and FLOPs in the model.
dapperfl,fedmp and nefl,DapperFL is compared to FedMP and NeFL in terms of model performance under different pruning ratios.
figure 3,comparative results,Figure 3 illustrates the comparative results of different frameworks under varying pruning ratios on Digits and Office Caltech.
dapperfl,accuracy,DapperFL consistently outperforms other frameworks in accuracy across all pruning ratios on Digits and Office Caltech benchmarks.
dapperfl,adaptability,DapperFL demonstrates superior adaptability in heterogeneous FL environments.
figure 3(b),accuracy at different pruning ratios,"The accuracy of DapperFL at ρ = 0.4 is higher than the accuracy at ρ = 0.2, as depicted in Figure 3(b)."
dapperfl,accuracy,"DapperFL's accuracy is shown to surpass its accuracy at different pruning rates, indicating the effectiveness of the pruning module."
dapperfl,resnet18,The over-parameterization of ResNet18 for the classification task in Office Caltech leads to a discrepancy in DapperFL's accuracy.
dapperfl,model generalization,"The MFP module of DapperFL effectively prunes unnecessary parameters while enhancing model generalization, contributing to its superiority over other frameworks."
dapperfl,comparison frameworks,DapperFL's superiority over comparison frameworks that employ full-size models is demonstrated through improved accuracy at higher pruning rates.
dapperfl,model performance,"The pruning ratio ρ of DapperFL significantly impacts its model performance, as evaluated in Appendix D."
dapperfl,mfp module,"The performance of DapperFL is evaluated with and without the MFP module, showcasing the effect of key modules on Digits and Office Caltech."
dapperfl,dar module,"The performance of DapperFL is evaluated with and without the DAR module, demonstrating the impact of key modules on model performance."
mfp module,dapperfl,The MFP module is employed in DapperFL for model pruning using ℓ1 norm on local models directly
mfp module,model pruning,The MFP module performs model pruning directly on local models in DapperFL
dapperfl,mfp module,Incorporating the MFP module into DapperFL results in a gradual improvement in accuracy
dar module,dapperfl,Incorporating the DAR module into DapperFL also leads to an improvement in accuracy
mfp,dar,MFP and DAR synergistically enhance model performance in DapperFL
office caltech,dapperfl,"The inclusion of both MFP and DAR modules in DapperFL results in a steady improvement in accuracy, particularly observed in Office Caltech benchmark"
mfp module,hyper-parameters,"The performance of DapperFL is influenced by hyper-parameters within the MFP module, such as α0, αmin, and ϵ"
dar,hyper-parameters,The performance of DapperFL is also influenced by hyper-parameters within the DAR module
office caltech benchmark,avg,"Both benchmarks have an average accuracy labeled as 'AVG', which represents the calculated average accuracy."
α0,model accuracy,The α0 parameter affects model accuracy by dictating the initial weight of the global model fused into the local model.
α0,fl process,"Infusing the local model with knowledge from other domains early in the FL process enhances generalization, with optimal α0 evident at 0.9."
αmin,model accuracy,The αmin parameter affects model accuracy by determining the minimum weight of the global model fused into the local model.
fl process,domain-specific knowledge,"As the FL process proceeds, the local model benefits from acquiring more domain-specific knowledge to maintain personalization."
ϵ,model accuracy,The ϵ parameter influences model accuracy by controlling the rate at which the fusion factor α0 diminishes towards αmin.
ϵ,fusion factor α0,The most effective rate of decrease for the fusion factor α0 towards αmin is achieved when ϵ = 0.2 in both benchmarks.
relationship,model accuracy,The abnormal trends in the relationship between model accuracy and hyper-parameter ϵ when it is less than 0.2 are recognized.
relationship,hyper-parameter,"Bayesian search is implemented as an automatic selection mechanism to find the optimal value of ϵ, recognizing the abnormal trends in the relationship between model accuracy and hyper-parameter ϵ when it is less than 0.2."
model accuracy,hyper-parameter,"There is a relationship between model accuracy and hyper-parameter ϵ, as indicated by the abnormal trends in their relationship when ϵ is less than 0.2."
configurations,gamma values,Figure 4(d) provides configurations with varying γ values across both Digits and Office Caltech.
gamma values,accuracy,"There is a relationship between γ values and accuracy, with an increase in accuracy observed with higher γ values until certain thresholds on Digits and Office Caltech."
gamma values,regularization factor,"The regularisation factor γ in the DAR Module plays a crucial role in solving the domain shift problem in FL, and a careful choice of γ can improve the model performance."
regularization factor,accuracy,"The impact of regularization on accuracy is more pronounced on Office Caltech, as seen by the significant drop in accuracy at γ = 0.1."
dapperfl,heterogeneous edge devices,Our proposed FL framework DapperFL is tailored for heterogeneous edge devices with the presence of domain shifts.
mfp module,dar module,DapperFL integrates a dedicated MFP module and a DAR module to achieve domain generalization adaptively in heterogeneous FL.
dar module,domain generalization,"The DAR module introduces a specialized regularization technique to implicitly encourage the pruned local models to learn robust local representations, thereby enhancing DapperFL’s overall performance, and achieve domain generalization adaptively in heterogeneous FL."
mfp module,system heterogeneity challenges,"The MFP module addresses system heterogeneity challenges by shrinking the footprint of local models through personalized pruning decisions determined by both local and remaining domain knowledge, effectively mitigating limitations associated with system heterogeneity."
local models,heterogeneous models,"We designed a specific aggregation algorithm for DapperFL to aggregate heterogeneous models produced by the MFP module, aiming to realize a robust global model across multiple domains."
dapperfl,sota fl frameworks,The evaluation of DapperFL’s implementation on a real-world FL platform demonstrated that it outperforms several SOTA FL frameworks on two benchmark datasets comprising various domains.
dapperfl,"hyper-parameters α0, αmin, ϵ, and γ","Despite its potential in addressing system heterogeneity and domain shifts, DapperFL introduces four hyper-parameters α0, αmin, ϵ, and γ associated with the DG performance of the global model. A potential future direction involves the automatic selection of these hyper-parameters, therefore enhancing the flexibility and accessibility of the DapperFL."
research,national natural science foundation of china,This research is supported part by the National Natural Science Foundation of China No. 92267104.
dr. xuyun zhang,arc decra,Dr. Xuyun Zhang is the recipient of an ARC DECRA funded by the Australian Government.
dr. xuyun zhang,australian government,Dr. Xuyun Zhang is the recipient of an ARC DECRA funded by the Australian Government.
k.-k. r. choo,cloud technology endowed professorship,The work of K.-K. R. Choo is supported only by the Cloud Technology Endowed Professorship.
