node_1,node_2,edge
federated learning,machine learning paradigm,Federated learning is described as a prominent machine learning paradigm in edge computing environments
federated learning,edge computing environments,Federated learning specifically focuses on edge computing environments
federated learning,global model,Federated learning enables edge devices to collaboratively optimize a global model
federated learning,private data,Federated learning allows edge devices to optimize a global model without sharing their private data
fl frameworks,efficacy deterioration,Existing FL frameworks suffer from efficacy deterioration due to system heterogeneity in edge computing environments
fl frameworks,domain shifts,Existing FL frameworks suffer from efficacy deterioration especially in the presence of domain shifts across local data
system heterogeneity,edge computing,System heterogeneity is inherent in edge computing environments
local models,dapperfl,DapperFL introduces a dedicated MFP module to produce personalized compact local models for clients
model fusion pruning (mfp) module,local models,The MFP module prunes local models with fused knowledge obtained from both local and remaining domains
dapperfl,domain adaptive regularization (dar) module,DapperFL includes a DAR module to further improve its overall performance
dar module,pruned model,The DAR module employs regularization generated by the pruned model to learn robust representations across domains
local models,aggregation algorithm,There is a specific aggregation algorithm for aggregating heterogeneous local models with tailored architectures and weights in DapperFL
dapperfl,heterogeneous clients,DapperFL is implemented on a real-world FL platform with heterogeneous clients
experimental results,benchmark datasets,Experimental results on benchmark datasets with multiple domains demonstrate that DapperFL outperforms several
dapperfl,fl frameworks,DapperFL outperforms several state-of-the-art FL frameworks by up to 2.28%
dapperfl,model volume reductions,DapperFL achieves model volume reductions ranging from 20% to 80%
dapperfl,code,The code for DapperFL is available at: https://github.com/jyzgh/DapperFL
fl,distributed machine learning paradigm,FL is an emerging distributed machine learning paradigm in edge computing environments
fl,participant devices,FL enables participant devices (clients) to optimize their local models
fl,central server,A central server aggregates local models into a global model in FL
fl,collaborative training,FL facilitates collaborative training of a global model by distributed clients
fl,privacy concerns,FL mitigates privacy concerns associated with data transmission
client,system heterogeneity,Participant clients in FL environments exhibit system heterogeneity
client,low-capability,Low-capability clients often fail due to system heterogeneity
client,system capabilities,Participant clients generally exhibit diverse and constrained system capabilities
client,cpu architecture,Participant clients have diverse CPU architectures
client,available memory,Participant clients have constrained available memory
client,battery status,Participant clients have varying battery statuses
heterogeneity,clients,"Different clients in Federated Learning (FL) exhibit heterogeneity in terms of resource constraints and data distributions, which impacts the overall performance of the global model."
client,training,"Low-capability clients may struggle to complete local training in FL, leading to performance issues in the aggregated global model."
heterogeneity,data distributions,"The distributed nature of FL leads to variations in data distributions among participant clients, causing domain shifts and affecting model aggregation."
domain shifts,data distributions,"Domain shifts occur in FL when participant clients collect data from diverse domains, leading to non-IID data distributions and biased global model aggregation."
resource constraints,model update,"Devices with stringent resource constraints may fail to complete model updates within the allowed time, resulting in exclusion from the FL process and missing out on valuable data features."
domain shifts,local models,"Devices collecting data from different domains may have diverse local models in FL, impacting the global model aggregation and potentially limiting the benefits for certain devices."
system heterogeneity,fl frameworks,"Existing FL frameworks aim to address system heterogeneity by compressing local models for heterogeneous clients, allowing the inclusion of low-capability clients in the FL process."
challenges,fl frameworks,"Various studies have focused on addressing challenges in FL, such as system heterogeneity and domain shifts, through the use of different FL frameworks."
fl process,clients,The FL process involves working with clients' data to create compressed model tailored for each individual client.
compressed models,clients,"Compressed models are created based on local data from clients, which can lead to over-fitting on their local domains."
compressed models,domain shifts,Compressed models are susceptible to over-fitting due to the presence of domain shifts in the data.
central server,global model,The central server struggles to aggregate a robust global model with strong Domain Generalization capabilities due to domain shifts in clients' data.
existing solutions,domain-invariant learning approaches,Existing solutions explore domain-invariant learning approaches to address the domain shifts challenge in Federated Learning.
existing solutions,resource consumption,"Existing solutions neglect the resource consumption of clients, making them unsuitable for direct application in heterogeneous Federated Learning."
fl,non-independent and identically distributed data,"The inherent nature of Federated Learning yields non-IID data across clients, which impedes learning a domain-invariant global model."
existing studies,dapperfl,"Existing studies inspired the proposal of DapperFL, an innovative Federated Learning framework designed to enhance model performance in heterogeneous environments."
dapperfl,model fusion pruning (mfp) module,DapperFL addresses system heterogeneity challenge through deployment of MFP module
model fusion pruning (mfp) module,local models,MFP module generates personalized compact local models for clients by pruning them with fused knowledge
model fusion pruning (mfp) module,global knowledge from the server,MFP module prunes local models with personalized footprints leveraging both domain knowledge from local data and global knowledge from the server
domain adaptive regularization (dar) module,pruned model,DAR module segments the pruned model into an encoder and a classifier
heterogeneous local models,aggregating heterogeneous local models,novel model aggregation approach tailored to aggregating heterogeneous local models with varying architectures and weights
mfp module,dar module,"The DAR module introduces a regularization term on the local objective to encourage clients to learn robust representations across various domains, thereby adaptively alleviating the domain shifts problem."
dar module,clients,"The DAR module introduces a regularization term on the local objective to encourage clients to learn robust representations across various domains, thereby adaptively alleviating the domain shifts problem."
dar module,robust representations,"The DAR module introduces a regularization term on the local objective to encourage clients to learn robust representations across various domains, thereby adaptively alleviating the domain shifts problem."
clients,learning,"The DAR module introduces a regularization term on the local objective to encourage clients to learn robust representations across various domains, thereby adaptively alleviating the domain shifts problem."
dar module,local models,"We implement the proposed framework on a real-world FL platform and evaluate its performance on two benchmark datasets with multiple domains. The results demonstrate that DapperFL outperforms several state-of-the-art frameworks by up to 2.28%, while achieving adaptive model volume reductions on heterogeneous clients."
local models,heterogeneous clients,"We implement the proposed framework on a real-world FL platform and evaluate its performance on two benchmark datasets with multiple domains. The results demonstrate that DapperFL outperforms several state-of-the-art frameworks by up to 2.28%, while achieving adaptive model volume reductions on heterogeneous clients."
heterogeneous fl,global model performance degradation,"In heterogeneous FL, diverse system capabilities and data distributions across clients often result in performance degradation of the global model."
system capabilities,data distributions,"In heterogeneous FL, diverse system capabilities and data distributions across clients often result in performance degradation of the global model."
model sparsification techniques,reducing volume of local models,"Studies in [10, 21, 22, 11, 23, 12] adopt model sparsification techniques to reduce the volume of local models, thereby involving low-capability clients in the FL process."
dedicated objective functions,specialized training steps,"The studies in [17, 24, 25] leverage dedicated objective functions and specialized training steps to address the data heterogeneity issue."
local model,parameters,The local model's parameters are selectively optimized or transmitted to reduce computational or communication resource consumption.
model,sub-models,"The model is split into several sub-models in studies [28, 29, 30]."
sub-models,server,"A subset of sub-models is offloaded to the server for updating in studies [28, 29, 30]."
heterogeneous fl frameworks,data heterogeneity,Heterogeneous FL frameworks assume data heterogeneity exclusively involves distribution shifts in the number of samples and/or labels.
domain generalization (dg),centralized machine learning paradigms,DG is originally proposed in centralized machine learning paradigms to address the problem of domain shifts.
centralized studies,entire dataset,Existing centralized studies assume access to the entire dataset during the model training process.
domain-invariant representations,unseen domains,Studies focus on learning domain-invariant representations that can be generalized to unseen domains.
model,multiple domains,Several studies train a generalizable model across multiple domains leveraging meta-learning or transfer learning techniques.
studies,characteristics of domains,"There are studies focusing on the characteristics of domains, enhancing the generality of the model by properly augmenting the style of domain or instance."
centralized machine,fundamental assumption,The fundamental assumption of centralized machine learning is unfortunately not elaborated further in the context provided.
centralized machine learning,fl (federated learning),FL is a concept that challenges the fundamental assumption of centralized machine learning as the dataset is distributed among clients in FL.
fl,clients,"Clients in FL are restricted from sharing their data, which contributes to the decentralized nature of FL."
dg approaches,fl,"Recent studies have explored DG approaches in FL through techniques like representation learning, prototype learning, and contrastive learning."
resource constraints,heterogeneous fl,Strict resource constraints in FL have led to limited effectiveness in addressing the inherent system heterogeneity feature of FL.
heterogeneous fl,distributed model pruning approach,The distributed model pruning approach aims to reduce resource consumption in heterogeneous FL through leveraging local domain knowledge and global knowledge.
dapperfl,model fusion pruning (mfp),"DapperFL consists of key modules like Model Fusion Pruning (MFP), which is designed to compress local models while addressing domain shift problems."
dapperfl,domain adaptive regularization (dar),"DapperFL also includes modules like Domain Adaptive Regularization (DAR), which employs regularization generated to enhance model performance across domains."
dar module,regularization,The DAR module employs regularization generated by the compressed model to further mitigate domain shift problems.
dar module,local updating,"During local updating, the DAR module segments the local model into an encoder and a classifier."
dar module,encoder,"The DAR module segments the local model into an encoder and a classifier, which are responsible for generating local representations."
dar module,classifier,"The DAR module segments the local model into an encoder and a classifier, which are responsible for performing predictions."
dar module,local objective li,"The local objective Li is then constructed by combing regularization LDAR, and the DAR module performs this task."
local updating,local model,"During local updating, the DAR module segments the local model into an encoder and a classifier, which are responsible for generating local representations and performing predictions, respectively."
local updating,updated local model,The client transmits the updated local model to the central server during local updating.
local model,central server,The client transmits the updated local model to the central server.
central server,local models,The central server recovers the structure of received local models and aggregates them through weighted averaging.
global model,local model,The global model W t−1 is fused into the fine-tuned local model to learn cross-domain knowledge.
mfp module,global model,MFP fuses the global model W t−1 into the fine-tuned local model to address system heterogeneity.
mfp module,local model,MFP calculates a binary mask matrix to generate the pruned local model.
local training,pruned models,"The process of local training is utilized to determine the pruned models, as one epoch of local training is found to be sufficient for efficiency."
local training,model performance,"Additional local epochs do not significantly enhance the model’s performance, supporting the use of a single epoch for efficiency."
local training,domain generalization,"In domain generalization-related FL research, one epoch of local training is employed to collect local domain information."
local training,neural architecture search,Pioneering research in model design and neural architecture search has shown the effectiveness of utilizing a few epochs for obtaining a coarse estimate of a sub-model.
pruned models,global model,"The initial backbone model is used as the global model in the communication round, where the pruned local models are fused with the global model."
approach,effective,The approach mentioned in the context is described as effective in quickly assessing model configurations without extensive computation.
mfp module,global model,The MFP module fuses the global model W t−1 into the local model ˆwt i to embed the cross-domain information into the local model.
global model,local model,The fusion operation is formulated as i = αtW t−1 + (1 − αt) ˆwt where αt is the fusion factor used to control the quality of the fused global model W t−1.
local data,client,"Considering that the local data on the client is typically limited, resulting in updating at the beginning of FL requiring more guidance from the global model by exploring the commonalities across different domains."
local model,fl process,"As the FL process proceeds, the local model is capable of learning more domain-dependent information from itself."
dynamic adjusting mechanism,fl training,"Thus, we design a dynamic adjusting mechanism to modify the αt during the FL training."
sensitivity factor,fl process,The decreased speed of αt is controlled by a sensitivity factor ϵ.
local model,knowledge,"To ensure the local model will consistently learn the knowledge from other domains, a minimum value αmin is assigned for αt."
dynamic adjusting mechanism,minimum value,"Formally, the dynamic adjusting mechanism for αt is described as αt = max{(1 − ϵ)t−1α0, αmin}."
mfp module,binary mask matrix,"Subsequently, the MFP module calculates a binary mask matrix M t i is derived through the channel-wise ℓ1 norm, which fused local model wt."
mfp module,binary mask matrix m ti,"The MFP module calculates a binary mask matrix M ti through the channel-wise ℓ1 norm, indicating the importance of parameters and the need for pruning."
pruning ratio ρi,binary mask matrix m ti,"The pruning ratio ρi determines the proportion of '0' in the binary mask matrix M ti, indicating which parameters need to be pruned."
dapperfl,structural pruning strategy (channel pruning),"The pruning strategy used in our DapperFL is structural pruning strategy (channel pruning), which is a hardware-friendly approach for pruning parameters."
dapperfl,pytorch,"DapperFL leverages PyTorch, a machine learning library, for implementing the pruning strategy, making it suitable for deployment on edge devices."
mfp module,local model wt i ⊙ m ti,"The MFP module prunes the local model wt i using the binary mask matrix M ti, resulting in a pruned model wt3.3."
fl,client i,"In FL, each client i possesses private local data, leading to domain shifts and the need for domain adaptive regularization."
client i,"local data di = {xi, yi}ni","Client i has private local data represented as Di = {xi, yi}Ni, where x denotes the input, y denotes the label, and Ni represents the local data sample size."
domain shifts,representation zi,"Due to domain shifts, the representation zi generated by the local encoder varies among different clients, leading to the domain shifts problem."
representation zi,local encoder,"The representation zi is generated by the local encoder, and it varies among different clients."
local predictor,prediction results,The local predictor's degraded prediction results are due to the varying representation zi generated by the local encoder among different clients.
dar module,performance of dapperfl,The DAR module is designed to enhance the performance of DapperFL across multiple domains.
dar module,compatibility with mfp module,The DAR module is designed to be compatible with the MFP module while enhancing the performance of DapperFL across multiple domains.
dar module,regularization term,The DAR module introduces a regularization term to alleviate the bias of representations zi on different clients.
local objective,regularization term ldar,The regularization term LDAR is introduced to the local objective to alleviate the bias of representations zi on different clients adaptively.
segment,pruned local model,"The pruned local model is segmented into two parts, an encoder and a predictor."
encoder,representation zi,The encoder is responsible for learning a representation zi given an input xi.
predictor,label ˆyi,The predictor is responsible for predicting label ˆyi given the representation zi.
regularization term ldar,local objective,The regularization term LDAR is constructed on the local objective.
squared ℓ2 norm,local representation,"The squared ℓ2 norm of the local representation encourages different local encoders to generate aligned robust representations adaptively, mitigating the impact of domain shifts."
ℓ2 norm,ℓ1 norm,"The ℓ2 norm encourages each element of the representation to converge to 0 but not equal to 0, retaining more information. Compared to ℓ1 norm, ℓ2 norm does not make smaller representation elements exactly equal to 0."
higher order regularization,ℓ2 norm,"Higher order regularization introduces significant computational overhead compared to ℓ2 norm, without significantly improving the regularization effectiveness."
cross-entropy loss,dar module,"The cross-entropy loss used in the DAR module is constructed as: yi,k log(ˆyi,k). Ki denotes the set of possible labels on the client i, ˆyi,k denotes predicting label, and yi,k denotes ground-truth label."
client i,training objective,The training objective of each client is calculated using a pre-defined coefficient γ controlling the importance of LDARiLi relative to LCEi.
mfp module,dar module,"Despite the MFP module and the DAR module being capable of alleviating domain shift issues, the heterogeneous local models generated by the MFP module cannot be aggregated directly."
mfp module,aggregation algorithms,The heterogeneous local models generated by the MFP module cannot be aggregated directly using popular aggregation algorithms.
dapperfl,fl aggregation algorithm,We propose a specific FL aggregation algorithm for DapperFL to effectively aggregate these heterogeneous local models.
central server,local models,"To preserve specific domain knowledge while transferring global knowledge to the local model, the central server first recovers the structure of local models before aggregating."
communication round,pruned local model,"Specifically, in each communication round t, the pruned local model is recovered..."
client i,global knowledge,while the second term wt−1 ⊙ Mi contains the global knowledge from all clients.
local knowledge,global knowledge,"By combining these two forms of knowledge, we aim to leverage both the specialized insights of local models and the generalized capabilities of the global model."
models,global model,The global model represents the generalized capabilities of the models mentioned in the context
models,dapperfl.i,DapperFL.i seems to be related to the models mentioned
models,local knowledge,Local knowledge is an aspect of the capabilities of the models
dapperfl.i,local knowledge,DapperFL.i includes local knowledge in its functionality
dapperfl.i,complements wti,The term 'complements wti' is related to DapperFL.i in some way
complements wti,m ti,There is a relation between 'complements wti' and 'M ti' in the context
m ti,m tt4,The terms 'M ti' and 'M tt4' are related to each other
encoder,predictor,"All layers except the final linear layer act as the encoder, while the last linear layer of the model acts as the predictor"
local knowledge,local model,Local knowledge refers to the feature extraction capabilities of the local model
local model,data,The local model is trained on specific data available in its local domain
global knowledge,global model,Global knowledge is extracted from diverse local models and used by the global model
global knowledge,local models,Global knowledge synthesizes knowledge from different local models
local model,local dataset,Local model uses local dataset for training
dapperfl,global model,Algorithm 2 DapperFL involves an initial global model and optimized global model
communication rounds,local era,Total number of communication rounds and local epochs are mentioned in the context
local epoch,communication round,The local epoch e and communication round t are key terms in the context related to the iteration process of the federated learning algorithm.
global model,local models,The global model Wt is updated by receiving the local models wt from all clients and aggregating them using Eq.7.
local models,aggregate,The local models are aggregated to form the global model Wt according to Eq.7.
global model,local dataset,The global model Wt is calculated by aggregating the recovered local models from each client i using a weighted mean formula.
global model,heterogeneous aggregation algorithm,"The aggregated global model retains knowledge from all clients due to the heterogeneous aggregation algorithm, enabling robust performance across different domains."
dapperfl,algorithm,The overall learning process of the proposed DapperFL algorithm is described in detail in Algorithm 2.
dapperfl,experimental setup,The experimental evaluation section provides insights into the setup and implementation details of DapperFL.
dapperfl,fedml,DapperFL is implemented on the real-world FL platform FedML using PyTorch as the deep learning tool.
client set,heterogeneous edge devices,The FL environment is built with a client set consisting of 10 heterogeneous edge devices for the federated learning process.
client set,central server,The client set C includes 10 heterogeneous edge devices and a central server used for coordinating the federated learning process.
heterogeneous edge devices,system capabilities,"The heterogeneous edge devices are categorized into 5 levels based on their system capabilities, with each level representing a different set of devices."
gpu server,nvidia rtx 3080ti gpus,The GPU server with 2 NVIDIA RTX 3080Ti GPUs is used for conducting experiments
experiments,fixed random seeds,Experiments are conducted three times with fixed random seeds for reproducibility
datasets,data partition,"The datasets DapperFL is evaluated on for domain generalization include Digits and Office Caltech, which are then partitioned for client distribution"
digits,four domains,"Digits benchmark consists of four domains: MNIST, USPS, SVHN, and SYN"
office caltech,four domains,"Office Caltech benchmark consists of four domains: Caltech, Amazon, Webcam, and DSLR"
benchmark,local data proportion,"For Digits, local data proportion is 1% while for Office Caltech, it is 20%"
resnet10,backbone models,ResNet10 is adopted as the backbone model for Digits in the evaluations
resnet18,backbone models,ResNet18 is adopted as the backbone model for Office Caltech in the evaluations
dapperfl,comparison frameworks,Both DapperFL and comparison frameworks train the models from scratch for a fair comparison
caltech,comparison frameworks,"Caltech is mentioned as one of the datasets in the Comparison Frameworks section, indicating a relationship between the two terms."
comparison frameworks,dapperfl,"DapperFL is compared with other frameworks in the Comparison Frameworks section, showing a comparison relationship between the two terms."
comparison frameworks,fedavg,"FedAvg is one of the frameworks compared in the Comparison Frameworks section, indicating a comparison relationship between the two terms."
