node_1,node_2,edge
smoothing technique,outliers,The smoothing technique struggles to fully mitigate the influence of outliers
rotation and permutation methods,outliers,Rotation and permutation methods are highly effective against both types of outliers
normal outliers,massive outliers,Table 7 shows the impact of Normal and Massive outliers on quantization
gpt-4,mt-bench,Figure 3 shows the evaluation of GPT-4 on the MT-Bench
duquant,quarot,Comparison between DuQuant and QuaRot highlights key differences
quarot,duquant,DuQuant's rotation matrix outperforms QuaRot's approach by utilizing prior knowledge to accurately target outliers.
quarot,gptq,QuaRot employs GPTQ for weight quantization method as per Table 8.
duquant,rtn quantization,"DuQuant attains competitive results using RTN quantization, which proves the effectiveness of zigzag permutation to enhance capacity."
duquant,permutation frequency,"Ablations on rotation and permutation frequencies in DuQuant show that ""Perm 1"" achieves stronger performance compared to ""Perm 0"" and incurs additional computational cost."
speedup,performance,"The approximately 2× speedup and the impressive performance are mentioned together, indicating a positive relationship between them in terms of system optimization."
additional costs,acceptable,"The additional costs are deemed acceptable in the context, suggesting a trade-off relationship between cost and acceptability."
permutations,performance,"Further permutations like 'Perm 2' do not improve performance, implying a negative relationship between permutations and performance improvement."
perm 1,balance,"'Perm 1' strikes the best balance between perplexity and inference speed, indicating a harmonious relationship in system configuration."
duquant,optimal configuration,"'Perm 1' is defined as the optimal configuration for DuQuant, suggesting a strong association between the two terms."
inference speedup,measured,"To assess the inference speedup delivered by DuQuant, a measurement strategy from [2] is adopted, indicating a relationship between speedup and measurement."
decoding stage,high throughput,"Batching the token generation phase in the decoding stage yields high throughput without any downside, showcasing a positive relationship between decoding and throughput."
memory consumption,peak memory usage,"The peak memory usage of DuQuant is measured with the W4A4 kernel, highlighting a direct relationship between memory consumption and peak memory usage."
memory consumption,duquant,DuQuant achieves up to 3.2× memory reduction in the pre-filling stage while maintaining strong memory efficiency in the decoding stage.
duquant,smoothquant,DuQuant outperforms SmoothQuant in terms of memory reduction and decoding efficiency.
duquant,qllm,DuQuant performs better than QLLM in terms of memory efficiency and performance.
duquant,llama2-7b,"DuQuant stands out for its efficiency on LLaMA2-7B, surpassing other baselines."
duquant,gptq,DuQuant does not rely on GPTQ for its quantization process.
duquant,gradient-based training,DuQuant does not rely on gradient-based training for its quantization process.
duquant,outliers,DuQuant manages outliers efficiently in its quantization process.
duquant,omni,"DuQuant's quantization process is efficient, as shown in Table F24 and its performance on one NVIDIA A100."
duquant,quantization strategy,DuQuant is an innovative quantization strategy for large language models (LLMs) that addresses the challenge of outlier activations by integrating rotation and permutation transformations.
duquant,outlier activations,"DuQuant strategically redistributes outliers, effectively mitigating the impacts of both massive and normal outliers."
duquant,quantization process,"DuQuant simplifies the quantization process by strategically redistributing outliers, leading to substantial improvements in model performance."
duquant,state-of-the-art results,DuQuant establishes new state-of-the-art results in 4-bit weight-activation quantization scenarios.
duquant,efficient llms,DuQuant enhances the deployment of efficient LLMs in resource-constrained environments.
duquant,national natural science foundation of china,This work is supported in part by the National Natural Science Foundation of China.
duquant,research grants council of the hong kong sar,This work is supported in part by the Research Grants Council of the Hong Kong SAR.
duquant,innohk initiative,This work is supported in part by the InnoHK initiative.
duquant,laboratory for ai-powered financial technologies,This work is supported in part by the Laboratory for AI-Powered Financial Technologies.
