node_1,node_2,edge
deep learning,stochastic gradient descent,deep learning relies on Stochastic Gradient Descent for training improvement
stochastic gradient descent,performance,SGD impacts the performance and stability of artificial neural networks
second order information,loss landscape,second order information relates to the curvature of the loss landscape
chaotic dynamics,optimization,chaotic dynamics are studied in the context of optimization in neural network training
curvature of the loss landscape,chaotic dynamics,there is a theoretical connection between loss landscape curvature and chaotic dynamics
modified sgd,non-chaotic training dynamics,a modified SGD is proposed to ensure non-chaotic training
negative eigenspectrum,local chaos,the negative eigenspectrum is connected to directions of local chaos in SGD
long-term chaos dynamics,convergence,long-term chaos dynamics challenge the understanding of convergence in parameter space
initial training phase,chaotic network behavior,chaotic behavior is mostly confined to the initial training phase
models perturbed upon initialization,divergence,perturbed models can diverge even after achieving top training performance
random walk,linear divergence,divergence of perturbed models can be modeled through a combination of random walk and linear divergence
deep learning,stochastic gradient descent (sgd),Deep Learning has led to the use of SGD as the primary optimization method.
sgd,descendants (duchi et al.,2011; kingma and ba
second order dynamics,artificial neural network (ann) training,Both second order dynamics and chaotic dynamics of ANNs are difficult to investigate.
ann training,chaotic dynamics,ANN training is known for its chaotic behavior.
experiments,small-sized models,Experiments were conducted on small models to study training dynamics.
experiments,natural datasets,These experiments used natural datasets for training.
modified sgd algorithm,non-chaotic training dynamics,A modified SGD algorithm is proposed to ensure non-chaotic training.
modified sgd algorithm,non-chaotic training dynamics,ensures non-chaotic dynamics in the training of ANNs
negative curvature,local chaos,negative curvature is associated with local chaos in ANN training
network dynamics,exponential divergence,network dynamics initially diverge exponentially during training
exponential divergence,polynomial behavior,eventually transitions to polynomial behavior as model performance converges
model training,convergence,model training converges over time
similarly initialized models,distance growth,even after convergence
distance growth,linear divergence,growing distance can be modeled as a combination of linear divergence and random walk
chaos,dynamical system,chaos characterizes certain dynamical systems
sensitive to initial conditions,chaotic system,sensitivity to initial conditions is a key feature of chaotic systems in model optimization
model optimization,parameter state,model's sensitivity to changes in its parameter state during optimization
chaotic,sensitivity to initial conditions,chaotic refers to how sensitive a model is to slight variations in its starting conditions
lyapunov exponents,characterization of chaos,Lyapunov exponents are used to analyze the chaotic behavior of a system
dynamical system,system state,a dynamical system involves the evolution of a system state over time
dynamics function,system evolves over time,the dynamics function defines how a system evolves through time
tangent map,displacement vector,the tangent map describes the evolution of displacement vectors over time
jacobian,dynamics function,the Jacobian is the derivative of the dynamics function with respect to the state
lyapunov exponents,eigenvalues (lyapunov spectrum),Lyapunov exponents are the eigenvalues of the Jacobian matrix in the context of dynamic systems
perturbation,initial perturbation,perturbation refers to an initial disturbance
eigenpair,direction,an eigenpair determines the behavior along a specific direction in the context of the neural network's dynamics.
training process,time step,the training process of a neural network progresses through discrete time steps.
sgd,learning rate,Stochastic Gradient Descent (SGD) is a training algorithm that involves a learning rate parameter.
sgd,data batches,SGD uses data batches at each time step to update the model.
tangent map,evolution,the tangent map describes the evolution of the neural network's parameters.
momentum,sgd,momentum is a variant of SGD that incorporates past gradients into the update.
hessian,curvature,the Hessian matrix represents the curvature of the loss landscape in neural network optimization.
chaotic dynamics,hessian,chaotic behavior in the training depends on the Hessian's properties.
second-order curvature information,training performance,using curvature information can potentially improve the efficiency of SGD.
negative hessian eigenvalue spectrum,local chaos,a negative Hessian eigenvalue spectrum can lead to chaotic behavior locally in the training.
chaos,neural network training,chaos is considered detrimental/beneficial for the training of neural networks
lyapunov matrix,chaotic evolution,the Lyapunov matrix indicates chaotic behavior of the system after training
greedy approach,finite-time lyapunov matrix,a greedy approach uses the finite-time Lyapunov matrix to assess chaos at each time step
local lyapunov exponents (lle),time step t,LLEs represent local chaos at a specific time step t during training
hessian,local chaotic dynamics,the eigenspectrum of the Hessian relates to local chaotic dynamics in neural network training
stochastic gradient descent (sgd),learning rate,training uses SGD with a specific learning rate
eigenpairs,hessian's eigenpairs,eigenpairs refer to the eigenvalues and eigenvectors of the Hessian
negative eigenvalue,locally chaotic training behavior,if an eigenvalue is negative
positive eigenvalues,locally chaotic training behaviour,Sufficiently large positive eigenvalues in SGD imply locally chaotic training.
negative eigenvalues,locally chaotic training behaviour,Negative eigenvalues automatically lead to locally chaotic training behaviour.
lles (locally linear embeddings),eigenpairs,LLEs consist of eigenpairs (λ_i
chaotic eigenpairs,projection,Chaotic directions in parameter updates can be removed via projection onto non-chaotic eigenvectors.
neural network,hessian h (t),A neural network has a Hessian H (t) associated with it.
eigenpairs,(λ(t),v(t))
chaotic components,projection,Projection removes chaotic components from gradient updates.
sgd (stochastic gradient descent),modified update vector,SGD undergoes a modification to its update vector through projection.
v (t),non-locally-chaotic eigenvectors,V (t) represents the matrix of non-locally-chaotic eigenvectors.
training dynamics,exponentially diverging orbits,For small parameter variations
previous work,lyapunov eigenspectrum calculation,Previous work analyzed the Lyapunov eigenspectrum
chaotic dynamics,small networks,chaotic dynamics has mostly been studied in small networks
chaotic dynamics,largest mlce,largest maximum Lyapunov exponent (mLCE) has been investigated
feedforward anns,sensitivity,feedforward ANNs' focus is on output sensitivity to inputs
rnns,lyapunov exponents,Vogt et al. (2020) calculated Lyapunov exponents in RNNs
better generalization,lower validation loss,better generalization is correlated with lower validation loss
sasdelli et al. (2021),ann training by sgd,Sasdelli et al. investigated chaos dynamics in SGD-trained ANNs
time-continuous dynamical system,time-discrete dynamical system,Sasdelli et al. modeled ANN training as time-continuous
biggest lyapunov exponent,most negative eigenpair of network hessian,theoretical work connects the biggest exponent to the negative eigenpair
positive eigenpairs,chaos,positive eigenpairs indicate chaos
chaotic evolution,negative curvature,directions of chaotic evolution and negative curvature are related
chaotic evolution,negative curvature,Both affect the training process in artificial neural networks.
artificial neural networks (anns),hessian,The eigenvalue spectra of ANNs' Hessians are studied in the context.
sagun et al. (2017),small 784-2-10 mlp,They analyzed the eigenvalue spectrum of a specific MLP for MNIST classification.
eigenvalues,two-phase distribution,Eigenvalues in ANNs' Hessians exhibit a two-phase distribution with a bulk around zero.
negative eigenvalues,improvement of the loss,Negative eigenvalues
alain et al. (2019),optimization algorithms,They found current algorithms are not efficient in optimizing negative curvature directions.
gur-ari et al. (2018),gradient of the hessian,They discovered the gradient mostly lies in the space of top eigenvectors
time-discrete modelling,sgd (stochastic gradient descent),This is used to derive predictions on how curvature impacts chaotic dynamics in training.
curvature,chaotic dynamics,The study explores the effect of curvature on the dynamics of training with SGD.
sgd,predictions,SGD is used to derive predictions about chaotic dynamics.
curvature,chaotic dynamics,Curvature affects the chaotic dynamics in training.
hessian spectrum,training step,The full Hessian spectrum is considered at every training step.
chaotic training dynamics,training performance,A novel connection exists between chaotic dynamics and training performance.
negative eigenvalues,training steps,Negative eigenvalues are present in all training steps.
mlp,feedforward anns,MLP for MNIST is a model for Feedforward ANNs.
positive lles,training steps,Positive LLEs can be expected at every training step in ANNs.
positive top eigenvalues,chaotic behavior,Positive top eigenvalues determine chaotic behavior under certain conditions.
negative eigenspectrum,training performance,The effect of the negative eigenspectrum on training performance needs verification.
python,pytorch framework,Experiments' code is written in Python using the Pytorch framework.
o2grad,pytorch,O2Grad is a package built on top of Pytorch for faster Hessian calculation.
usps,fashionmnist,Both USPS and FashionMNIST are used as datasets for the study.
16x16 pixels,usps,Images from USPS are subsampled to 16x16 pixels.
16x16 pixels,fashionmnist,Images from FashionMNIST are also subsampled to 16x16 pixels.
784-20-10 mlp,small 2d cnn,Both models
sgd,cgd (chaos-sensitive gradient descent),CGD is an altered version of the Pytorch implementation of SGD.
amd ryzen threadripper 1950x processor,nvidia geforce rtx 2080 ti gpus,These components form part of the first system's hardware configuration.
intel(r) core(tm) i5-8600k,nvidia geforce gtx 1080 ti,These components form part of the second system's hardware configuration.
cgd,chaotic direction pruning,CGD is modified to filter different components
training performance,chaotic direction pruning,The impact of chaotic direction pruning on training performance is investigated.
cgd,training performance,CGD (Consensus Gradient Descent) affects the training performance of models.
chaotic eigenpairs,filter,CGD is equipped to filter chaotic eigenpairs during training.
negative eigenpairs,filter,CGD can also filter only negative eigenpairs.
positive eigenpairs,filter,CGD has the ability to filter only positive eigenpairs as well.
k largest eigenpairs,absolute value,CGD can filter the k largest eigenpairs by absolute value.
k random eigenpairs,prune,CGD can also randomly prune k eigenpairs.
models,sgd,Models trained without pruning use regular SGD.
training accuracies,training losses,Training accuracies and losses are discussed in relation to model performance.
validation losses,validation accuracies,Validation losses and accuracies exhibit similar phenomena as training ones.
locally chaotic training behavior,ann training,Locally chaotic training behavior is essential for the training of ANNs.
reasonable training performance,generalization,Chaotic behavior contributes to achieving reasonable training performance and generalization in ANNs.
mlp,usps dataset,An MLP (Multi-Layer Perceptron) is trained on the USPS dataset.
2d cnn,fashionmnist,The same phenomenon is observed for a 2D Convolutional Neural Network and the FashionMNIST dataset.
positive spectrum,training performance,positive spectrum has a small effect on training performance
negative pruning,network's ability to learn,negative pruning strongly limits the network's ability to learn
chaotic pruning,network's ability to learn,chaotic pruning strongly limits the network's ability to learn
mlp,usps dataset,MLP is trained on the USPS dataset
sigmoid activation,convergence,sigmoid activation slows down convergence
cgd,pruning,CGD uses pruning of the full chaotic Hessian spectrum
local averaging,accuracy and loss curves,local averaging (window size 50) smooths the accuracy and loss curves
pruning,onset of pruning,pruning starts after the onset of pruning (2k
sgd,locally chaotic directions,SGD relies on locally chaotic directions for training
negative hessian eigenspectrum,training by sgd,negative Hessian eigenspectrum drives training by SGD
chaotic eigenvalues,hessian,chaotic eigenvalues are part of the Hessian matrix
training,neural networks,training refers to the process for neural networks
negative eigenpairs,hessian,negative eigenpairs belong to the Hessian
pruning,negative eigenvalues,pruning involves removing negative eigenvalues of the Hessian
alain et al. (2019),previous belief,Alain et al.'s work is mentioned in the context of previous beliefs about the Hessian
negative eigenspectrum,training dynamics,the negative eigenspectrum affects the training dynamics of neural networks
positive eigenspectrum,hessian,the positive eigenspectrum is another part of the Hessian
pruning,positive eigenspectrum,pruning can also be applied to the positive eigenspectrum
models,sgd,models are trained using Stochastic Gradient Descent (SGD)
negative pruning,models,models trained with pruning of the negative eigenspectrum have lower performance
positive pruning,training performance,positive pruning has a smaller impact on the training performance
anns,positive pruning,Artificial Neural Networks (ANNs) trained with positive pruning fare better
datasets,training,different datasets are used for evaluating the training performance
negative pruning,counterparts,comparing optimization methods
negative eigenvalue spectrum,hessian,contains important information about optimization problem
positive eigenvalue spectrum,hessian,contains less important information about optimization
negative eigenspectrum,locally chaotic training dynamics,induces chaotic dynamics in SGD
sgd,training performance,impact on training performance
gur-ari et al. (2018),positive eigenpairs of the hessian,observe gradient overlap
negative curvature,future loss improvement,indicates potential for improvement
positive curvature,local minimum,indicates proximity to a local minimum
negative components of the hessian,gradient,eliminates possibilities for big future improvements
hessian,gradient,The negative components of the Hessian are derived from the gradient.
negative eigenspectrum,loss,Pruning the negative eigenspectrum affects the rate of loss decrease.
training,negative/positive hessian eigenvalues,The count of negative/positive eigenvalues changes during training.
gradient overlap,axes of positive/negative curvature,Gradient overlap is greater with axes of positive curvature
initial discovery phase,negative curvature,Negative curvature is important in the initial phase of learning.
subsequent exploitation phase,positive curvature,Positive curvature becomes significant in the later phase of learning.
global chaos investigation,finite-time lyapunov exponents,Global chaos is investigated using finite-time Lyapunov exponents for longer timespans.
tangent maps,equation (8),Tangent maps are calculated based on equation (8) at each time step.
finite-time lyapunov matrix,eigenvalue decomposition,Eigenvalue decomposition is applied to the finite-time Lyapunov matrix to find the eigenspectrum.
lyapunov exponents,training,Lyapunov exponents are initially above 0 at the start of training.
lyapunov eigenspectrum,lyapunov exponents,The Lyapunov exponents are part of the Lyapunov eigenspectrum and relate to the convergence during training.
training,convergence,Training of the models leads to convergence of the Lyapunov exponents towards 0.
chaotic,edge-chaotic,The evolution is described as initially chaotic and edge-chaotic in the time limits.
models,initializations,Models with similar initializations continue diverging even after reaching top performance.
perturbation analysis,lyapunov eigenspace,Perturbation analysis explores divergence behavior using the Lyapunov eigenspace.
model a,models b1,...
lyapunov eigenpairs,perturbation axes,Lyapunov eigenpairs determine the perturbation axes for models B1
perturbation strategies,(1) top eigenvector,(2) bottom eigenvector
linear combination,vectors,linear combination is formed using vectors sampled from chaotic and non-chaotic directions.
vchaotic(n ),random chaotic directions,Vchaotic(N ) describes random chaotic directions.
vnon-chaotic(n ),random non-chaotic directions,Vnon-chaotic(N ) represents random non-chaotic directions.
initial parameters,perturbed,Initial parameters are altered along specific directions.
perturbation magnitudes,locality,Perturbation magnitudes must align with the locality required by theoretical preliminaries.
loss landscape,local minimum,The loss landscape near a local minimum is almost flat.
finite-time lyapunov matrix,time point t = tconv,The finite-time Lyapunov matrix is used at a converged time point t = Tconv.
tangent map y (t),eigenspace,The tangent map's eigenspace remains stable after a certain time step.
hessian eigenspectrum,full convergence,The Hessian eigenspectrum does not fully converge to zero.
chaotic eigenvectors,non-chaotic eigenvectors,Both chaotic and non-chaotic eigenvectors stabilize during training.
distance evolution,mlp without momentum,Distance evolution is shown for an MLP without momentum on USPS dataset.
fashionmnist,model architectures,FashionMNIST is compared with different model architectures for analysis.
momentum,analysis,Momentum is a subject of analysis in the context of model architectures.
maximal divergence,expected distance,The maximal divergence is discussed in the range of expected distance for models.
pytorch,lecun et al.,2012
distances,performance,Distances don't saturate during experiments
perturbations,drop in performance,Significant drop in performance is noticed with certain perturbation magnitudes.
distance evolution,linear divergence,Observed distance evolution can be explained by linear divergence and a random walk.
gradients,distance components,Gradients have distance components contributing to the evolution.
noise components,random walk,Noise components are associated with the random walk behavior in the gradients' evolution.
time (t),linear divergence,For larger time
term,t,term 't' is referred to as a variable in the context of mathematical expression.
↵t2,linear divergence,The ↵t2 term is associated with linear divergence in the context of time evolution.
perturbation,initial perturbations,Perturbations refer to initial changes applied to a model
mlp,sgd (stochastic gradient descent),MLP (Multi-Layer Perceptron) is trained using SGD without momentum in the described scenario.
usps,fashionmnist,Both USPS and FashionMNIST are datasets used for evaluating model divergence in the study.
euclidean distance,model divergence,Euclidean distance is used as a measure of the divergence between two models.
bounded loss valley,unbounded loss valley,These terms describe different scenarios regarding the limits of model divergence; a bounded one restricts divergence while an unbounded one allows for unlimited divergence.
lyapunov eigenspace,perturbation directions,The Lyapunov eigenspace guides the computation of initial perturbation directions for the models.
lce (lyapunov characteristic exponent),theoretical bounds,LCE is used to calculate maximum/minimum values (λ1(t)/λN(t)) which serve as theoretical bounds for the observed divergence.
analysis,further studies,required for deeper understanding
training dynamics,chaotic to edge-chaotic,evolution in parameter domain
anns,unchaotic to chaotic,transition in input domain
perturbation length,0.1,chosen value for experiments
smaller perturbation lengths,random behavior,caused by noise or numerical error
theoretical bounds,maximal and minimal lce,derived from equation (5)
upper bound,measure of maximal divergence,indicates single training run divergence
lyapunov-vector-product,hessian-vector-product,realization for computational efficiency
lyapunov-vector-product,hessian-vector-product,Lyapunov-vector-product can be realized through Hessian-vector-product.
faster algorithms,hessian-vector-product,Faster algorithms exist for Hessian-vector-product
pruning experiments,common datasets,Pruning experiments were performed on common datasets and model architectures.
high-dimensional datasets,models,Experiments are challenging to extend to higher-dimensional datasets and models due to computational expenses.
batchnorm,skip connections,BatchNorm and skip connections were not studied in this work
computational cost,training time,High computational cost limits the training time used in the analysis.
perturbed network divergence,model,The model for perturbed network divergence was analyzed.
edge-chaotic dynamics,overfitting,A connection between edge-chaotic dynamics during training and overfitting could be investigated.
chaotic dynamics,negative curvature,Chaotic dynamics of ANNs trained by SGD are linked to negative curvature.
negative curvature information,training,Negative curvature information is essential for training ANNs.
chaotic behavior,sgd training,Chaotic behavior is inherent to training via Stochastic Gradient Descent (SGD).
chaotic behaviour,training by sgd,chaotic behaviour is inherent to training performed using Stochastic Gradient Descent (SGD)
globally chaotic dynamics,beginning of the training,globally chaotic dynamics are mostly observed at the start of the training process
models with slightly different initializations,linear divergence in parameter space,models initialized differently continue to diverge linearly in parameter space during training
chaos in ann training,advancing understanding,work aims to provide a foundation for further studies to understand chaos in Artificial Neural Network (ANN) training
divergence of trajectories,end of the training,investigating the divergence of training paths at the conclusion of the process is suggested
chaos in the input,chaos in the parameter domain,relation between chaos present in input data and parameters is recommended for exploration
julius upmeier zu belzen,roland eils,both individuals are from the Berlin Institute of Health and supported the main author
leon sixt,biorobotics lab,Leon Sixt is associated with the Biorobotics Lab and provided advice
martin aleksandrov,dahlem center for machine learning and robotics,Martin Aleksandrov is from the Dahlem Center and offered guidance
maximilian granz,elsa-neumann-scholarship,Maximilian Granz was supported by the Elsa-Neumann-Scholarship from the state of Berlin
nvidia,titan xp gpu,Nvidia provided a Titan Xp graphics processing unit for the research
zedat,hpc system,ZEDAT granted access to their High-Performance Computing system
anonymous reviewers,paper review,reviewers provided feedback on the paper anonymously
hpc system,reviewers,The HPC system is the subject of review by anonymous reviewers.
reviewers,paper,The reviewers are reviewing the authors' paper.
reviewers,interesting points of discussion,The reviewers provided interesting points to discuss in relation to the paper.
