node_1,node_2,edge
node injections x,statistics,Some knowledge of the statistics of the node injections X is required.
`1-regularized estimator,glasso based estimators,`1-regularized estimator outperforms methods that use GLASSO based estimators.
chain graph,grid graph,Both are types of network structures compared in the experiment
grid graph,ieee 33 bus network,Network structures used for comparison in different scenarios of the experiment
`1 regularized mle,glasso+sr,Methods compared in the performance analysis for chain and grid graphs
`1 regularized mle,glasso+2hr,Additional comparison made specifically for the IEEE 33 bus network scenario
actual injected flows (x),not required,The learning setup does not necessitate knowledge of actual injected flows
b⇤,not a laplacian matrix,The condition illustrates the generality of the learning problem
n > p,not required,This condition not being mandatory enables the learning problem to apply to diverse domains
electrical networks,social networks,Examples illustrating the broad range of domains where the learning problem can be applied
assumptions [a1-a2],future direction,Verifying these assumptions in practical settings is identified as a promising area for further research
proposed algorithm/estimator,verification of assumptions [a1-a2],Not necessary for running the algorithm but crucial for theoretically ensuring estimator properties as per Theorem 1 and Theorem 2
objective function,minimization of bregman divergence,Suggested extension for more general loss functions in the objective function
bregman divergence,general loss functions,Bregman divergence is applied for more general loss functions indicating a application or extension relationship.
network matrix b⇤,generalize (2),The text suggests a future work direction to generalize equation (2) to include non-invertible network matrix B⇤
