node_1,node_2,edge
recall retriever model,recall rate,"The effectiveness of adjusting the training distribution depends on the presence of a high recall retriever model, typically requiring a recall rate of more than 10%."
training samples,generalization performance,It is crucial to ensure that there are enough training samples to maintain the generalization performance of the model.
two-stage recommender systems,generalization error bounds,The study provides an investigation into the generalization error bounds of two-stage recommender systems.
tree-based retriever models,theoretical and empirical investigation,The study emphasizes tree-based retriever models in the theoretical and empirical investigation conducted.
two-stage recommender systems,tree-based retriever models,The study emphasizes the bounds of two-stage recommender systems with a focus on tree-based retriever models.
rademacher complexity,generalization capabilities,Rademacher complexity is used to analyze the generalization capabilities of various models in two-stage recommender systems.
tree models,branches,The study highlights how increasing the number of branches in tree models can affect generalization performance.
ranker models,shifted distributions,Ranker models trained on shifted distributions can have an impact on generalization performance.
branches,generalization capabilities,Theoretical results indicate that increasing the number of branches in a tree model leads to enhanced generalization capabilities.
high recall retriever model,harmonized distributions,Using harmonized distributions to train the ranker model in the presence of a high recall retriever model can improve performance.
experimental validation,real-world datasets,The study includes experimental validation on real-world datasets using advanced models for both retriever and ranker stages.
two-stage models,generalization,The study contributes to the understanding of generalization in tree-based two-stage models.
theoretical foundation,designing effective models,The study provides a theoretical foundation for designing more effective models in two-stage recommender systems.
national key r&d program of china,national natural science foundation of china,The work was supported by grants from the National Key R&D Program of China and the National Natural Science Foundation of China.
