node_1,node_2,edge
foundation models,large language models (llms),"Foundation models are discussed as valuable tools in medicine, while the context mentions leveraging LLMs in complex medical tasks."
medical decision-making agents (mdagents),llms,MDAgents are introduced as a framework to address the gap in leveraging LLMs in medical tasks by automatically assigning a collaboration structure to a team of LLMs.
medical decision-making agents (mdagents),real-world medical decision-making processes,MDAgents are designed to emulate real-world medical decision-making processes in adapting to tasks of different complexities.
mdagents,baseline methods,Evaluation of MDAgents is done against baseline methods using state-of-the-art LLMs across medical knowledge and diagnosis benchmarks.
mdagents,human physicians,MDAgents' performance is compared against human physicians' medical complexity classification in real-world medical tasks.
mdagents,moderator review and external medical knowledge,"MDAgents utilize a combination of moderator review and external medical knowledge in group collaboration, resulting in improved accuracy in diverse medical tasks."
group collaboration,average accuracy improvement,group collaboration resulted in an average accuracy improvement of 11.8%
medical decision-making (mdm),clinicians,MDM is a multifaceted and intricate process in which clinicians collaboratively navigate diverse sources of information to reach a precise and specific conclusion
clinicians,diverse sources of information,clinicians collaboratively navigate diverse sources of information
primary care physician (pcp),specialist,a primary care physician (PCP) may refer a patient to a specialist when faced with a complex case
patient,specialist,a patient visiting the emergency department or urgent care might be triaged and then directed to a specialist for further evaluation
medical decision-making (mdm),interpreting complex and multi-modal data,MDM involves interpreting complex and multi-modal data
complex and multi-modal data,imaging,"complex and multi-modal data, such as imaging, electronic health records (EHR), physiological signals, and genetic information"
complex and multi-modal data,electronic health records (ehr),"complex and multi-modal data, such as imaging, electronic health records (EHR), physiological signals, and genetic information"
large language models (llms),ai support in mdm,Large Language Models (LLMs) have shown potential for AI support in MDM
llms,medical literature,they are able to process and synthesize large volumes of medical literature
llms,clinical information,they are able to process and synthesize large volumes of clinical information
llms,probabilistic reasoning,support probabilistic reasoning
llms,causal reasoning,support causal reasoning
medical applications,careful design,there is no silver bullet in medical applications that require careful design
hyewon jeong,md degree,"Hyewon Jeong received her MD degree from Yonsei University College of Medicine, South Korea"
physicians,llms,Comparison results between human physicians and LLMs are detailed in Appendix F.
framework,mdagents,Figure 1 shows the Medical Decision-Making Agents (MDAgents) framework.
framework,medical query,"The framework performs medical complexity check, recruitment, analysis and synthesis, and decision-making steps for different medical queries."
framework,medical datasets,"Given a medical query from different medical datasets, the framework performs several steps."
tools,multi-agent llms,"Decision-making tools, including multi-agent LLMs, have shown promise in non-medical domains."
design,generalist,The 'generalist' design has not effectively integrated the real-world systematic MDM process.
clinicians,mdm,"Clinicians consider the current and past history of the patient, available evidence from medical literature, and their domain expertise and experience for Medical Decision-Making (MDM)."
example,mdm,One example of Medical Decision-Making (MDM) is to triage patients in the emergency room based on the severity and complexity of their medical conditions.
patients,conditions,Patients with various medical conditions are triaged in the emergency room based on severity and complexity.
patients,pcp,Patients with stable chronic conditions could be managed by their Primary Care Provider (PCP).
patients,injuries,Patients with injuries that involve multiple organs or chronic conditions often require multiple collaborative discussions.
mdt,ict,MDT and ICT are forms of collaborative discussions among specialty physicians
mdagents,llms,MDAgents is an adaptive medical decision-making framework that leverages LLMs
mdagents,ai agents,MDAgents involve dynamic collaboration among AI agents based on task complexity
mdagents,solo and group methods,MDAgents demonstrate superior performance in accuracy over solo and group methods on medical benchmarks
mdagents,mdm instance,MDAgents' ability to find the appropriate complexity level for each MDM instance
language models in medical decision-making llms,medical decision-making,LLMs have shown promise in a range of applications within the medical field
llms,language models in medical decision-making llms,LLMs have shown promise in a range of applications within the medical field
medical decision-making,llms,LLMs have shown promise in a range of applications within the medical field
mdagents,llms,MDAgents is the only one to perform all key dimensions of LLM decision-making
retrieval augmented generation (rag),gpt-4,RAG and GPT-4 are both models used in the medical field for leveraging latent medical knowledge.
gpt-4,usmle,GPT-4 surpasses the passing score on USMLE by over 20 points with richer prompt crafting.
gpt-4,med-palm,GPT-4 can outperform fine-tuned models including Med-PaLM by prompt tuning.
general-purpose llms,medprompt and ensemble refinement,General-purpose LLMs have inspired various techniques such as Medprompt and ensemble refinement to improve LLM reasoning.
general-purpose llms,rag tools,General-purpose LLMs have inspired RAG tools that use external resources to improve the factuality and completeness of LLM responses.
mediq,llm reliability in clinical settings,Frameworks like MEDIQ advance LLM reliability in clinical settings by enhancing information-seeking through adaptive question-asking and uncertainty reduction.
uot,llm reliability in clinical settings,UoT advances LLM reliability in clinical settings by enhancing information-seeking through adaptive question-asking and uncertainty reduction.
llm reliability in clinical settings,diagnostic processes,Enhanced LLM reliability in clinical settings supports more realistic diagnostic processes.
solitary llm,real-world mdm,A solitary LLM may not fully encapsulate the collaborative and multidisciplinary nature of real-world MDM.
expert llms,collaboration,Joining multiple expert LLMs for effective collaboration leads to solving complicated medical tasks with greater accuracy.
studies,collaboration frameworks,An array of studies have explored effective collaboration frameworks.
multi-agent collaboration,studies,The term 'studies' is related to 'Multi-Agent Collaboration' as it signifies the array of studies that have explored effective collaboration frameworks between multiple LLM agents.
multi-agent collaboration,llm agents,The term 'LLM agents' is related to 'Multi-Agent Collaboration' as it refers to the multiple LLM agents involved in the collaboration frameworks.
multi-agent collaboration,capability,The term 'capability' is related to 'Multi-Agent Collaboration' as it emphasizes enhancing capability above and beyond an individual LLM through collaboration.
collaboration frameworks,roles,The term 'roles' is related to 'collaboration frameworks' as it describes how each agent adopts a specific role in the framework like an Assistant Agent or a Manager Agent.
collaboration frameworks,sub-steps,The term 'sub-steps' is related to 'collaboration frameworks' as tasks are broken down into sub-steps and solved collaboratively in the framework.
role-playing,collaboration,The term 'collaboration' is related to 'role-playing' as it focuses on collaboration and multi-step problem-solving.
role-playing,multi-step problem-solving,The term 'multi-step problem-solving' is related to 'role-playing' as it is the main focus of the role-playing framework.
multi-agent debate,task independence,The term 'task independence' is related to 'multi-agent debate' as it prompts each agent to solve the task independently in this framework.
multi-agent debate,shared response convergence,The term 'shared response convergence' is related to 'multi-agent debate' as agents reason through others' answers to converge on a shared response in this framework.
voting,multi-disciplinary collaboration,The term 'multi-disciplinary collaboration' is related to 'Voting' as they are both similar frameworks used in multi-agent interactions.
group discussions,reconcile,The term 'ReConcile' is related to 'group discussions' as it is a specific type of group discussions used in multi-agent collaboration.
frameworks,existing setups,The term 'existing setups' is related to 'frameworks' as they are compared across key dimensions in multi-agent interaction.
multi-agent configurations,performance impact,"The term 'performance impact' is related to 'multi-agent configurations' as the static architecture may lead to suboptimal configurations, negatively impacting performance."
multi-agent approaches,computationally inefficient,The term 'computationally inefficient' is related to 'multi-agent approaches' as there is a risk of being computationally inefficient or expensive to employ.
multi-agent approaches,justify costs,The term 'justify costs' is related to 'multi-agent approaches' as they need to justify the costs with noticeable justifications.
models,frameworks,Models and frameworks could generalize better to different tasks.
frameworks,optimal collaboration strategy,The proposed framework dynamically assigns the optimal collaboration strategy at inference time.
mdagents,medical decision-making agents,MDAgents is the abbreviation for Medical Decision-making Agents.
mdagents,stages,MDAgents incorporates four stages in its design.
medical complexity check,medical query,The system evaluates the medical query through the Medical Complexity Check.
expert recruitment,primary care clinician (pcc),"Based on complexity, the framework activates a single Primary Care Clinician for low complexity issues."
expert recruitment,multi-disciplinary team (mdt) or integrated care team (ict),"Based on complexity, the framework activates a Multi-disciplinary Team or Integrated Care Team for moderate or high complexities."
analysis and synthesis,solo queries,Solo queries use prompting techniques like Chain-of-Thought and Self-Consistency.
analysis and synthesis,mdts,MDTs involve multiple LLM agents forming a consensus.
analysis and synthesis,icts,ICTs synthesize information for the most complex cases.
decision-making,inputs,The final stage synthesizes all inputs to provide a well-informed answer.
moderator agent,general practitioner (gp),The moderator agent functions as a general practitioner (GP) or emergency department doctor who first triages the medical query.
moderator agent,emergency department doctor,The moderator agent functions as a general practitioner (GP) or emergency department doctor who first triages the medical query.
moderator agent,single agent,The moderator agent assesses the complexity of the problem and determines whether it should be handled by a single agent.
moderator agent,mdt (multi-disciplinary team),The moderator agent determines whether the medical query should be handled by a MDT.
moderator agent,ict (integrated care team),The moderator agent determines whether the medical query should be handled by an ICT.
recruiter agent,moderator,The recruiter agent is responsible for assembling the appropriate team of specialist agents based on the complexity assessment of the moderator.
recruiter agent,pcp agent,The recruiter agent may assign a single PCP agent for low-complexity cases.
recruiter agent,mdt (multi-disciplinary team),The recruiter agent may assign a MDT with relevant expertise for moderate complexity cases.
recruiter agent,ict (integrated care team),The recruiter agent may assign an ICT with relevant expertise for high-complexity cases.
general doctor,specialist,"General doctors or specialists are domain-specific or general physicians recruited by the recruiter agent, depending on the complexity of the case."
general doctor,team,General doctors may work independently or as part of a team.
specialist,case,Specialists are recruited for their specific expertise in more complex cases.
specialist,knowledge,Specialists provide their specialized knowledge to reach a consensus or provide detailed reports for high-complexity cases.
medical complexity classification,mdagents framework,The MDAgents framework involves the concept of Medical Complexity Classification as described in Line 1 of Algorithm 1 from the given context.
medical complexity classification,moderator llm,"The complexity level of a medical query is determined by the moderator LLM, who acts as a generalist practitioner (GP) as explained in the context."
moderator llm,gp,The moderator LLM functions as a generalist practitioner (GP) in the context of determining the complexity of a medical query.
moderator llm,classifier,The moderator LLM functions as a classifier to return the complexity level of the given medical query in the context.
low,simple well-defined medical issues,"The complexity level 'Low' refers to simple well-defined medical issues that can be resolved by a single PCP agent, as outlined in the context."
mdt,moderate medical issues,Moderate medical issues require a collaborative approach among an MDT according to the context.
ict,complex medical scenarios,Complex medical scenarios that demand extensive coordination and combined expertise from an ICT are explained in the context.
expert recruitment,algorithm 1,"Expert Recruitment is related to Algorithm 1 as mentioned in Line 3, 7, 17 of the context."
specialists,healthcare departments,Specialists from different healthcare departments collaborate in decision-making processes
recruiter llm,domain experts,Recruiter LLM enlists domain experts based on complexity levels determined by moderator LLM
medical expertise,roles,Assigning medical expertise and roles to multiple LLMs for independent or collaborative work
llms,medical experts,LLMs are instructed to act as solo medical agents or collaborate with other medical experts in a team
assessment protocol,decision-making framework,"Initial assessment protocol categorizes query complexity into low, moderate, and high for decision-making framework"
query complexity,cases,"Query complexity is categorized into low, moderate, and high based on medical constructs"
comorbidity,case management complexity,Comorbidity and case management complexity are considered for intermediate and multi-disciplinary care requirements
severity of illness,high complexity cases,Severity of illness is considered for high complexity cases requiring comprehensive management
recruitment approach,recruiter,Specific refinement approach outlines different roles based on query complexity
pcp agent,definition in section 3.2,PCP agent is deployed for straightforward cases based on the definition in Section 3.2
llm,recruiter,LLM is recruited by the recruiter
domain expert,recuriter llm,Domain expert is recruited by the recruiter LLM
few-shot prompting,problem,Few-shot prompting is applied to the problem
output answer,ans,Output answer denoted as ans is obtained directly from the agent’s response to Q
ans,agent,"The output answer is formalized as ans = Agent(Q), with Agent representing the engaged PCP agent"
mdt approach,figure 10,MDT approach has been increasingly recognized for its effectiveness in producing comprehensive and nuanced solutions
mdt framework,professionals,MDT framework leverages the collective expertise of professionals from diverse disciplines
mdt approach,problem complexity,MDT approach is advantageous in scenarios where the complexity of a problem transcends the scope of a single domain
mdt approach,fusion of insights,MDT approach necessitates a fusion of insights from various specialties
problem-solving process,mdt approach,MDT approach significantly improves the adaptability and efficiency of the problem-solving process
framework,queries of moderate complexity,The framework specifically addresses queries of moderate complexity
framework,multi-tiered collaborative approach,"The framework addresses queries through a structured, multi-tiered collaborative approach"
mdt,recruiter llm,MDT is recruited by recruiter LLM
mdt,recruiter llm,MDT recruited by recruiter LLM
mdt,consensus,consensus reached by MDT in iterative discussion process
agents,ai,agents Ai indicate participation for each round
mdt,moderator agent,moderator agent reviews MDT's discourse for consensus determination
complex care cases,mdt approach,Complex care cases related to MDT approach
ict paradigm,highest tier of query complexity,ICT paradigm essential for addressing highest tier of query complexity
ict paradigm,decision-making process,ICT paradigm ensures specialized analysis at each stage of decision-making process
report generation process,appendix,The report generation process described in the Appendix with the prompt is a key component of the process.
team,lead clinician,"Each team, led by a lead clinician, collaboratively produces a comprehensive report synthesizing their findings."
process,decision-making,The decision-maker agent synthesizes diverse inputs generated throughout the decision-making process to arrive at a well-informed final answer to the medical query.
framework,decision-making,The decision-making process is a final stage of the framework.
components,query,The synthesis involves several components depending on the complexity level of the query.
primary decision-making agent,response,"For low complexity queries, the decision-maker agent directly utilizes the initial response from the primary decision-making agent."
recruited agents,conversation history,"For moderate complexity queries, the decision-maker agent incorporates the conversation history between the recruited agents to understand nuances and disagreements in their responses."
agents,justifications,The detailed reports generated by the agents include comprehensive analyses and justifications for their diagnostic suggestions.
decision-making process,agent,"The decision-making process is formulated as ans = Agent(·) where the final answer, ans is deter- mined by integrating the outputs from analysis and synthesis step based on its medical complexities"
integration,ensemble techniques,This integration employs ensemble techniques such as temperature ensembles to ensure the decision is robust and reflects a consensus among the models when applicable
temperature ensembles,decision,This integration employs ensemble techniques such as temperature ensembles to ensure the decision is robust and reflects a consensus among the models when applicable
ensemble techniques,decision,This integration employs ensemble techniques such as temperature ensembles to ensure the decision is robust and reflects a consensus among the models when applicable
medical benchmarks,accuracy (%),Table 2: Accuracy (%) on Medical benchmarks with Solo/Group/Adaptive setting
medvidqa,gpt-4(v),All benchmarks except for MedVidQA were evaluated with GPT-4(V) and MedVidQA was evaluated with Gemini-Pro(Vision)
medvidqa,gemini-pro(vision),All benchmarks except for MedVidQA were evaluated with GPT-4(V) and MedVidQA was evaluated with Gemini-Pro(Vision)
full experimental results,other models,Full experimental results with other models are listed in Table 9-12 in Appendix
ddxplust,pubmedqat,Both DDXPlusT and PubMedQAT are related to medical benchmarks and are part of the datasets evaluated in the experiments section.
pubmedqat,path-vqait,"PubMedQAT and Path-VQAIT are part of the datasets evaluated in the experiments section, indicating a relation through the evaluation process."
path-vqait,pmc-vqaitmedvidqav,"Both Path-VQAIT and PMC-VQAITMedVidQAV are datasets evaluated in the experiments section, possibly being compared or contrasted during evaluation."
pmc-vqaitmedvidqav,symcatt,"PMC-VQAITMedVidQAV and SymCatT are datasets evaluated in the experiments section, suggesting a comparison or analysis of results between these datasets."
symcatt,jamat,"SymCatT and JAMAT are both medical benchmarks evaluated in the experiments section, indicating a relation through the evaluation process."
jamat,medbulletstmimic-cxrit,"Both JAMAT and MedBulletsTMIMIC-CXRIT are part of the datasets evaluated in the experiments section, suggesting a relation through the evaluation process."
dataset,appendix a,datasets are deferred to Appendix A
dataset,figure 8,datasets are deferred to Figure 8
50 samples,dataset,we use 50 samples per dataset for testing
inference time,low complexity,inference time for low complexity was 14.7s
inference time,moderate complexity,inference time for moderate complexity was 95.5s
inference time,high complexity,inference time for high complexity was 226s
quantitative experiments,section,for all the quantitative experiments in this section
settings,solo,compare three settings: Solo
settings,group,compare three settings: Group
settings,adaptive,compare three settings: Adaptive
mdagents,pcp,MDAgents adaptively constructs the inference structure from PCP
mdagents,mdt,MDAgents adaptively constructs the inference structure to MDT
mdagents,ict,MDAgents adaptively constructs the inference structure to ICT
shot prompting,complexity cases,use 3-shot prompting for low-complexity cases and zero-shot prompting for moderate and high-complexity cases
medical question answering,medqa,"focus on question answering through text, involving both literature-based and conceptual medical knowledge questions"
medical question answering,pubmedqa,"focus on question answering through text, involving both literature-based and conceptual medical knowledge questions"
pubmedqa,pubmed,"PubMedQA tasks models to answer questions using abstracts from PubMed, requiring synthesis of biomedical information"
medqa,medical educational materials,MedQA tests the model's ability to understand and respond to multiple-choice questions derived from medical educational materials and examinations
medbullets,usmle step 2/3 type questions,MedBullets provides USMLE Step 2/3 type questions that demand the application of medical knowledge and clinical reasoning
jama,clinical challenge,"JAMA Clinical Challenge presents challenging real-world clinical cases with diagnosis or treatment decision-making questions, testing"
diagnostic reasoning ddxplus,symcat,"These tasks involve clinical vignettes and closely mimic the diagnostic process of physicians. They test the model's ability to reason through symptoms and clinical data to suggest possible medical conditions, evaluating the AI's diagnostic reasoning abilities similar to a clinical setting."
symcat,nlice method,SymCat uses synthetic patient records constructed from a public disease-symptom data source and is enhanced with additional contextual information through the NLICE method.
medical visual interpretation path-vqa,pmc-vqa,Path-VQA focuses on answering questions based on pathology images while PMC-VQA evaluates AI's proficiency in deriving answers from both text and images found in scientific publications.
medical visual interpretation path-vqa,medvidqa,"MedVidQA extends to video-based content, where AI models need to process information from medical procedure videos."
medical visual interpretation path-vqa,mimic-cxr,"MIMIC-CXR-VQA specifically targets chest radiographs, requiring integration of visual data with clinical knowledge."
mimic-cxr-vqa,chest radiographs,MIMIC-CXR-VQA specifically targets chest radiographs for visual question-answering tasks in the medical domain.
zero-shot,solo setting,Zero-shot directly incorporates a prompt to facilitate inference in the Solo setting.
few-shot,solo setting,Few-shot involves a small number of examples in the Solo setting.
few-shot cot,answer,Few-shot CoT integrates rationales before deducing the answer.
few-shot cot-sc,answer,Few-shot CoT-SC builds upon Few-shot CoT by sampling multiple chains to yield the majority answer.
ensemble refinement (er),model responses,Ensemble Refinement (ER) conditions model responses on multiple reasoning paths to bolster the reasoning capabilities of LLMs.
medprompt,prompting strategies,Medprompt is a composition of several prompting strategies that enhances the performance of LLMs.
voting,group decision-making,Voting is a group decision-making method tested.
medagents,group decision-making,MedAgents is a group decision-making method tested.
reconcile,group decision-making,Reconcile is a group decision-making method tested.
autogen,group decision-making,AutoGen is a group decision-making method tested.
dylan,group decision-making,DyLAN is a group decision-making method tested.
gpt-4,multiple models,GPT-4 was used for all agents in the methods supporting multiple models.
gpt-4,agents,"GPT-4 was used for all agents, indicating a direct relation between the two terms."
medqa,pubmedqa,"Both datasets are mentioned in Table 2, indicating a relation through comparison."
medqa,ddxplus,"MedQA is compared with DDXPlus, showing a relationship through comparison in terms of performance."
medqa,symcat,"Both datasets are mentioned in Table 2, indicating a relation through comparison."
medqa,jama,"Both datasets are mentioned in Table 2, indicating a relation through comparison."
medqa,medbullets,"Both datasets are mentioned in Table 2, indicating a relation through comparison."
