node_1,node_2,edge
medqa,path-vqa,"Both datasets are mentioned in Table 2, indicating a relation through comparison."
medqa,pmc-vqa,"Both datasets are mentioned in Table 2, indicating a relation through comparison."
medqa,medvidqa,"Both datasets are mentioned in Table 2, indicating a relation through comparison."
method,adaptive,"The method (Adaptive) is compared with several baselines, showing a relationship through comparison."
method,solo,"The method (Adaptive) is compared with Solo setting, showing a relationship through comparison."
method,group,"The method (Adaptive) is compared with Group setting, showing a relationship through comparison."
mdagents,solo,"MDAgents significantly outperforms (p < 0.05) both Solo and Group setting methods, indicating a relationship through performance."
mdagents,group,"MDAgents significantly outperforms (p < 0.05) both Solo and Group setting methods, indicating a relationship through performance."
ddxplus,single-agent,"DDXPlus outperformed the best performance of single-agent by 5.2%, showing a direct relationship in terms of performance."
ddxplus,multi-agent,"DDXPlus outperformed the best performance of multi-agent by 9.5%, showing a direct relationship in terms of performance."
system,adaptive strategies,"This reveals the effectiveness of adaptive strategies integrated within our system, indicating a direct relationship."
system,"text-only (e.g., ddxplus","The system outperformed the best performance of DDXPlus, showing a relationship through comparison in terms of performance."
system,"text-image datasets (e.g., path-vqa","The system adeptly synthesizes visual data, showing a direct relationship."
approach,textual information,"Our approach comprehends textual information with high precision, showing a direct relationship."
approach,visual data,"Our approach adeptly synthesizes visual data, showing a direct relationship."
llm,medqa dataset,"LLM's capability to classify complexity is experimented with the MedQA dataset, showing a direct relationship."
problems,accuracy,"Problems are evaluated based on accuracy achieved, indicating a direct relationship."
problems,complexity levels,"Problems are evaluated at various complexity levels, showing a direct relationship."
adaptive decision-making framework,effectiveness,"The framework works well, revealing its effectiveness, indicating a direct relationship."
adaptive decision-making framework,accuracy level,"The adaptive decision-making framework works well when accurately assigning difficulty levels to medical questions, as shown by the y-axis in the graph."
medical question,difficulty level,"Accurately assigning a difficulty level to a medical question is crucial to ensure appropriate decision-making, as identified in the text."
medical question,idt (interdisciplinary team),"An obviously easy medical question may not require the involvement of a team of specialists like an IDT, as it could result in overly pessimistic approaches."
medical question,pcp (primary care physician),"If a difficult medical question is only addressed by a PCP, it may lead to inadequate problem resolution."
llm (language level model),medical question,"The LLM's capability to accurately classify the difficulty of medical questions is essential to ensure suitable medical solutions and avoid wrong decision-making, as mentioned in the context."
llm (language level model),mdm (medical decision making) problem,"An LLM functions as a classifier to select the optimal complexity level for each MDM problem, as hypothesized in the text."
llm (language level model),accuracy,"The success of medical decision-making heavily relies on the accuracy of the LLM in classifying the difficulty levels of medical questions, as highlighted in the context."
llm (language level model),solutions,"The LLM helps in selecting appropriate solutions by matching the complexity levels of medical problems accurately, as shown in Figure 3."
llm (language level model),reliability,The reliability of the LLM in selecting the optimal complexity level for MDM problems is supported by its ability to appropriately match complexity levels with high accuracy.
figure 3,complexity levels,"Figure 3 illustrates that the model appropriately matches the complexity levels of medical problems as low, moderate, and high, thus supporting the hypothesis mentioned in the text."
success rate,solution accuracy,"The success rate of determining the difficulty level that yields the highest accuracy is evaluated by assessing the success rate of solutions across various difficulty levels, as stated in the context."
medical problems,accuracy level,"The accuracy of solutions for 25 medical problems is evaluated across various difficulty levels to determine the difficulty level that yields the highest accuracy, as mentioned in the context."
success rate,difficulty level,The success rate measurement aimed to identify the difficulty level that yielded the highest accuracy.
llm,complexity classification,The approach ensures that LLM's complexity classification aligns with the most effective and accurate medical solutions.
medical solutions,medical expertise,Optimizing the application of medical expertise to each question involves aligning with the most effective medical solutions.
problem p,complexity level,"For any given problem P, the probability of solving the correct answer at a specific complexity level is denoted."
llm,complexity levels,"The probabilities a, b, and c are used to describe the accuracy of the system for problem P by selecting corresponding complexity levels."
a,complexity levels,The probability a is used to select the complexity level corresponding to arg max.
b,complexity levels,The probability b is used to select the complexity level corresponding to arg mid.
c,complexity levels,The probability c is used to select the complexity level corresponding to arg min.
accuracy of the system,complexity levels,"The accuracy of the system for problem P can be described by a combination of probabilities a, b, and c corresponding to different complexity levels."
"values of a, b, c",llm,"The estimated values of a, b, c indicate that LLM can provide an optimal complexity level with a probability of at least 80%."
classifier llm,complexity levels,These findings suggest that a classifier LLM can implicitly simulate various complexity levels.
classifier llm,complexity levels,The classifier LLM can simulate various complexity levels and adapt to the complexity required for each medical problem.
classifier llm,adaptive approach,The competitiveness of our Adaptive approach shows the importance of adjusting complexity dynamically for applying LLMs effectively in MDM contexts.
solo vs. group setting,mdm,"The experimental results distinguish performance patterns between Solo and Group settings across various medical benchmarks, showcasing the importance in the MDM context."
solo methods,few-shot cot and cot-sc,"In simpler datasets like MedQA, solo methods utilizing Few-shot CoT and CoT-SC achieved up to 83.9% accuracy."
group settings,symcat,"In more complex datasets like SymCat, group settings performed better with 91.9% accuracy compared to 88.7% in solo settings."
group settings,collaborative process,"Group settings, such as Weighted Voting and Reconcile, performed better in multi-modal datasets, highlighting the advantage of collaborative processes in complex tasks."
group settings,multi-modal datasets,"Group settings excelled in multi-modal datasets like Path-VQA, MedVidQA, and MIMIC-CXR, showcasing the advantage in handling image + text tasks."
group settings,pooled diagnoses,"Pooled diagnoses from groups of physicians outperformed individual physicians, with accuracy increasing as the group size increased, aligning with findings from [4]."
solo settings,group settings,"Solo settings outperformed group settings in four benchmarks, while group settings outperformed solo settings in six benchmarks."
solo methods,group settings,"solo methods excel in straightforward tasks, while group settings provide better performance in complex, multi-faceted tasks requiring diverse expertise."
adaptive method,static complexity assignments,The adaptive method significantly outperforms static complexity assignments across different modality benchmarks.
adaptive method,low setting,"The Adaptive method achieves an accuracy of 81.2%, significantly higher than low (64.2%) setting."
adaptive method,moderate setting,"The Adaptive method achieves an accuracy of 81.2%, significantly higher than moderate (71.6%) setting."
adaptive method,high setting,"The Adaptive method achieves an accuracy of 81.2%, significantly higher than high (65.8%) setting."
text-only queries,adaptive method,"An accuracy of 81.2% is achieved for text-only queries with the Adaptive method, significantly higher than other settings."
adaptive method,mdagents (ours),Our adaptive method outperforms MDAgents (Ours) with an average accuracy of 77.6%.
adaptive method,low complexity,"In the image + text modality, the Adaptive method classified 55% of the queries as low complexity."
visual information,decision-making process,Visual information provides clear and straightforward cues that simplify the decision-making process.
video + text queries,low complexity,"Video + text queries are often classified as low complexity, indicating that dynamic visual data in conjunction with text can be straightforwardly interpreted."
medvidqa,complex medical knowledge,"MedVidQA contains relatively less complex medical knowledge, indicating the need for evaluation on more challenging video medical datasets."
medrag,mdagents framework,MedRAG is a systematic toolkit that leverages various corpora to provide comprehensive knowledge into the MDAgents framework.
mdagents framework,baseline accuracy,The baseline accuracy of MDAgents is 71.8%.
medrag,increase accuracy,"Integrating MedRAG increases accuracy of MDAgents to 75.2%, while combining it with moderator's review raises it to 80.3%."
moderator review,accuracy enhancement,"Moderator review enhances accuracy of MDAgents, with combined effect being synergistic with MedRAG."
external knowledge,refining and converging on accurate medical decisions,Leveraging external knowledge and feedback mechanisms is crucial for refining and converging on accurate medical decisions.
hybrid strategy,real-world practices,"The importance of a hybrid strategy aligns with real-world practices, emphasizing the need for leveraging external knowledge and structured feedback mechanisms."
hybrid strategy,real-world practices,The importance of a hybrid strategy is emphasized by aligning with real-world practices of continuous learning and expert consultation.
number of agents,collaborative group setting,Varying the number of agents in a collaborative Group setting shows that a higher number of agents does not lead to better performance.
adaptive method,collaborating agents,The Adaptive method achieves optimal performance with fewer agents by intelligently calibrating the number of collaborating agents.
computational efficiency,solo setting,The Solo setting resulted in a high computational cost without a corresponding increase in accuracy.
computational efficiency,group setting,The Group setting resulted in a high computational cost without a corresponding increase in accuracy.
adaptive method,resources,The Adaptive method exhibits a more economical use of resources while maintaining high accuracy.
robustness,mdagents,The Adaptive approach shows resilience to changes in temperature with performance improving under higher temperatures.
model,temperatures,The model can utilize the creative and diverse outputs generated at higher temperatures to enhance decision-making.
model,solo and group conditions,The property of enhancing decision-making under higher temperatures is not as pronounced in the Solo and Group conditions.
model,real-world medical domains,The robustness of the model is particularly valuable in real-world medical domains with high uncertainty and ambiguity in datasets.
creative diagnostic approaches,cognitive biases,Creative diagnostic approaches can mitigate cognitive biases and improve diagnostic accuracy.
creative diagnostic approaches,decision-making,Creative diagnostic approaches can foster flexibility and adaptability in decision-making.
model,future work,Future work should explore a wider range of temperatures to further improve the performance of the model.
mdagents,framework,MDAgents is a concept introduced in the paper as a framework designed to enhance the utility of LLMs in complex medical decision-making.
mdagents,consensus,"The paper discusses a clear convergence trend among MDAgents across various data modalities, indicating the capability of MDAgents to reach consensus."
mdagents,entropy calculation,"Reference to Appendix B is made for a detailed explanation of the entropy calculation, which is related to the convergence trends in consensus dynamics discussed in the paper."
llms,mdagents,MDAgents is designed to enhance the utility of LLMs in complex medical decision-making by dynamically structuring effective collaboration models.
mdagents,roles,"MDAgents adaptively assigns LLMs either to roles independently or within groups, depending on the task's complexity in order to reflect nuanced consultation aspects in clinical settings."
consensus,entropy,There is a relationship between consensus among MDAgents and entropy calculation discussed in the paper as they both reflect the convergence trends and interpretative diversity.
medical decision processes,mdagents,"MDAgents outperformed previous solo and group methods in 7 out of 10 medical benchmarks, indicating the efficiency of MDAgents in medical decision processes."
case study,proposed framework,"The case study illustrates the practical efficacy and collaborative dynamics of the proposed framework, providing insights into medical decision processes."
expert opinions,diagnosis,"Expert opinions are synthesized to reach a more accurate diagnosis, showcasing the significance of expert opinions in the medical decision-making process."
diagnosis,agents,"Agents converge on the correct diagnosis despite initially divergent perspectives, demonstrating the role of agents in reaching a consensus in medical diagnoses."
agents,strategies,"Ablation studies elucidate the individual contributions of agents and strategies within the system, emphasizing the importance of strategies in medical decision processes."
components,interactions,"Critical components and interactions drive the framework's success, highlighting the interdependence of components and interactions in medical decision processes."
multi-modal reasoning,collaborative process,"By harnessing the strength of multi-modal reasoning and fostering a collaborative process among LLM agents, new possibilities for enhancing LLM-assisted medical diagnosis systems are explored."
clinical reasoning,framework,"The framework pushes the boundaries of automated clinical reasoning, showcasing its potential in advancing clinical decision-making processes."
