node_1,node_2,edge
work,temporal information,Incorporating temporal information into the work can create other patterns and improve the results' quality.
work,datasets,The hope is that the work can foster the community to collect datasets that involve long and complex interactions.
machine learning cluster of excellence,exc number 2064/1,The Machine Learning Cluster of Excellence is associated with the EXC number 2064/1.
authors,international max planck research school for intelligent systems (imprs-is),The authors acknowledge the support of the International Max Planck Research School for Intelligent Systems (IMPRS-IS).
r. marin,alexander von humboldt foundation,R. Marin is supported by an Alexander von Humboldt Foundation Research Fellowship.
