node_1,node_2,edge
pointconv,bottleneck architecture,PointConv is re-implemented using the bottleneck architecture which resulted in significantly better performance than the original paper.
pointconvformer,minkowskinet42,"PointConvFormer outperforms MinkowskiNet42 by a significant 10.1% with 10cm input grid, 7.3% with 5cm input grid, and 2.3% with 2cm input grid, while being faster than it in the first two cases."
pointconvformer,mix3d,"mix3D could further improve results at 10cm and 5cm resolutions. On 2cm, although mix3D did not improve results on our model with 9.4M parameters, it helped to propel a much smaller model with 5.8M parameters to a similar accuracy."
pointconvformer,pointconv,PointConvFormer is able to achieve better predictions with fine details comparing with PointConv.
pointconvformer,point transformer,PointConvFormer is usually able to find the better prediction out of PointConv and Point Transformer.
convformer,pointconv,"ConvFormer is able to find the better prediction out of PointConv, showing that its novel design brings the best out of both operations."
convformer,point transformer,"ConvFormer is able to find the better prediction out of Point Transformer, showing that its novel design brings the best out of both operations."
semantickitti,kitti vision odometry benchmark,SemanticKitti is a large-scale street view point cloud dataset built upon the KITTI Vision Odometry Benchmark.
semantickitti,scannet,Results on the ScanNet validation set are compared with different input voxel size in SemanticKitti.
voxel/grid size,params,"Comparison with different input voxel size is shown in Table 1, including Voxel/grid size and Params."
pointconvformer,mix3d,PointConvFormer is implemented with a mix3D feature to improve performance.
pointconvformer,minkowskinet42,PointConvFormer has similarities with MinkowskiNet42 in terms of architecture or design.
pointconvformer,fast point transformer,PointConvFormer and Fast Point Transformer are compared for performance evaluation.
pointconvformer,pointconvformer-lite,PointConvFormer is compared with a Lite version for efficiency or resource optimization.
pointconvformer,mix3d,"PointConvFormer (ours) + mix3D are mentioned together in the context, indicating a relationship between them"
pointconvformer,pointconvformer-lite,"Both PointConvFormer (ours) and PointConvFormer-Lite (ours) are variations of the PointConvFormer, suggesting a similarity between them"
minkowskinet42,fast point transformer,Both MinkowskiNet42 and Fast Point Transformer are mentioned as methods or models related to 3D point cloud data
pointconvformer,semantickitti dataset,"Results on the semanticKitti dataset are reported with the use of PointConvFormer, implying a connection between them"
pointconvformer,spvnas,"Our PointConvFormer method outperforms SPVNAS, indicating a performance comparison between PointConvFormer and SPVNAS"
nas,performance improvement,"It is mentioned that utilizing NAS would further improve performance, highlighting the potential role of NAS in enhancing system performance"
scene flow estimation,3d applications,"Scene flow estimation is stated to be applicable in many 3D applications, showing the relevance of scene flow estimation in various contexts"
scene flow,3d applications,scene flow can be used in many 3D applications
scene flow,rgb data,scene flow was estimated directly from RGB data
scene flow,3d point clouds,scene flow estimation from 3D point clouds
point-convformer,pointpwc-net,Point-ConvFormer into the PointPWC-Net
pointconv,feature pyramid layers,replacing the PointConv in the feature pyramid layers
scannet,pointconvformer,visualize the ScanNet prediction results from PointConvFormer
scannet,pointconv*,visualize the ScanNet prediction results from PointConv*
scannet,point transformer,visualize the ScanNet prediction results from Point Transformer
scannet,point cloud segmentation results,Semantic segmentation results on ScanNet dataset
baseline methods,test set,Numbers for test set are from the official ScanNet benchmark
pointtransformer,fast point transformer,"Both PointTransformer and Fast Point Transformer are variants of PointTransformer, with Fast Point Transformer being a faster version."
pointtransformer,stratified transformer,PointTransformer and Stratified Transformer are different types of transformers used in point cloud processing.
pointtransformer,pointtransformerv2,PointTransformerV2 is an improved version of PointTransformer.
pointconvformer,pointpwc-net,"PointConvFormer is a modified version of PointPWC-Net, with changes in certain structures."
pointconvformer,pcfpwc-net,PCFPWC-Net is a new network based on PointConvFormer.
pointconvformer,pcfpwc-net,"PCFPWC-Net stands for PointConvFormer, indicating a relation of being a specific implementation or variant of PointConvFormer."
pointconvformer,attention score,"The difference of attention scores is visualized, indicating a relation where PointConvFormer uses attention scores to conduct neighborhood filtering."
object boundaries,smooth surfaces and points from the same class,"The visualization shows that larger differences in attention scores happen mostly in object boundaries, while smooth surfaces and points from the same class have low differences, indicating a relation between how PointConvFormer treats different types of features."
attention types,pointconvformer,"Ablation studies on different attention types in PointConvFormer are performed, suggesting a relation of importance of attention types in the functionality of PointConvFormer."
pointconvformer,point transformer,"PointConvFormer compared with Point Transformer attention types, showing that PointConvFormer is significantly better than Point Transformer attention"
pointconvformer,dot-product attention,"PointConvFormer compared with Dot-Product Attention, showing that PointConvFormer is significantly better than using only Dot-Product Attention"
pointconvformer,subtravtive attention,The computational cost and memory usage of the dot product version of attention is shown to be slightly smaller than the subtravtive attention used in PointConvFormer
pointconvformer,feature difference,Experimental results show that the feature difference in PointConvFormer achieves better results than dot-product attention
dot-product attention,point transformer,Experimental results show that Dot-Product Attention has more parameters than Point Transformer due to the use of two MLPs for Q and K
eq.(6),memory,The equation mentioned in the context has a relation with the concept of memory as it discusses the memory usage during inference.
eq.(6),computation,The equation mentioned in the context has a relation with the concept of computation as it discusses the computation during inference.
neighborhood size,savings,"The size of the neighborhood is related to the savings mentioned in the context, as the small neighborhood size impacts the savings significantly."
table 5,attention types,Table 5 discusses different attention types related to the model architecture and training parameters.
pointconvformer,point cloud data,"PointConvFormer is a layer proposed for tasks on point cloud data, which indicates a direct relation between the two concepts."
point-based model,accuracy-speed tradeoff,The point-based model mentioned in the context provides a better accuracy-speed tradeoff compared to sparse 3D convolutional networks.
dr. shuangfei zhai,acknowledgements,Dr. Shuangfei Zhai is thanked in the Acknowledgements section for helpful discussions.
