node_1,node_2,edge
heat,generalization,The terms HEAT and generalization are related as the ability of the model to generalize across datasets.
global reasoning capacity,corner detection,The terms global reasoning capacity and corner detection are compared in terms of their impact on the generalization ability of the model.
floorplan,two-stage pipelines,The terms floorplan and two-stage pipelines are related as the quality of floorplan generated by the pipelines is strongly affected by errors in the first stage.
montefloor,missing rooms,MonteFloor is strongly affected by missing rooms in the first stage.
montefloor,missing corners/edges,MonteFloor shows missing corners/edges in the 3rd and 4th row.
heat,missing corners/edges,HEAT suffers from missing corners/edges in the 5th and 6th row.
heat,sparse input point cloud,HEAT faces missing corners/edges issue when the input point cloud is sparse.
roomformer,missing corners/edges,RoomFormer handles missing corners/edges cases more robustly.
floor-sp,redundant corners,Floor-SP generates redundant corners due to its containment constraint.
roomformer,plausible results,RoomFormer produces more plausible results without imposing hard constraints.
room,door/window decoding,Separating room and door/window decoding can improve room density.
montefloor,density map,MonteFloor is associated with Density Map in the context of 3D scans.
heat,ground truth,HEAT is related to Ground Truth in the context of 3D scans.
floor-sp,ground truth,Floor-SP's constraint results in redundant corners compared to Ground Truth.
redundant corners,containment constraint,The tendency to produce redundant corners is attributed to the containment constraint.
method,robustness,The method mentioned is described as more robust in handling cases with redundant corners due to the containment constraint.
type classification,room and door/window,The need for type classification arises because room and door/window may have significantly different geometry and semantic properties.
method,performance,"The second-best performing method is SD-TQ, which involves using the original model with more polygon queries for modeling doors and windows."
shape representation,parameters,Single-level queries are deemed sufficient for shapes represented by a fixed number of parameters like lines.
multi-scale features and polygon refinement,model analysis,The impact of multi-scale features and polygon refinement on the model is analyzed in Table 6.
various losses,loss analysis,"The impact of various losses on the model is analyzed in Table 7, specifying that Lcls is always required for determining valid corners."
refinement process,reference points,The refinement process and the reference points in intermediate layers are discussed in relation to removing the refinement process and keeping the reference points static in intermediate layers.
roomformer,2d floorplan reconstruction,RoomFormer is introduced as a model for 2D floorplan reconstruction in the context
vertex label classification loss,loss functions,The vertex label classification loss is one of the loss components used to supervise the network
sequence coordinates regression loss,rasterization loss,It is concluded that the sequence coordinates regression loss is essential while the rasterization loss serves as an auxiliary loss
semantically-rich floorplans,polygonal reconstruction tasks,The approach aims to inspire more applications in polygonal reconstruction tasks by focusing on semantically-rich floorplans.
heat,monte-floor,"Authors of HEAT and Monte-Floor provided results on Structured3D for comparison, mentioned in acknowledgments."
theodora kontogianni,francis engelmann,"Theodora Kontogianni and Francis Engelmann are postdoctoral research fellows at the ETH AI Center, mentioned in acknowledgments."
results of semantic-rich floorplans,doors,Arcs represent doors in the results of semantic-rich floorplans with dashed lines representing windows.
single decoder variant (sd-tq),room,"The single decoder variant incorrectly identifies a room as 'bathroom' instead of 'misc', following house design principles."
house,bathroom,"Each house usually has a bathroom, which is better reflected in the groundtruth according to house design principles."
two-level queries,single-level queries,Comparison between two-level and single-level queries shows that two-level queries greatly improve all metrics in modeling floorplans.
two-level design,single vertex,"Two-level design relaxes the role of each query to model a single vertex, enhancing interactions between vertices."
vertex,sequence,"Vertices and sequences are mentioned as key concepts in the context, indicating a relationship between them in terms of modeling and interaction."
room,vertices,"The context mentions explicit interactions between vertices of the same room, suggesting a relationship between room and vertices."
room,adjacent rooms,"The context talks about interactions between vertices across adjacent rooms, indicating a relationship between rooms and adjacent rooms."
feature maps,local and global contexts,"The context discusses the use of multi-scale feature maps to aggregate both local and global contexts, implying a relationship between feature maps and contexts."
feature maps,vertex positioning and order capturing,"The context mentions that multi-scale feature maps are used for joint vertex positioning and order capturing, suggesting a relationship between feature maps and vertex positioning."
queries,vertex sequence coordinates,"The context proposes learning vertex sequence coordinates as queries, indicating a relationship between queries and vertex sequence coordinates."
coordinates,sequence,"The context talks about learning vertex sequence coordinates and using them for iterative polygon refinement, suggesting a relationship between coordinates and sequences."
