node_1,node_2,edge
smartphone photos,portrait photography,"Smartphone photos are in demand, particularly in the domain of portrait photography."
manufacturers,perceptual quality criteria,Manufacturers use perceptual quality criteria throughout the development of smartphone cameras.
smartphone cameras,automated learning-based methods,The costly procedure in the development of smartphone cameras can be partially replaced by automated learning-based methods for image quality assessment.
image quality assessment (iqa),mean opinion scores (mos),It is necessary to estimate and guarantee the consistency of the IQA process instead of using MOS for crowdsourcing IQA.
existing blind iqa (biqa) datasets,cross-content assessment difficulty,"Existing BIQA datasets pay little attention to the difficulty of cross-content assessment, degrading the quality of annotations."
piq23 dataset,portrait-specific iqa dataset,"This paper introduces PIQ23, a portrait-specific IQA dataset containing a high variety of images acquired from 100 smartphones."
piq23 dataset,image quality experts,The PIQ23 dataset is annotated by pairwise comparisons collected from over 30 image quality experts for three image attributes.
piq23 dataset,statistical analysis,An in-depth statistical analysis of annotations over PIQ23 allows the evaluation of their consistency.
piq23 dataset,comparison with existing datasets,"Through an extensive comparison with existing datasets, the effectiveness of PIQ23 is demonstrated."
piq23,consistency,PIQ23 allows us to evaluate consistency
piq23,semantic information,PIQ23 shows that semantic information can be used to improve IQA predictions
semantic information,iqa predictions,Semantic information can be used to improve IQA predictions
image context,iqa predictions,Image context can be used to improve IQA predictions
dataset,proposed statistical analysis and biqa algorithms,Dataset along with statistical analysis and BIQA algorithms are available
social media,smartphones,Social media has made smartphones a vital tool for connecting with people worldwide
visual media,portrait photography,"Visual media, particularly portrait photography, has become a crucial aspect of sharing content on social media platforms"
portrait photography,applications,Portrait photography serves numerous applications such as advertisements and social media
portrait photography,use cases,Portrait photography serves numerous use cases such as anniversaries and weddings
portrait photography,scene semantics,Capturing a high-quality portrait demands careful consideration of scene semantics
portrait photography,compositional rules,Capturing a high-quality portrait demands careful consideration of compositional rules
portrait photography,image quality,Capturing a high-quality portrait demands careful consideration of image quality
smartphone manufacturers,visual quality,Smartphone manufacturers strive to deliver the best visual quality while minimizing production costs
smartphone manufacturers,professional photography,Smartphone manufacturers strive to deliver visual quality that rivals professional photography
smartphone manufacturers,complex tuning,Smartphone manufacturers implement complex tuning and optimization protocols to calibrate image quality
smartphone manufacturers,optimization protocols,Smartphone manufacturers implement complex tuning and optimization protocols to calibrate image quality
smartphone cameras,image quality,Smartphone cameras introduce sophisticated processing techniques to calibrate image quality
smartphone cameras,non-linear processing techniques,Smartphone cameras introduce non-linear processing techniques such as multi-image fusion or deep learning-based image enhancement
objective quality assessment,digital cameras,"Objective quality assessment [4, 16, 32, 40] that models digital cameras as linear systems unreliable [9]"
objective quality assessment,perceptual evaluations,"In addition to objective measurements, the tuning process also includes perceptual evaluations where cameras are assessed by image quality experts"
automatic image quality assessment,human perception,Automatic image quality assessment (IQA) methods that try to mimic human perception of quality have been around for many years
automatic image quality assessment,tuning process,Automatic image quality assessment (IQA) methods aim to help in the tuning process
blind iqa,image quality,Blind IQA (BIQA) is a branch of IQA where image quality is evaluated without the need for undistorted reference images
blind iqa,biqa methods,Learning-based BIQA methods have shown good performance on authentic camera distortion datasets annotated by subjective assessment of image quality
biqa methods,authentic camera distortion datasets,Learning-based BIQA methods have shown good performance on authentic camera distortion datasets annotated by subjective assessment of image quality
subjective opinions,biqa methods,"Annotating these datasets is considered an ill-posed problem, as the subjective opinions are not deterministic, making it challenging to use BIQA methods as accurate quality measures"
subjective judgments,objective manner,There is a need to develop a quantitative and formal framework to evaluate and compare subjective judgments in an objective manner
pairwise comparisons,subjective judgments,"In this paper, we rely on pairwise comparisons performed by"
pairwise comparisons,image quality experts,Pairwise comparisons performed by image quality experts
image quality experts,attributes,Image quality experts rely on attributes for pairwise comparisons
image quality experts,image quality,"Image quality experts define image quality based on attributes such as target exposure, dynamic range, color, sharpness, noise, and artifacts"
attributes,target exposure,Target exposure is one of the attributes used in image quality assessment
attributes,image quality,"Attributes such as dynamic range, color, sharpness, noise, and artifacts define image quality"
image quality,portrait quality assessment,"Portrait quality assessment considers attributes such as skin tone, bokeh effect, face detail rendering, and target exposure"
portrait quality assessment,portrait images,Portrait images have specific considerations for quality assessment
portrait images,skin tone,Portrait images require considerations for skin tone in quality assessment
portrait images,face detail rendering,Portrait images require considerations for face detail rendering in quality assessment
portrait images,target exposure,Portrait images have considerations for target exposure on the face in quality assessment
portrait images,bokeh effect,Portrait images require considerations for bokeh effect in quality assessment
face iqa,face recognition systems,Work on face IQA is aimed at improving face recognition systems
smartphone portrait quality dataset,portrait image quality assessment,The dataset aims to push forward smartphone portrait photography by introducing a new domain of application for IQA
dataset,portrait images,The dataset consists of single portrait images taken using smartphone devices
dataset,brand,The dataset includes images taken using 100 smartphone devices from 14 different brands
dataset,natural scenes,The dataset is distributed across 50 different natural scenes
natural scenes,scene,Natural scenes represent fixed visual content in the dataset
iqa dataset,ethical challenges,The IQA dataset addressed ethical challenges by obtaining signed and informed agreements from individuals depicted in the dataset.
iqa dataset,iqa experiment,The IQA dataset was used in a large IQA experiment controlled in a laboratory environment with fixed viewing conditions.
iqa dataset,expert opinions,Opinions for each scene in the IQA dataset were gathered from over 30 image quality experts on three attributes related to portrait quality.
iqa dataset,statistical analysis method,"The IQA dataset was analyzed using an in-depth statistical analysis method to evaluate precision, consistency, and difficulty of the IQA task."
iqa dataset,biqa models,The IQA dataset was used for an extensive comparison between multiple BIQA models to strengthen image quality prediction.
ethical challenges,individuals depicted,Ethical challenges involved in creating the dataset were addressed by obtaining agreements from each individual depicted in the dataset.
iqa experiment,pairwise comparisons,"In the IQA experiment, pairwise comparisons were used to gather opinions from image quality experts on three attributes related to portrait quality."
biqa models,new method,BIQA models were compared with a simple new method that combined scene semantic information with quality features to strengthen image quality prediction.
quality,biqa computational algorithms,Quality and BIQA computational algorithms are related as the algorithms are used to assess the quality of images
biqa datasets,live,BIQA datasets and LIVE are related as LIVE is mentioned as an early dataset in the context
biqa datasets,csiq,BIQA datasets and CSIQ are related as CSIQ is mentioned as an early dataset in the context
biqa datasets,tid,BIQA datasets and TID are related as TID is mentioned as an early dataset in the context
biqa datasets,bapps,BIQA datasets and BAPPS are related as BAPPS is mentioned as an early dataset in the context
biqa datasets,clive,BIQA datasets and CLIVE are related as CLIVE is mentioned as an in-the-wild dataset in the context
biqa datasets,koniq10k,BIQA datasets and KonIQ10k are related as KonIQ10k is mentioned as an in-the-wild dataset in the context
biqa datasets,paq-2-piq,BIQA datasets and PaQ-2-PiQ are related as PaQ-2-PiQ is mentioned as an in-the-wild dataset in the context
virtanen,cid2013,Virtanen and CID2013 are related as CID2013 is mentioned as a database developed by Virtanen et al.
zhu,scpqd2020,Zhu and SCPQD2020 are related as SCPQD2020 is mentioned as a smartphone IQA dataset provided by Zhu et al.
fang,spaq,Fang and SPAQ are related as SPAQ is mentioned as a smartphone IQA dataset published by Fang et al.
scpqd2020,spaq,"SCPQD2020 lacks in the number of observers, whereas SPAQ relies on resized images which heavily degrades the quality."
scpqd2020,bapps,"Both SCPQD2020 and BAPPS rely on rating systems (MOS), and do not pay close attention to the difficulty of cross-content observations."
spaq,bapps,"SPAQ and BAPPS rely on rating systems (MOS), and do not pay close attention to the difficulty of cross-content observations."
piq23,tid2013,"PIQ23 provides 50 scenes, each annotated independently, while TID2013 has been mentioned as it is a dataset that relies on rating systems (MOS) but different from the others."
piq23,bapps,"PIQ23 and BAPPS are datasets that rely on rating systems (MOS), and do not pay close attention to the difficulty of cross-content observations."
biqa methods,svr,BIQA methods can be separated into classical and deep learning approaches. Early learning-based approaches use a combination of hand-crafted statistical features (natural scene statistics) to train shallow regressors like SVR.
biqa methods,cnn,BIQA methods can be separated into classical and deep learning approaches. Modern BIQA methods involve multiple convolutional neural networks (CNN) based models.
modern datasets,performance,The modern datasets have shown solid performance.
zhang et al.,problem of uncertainty in iqa,Zhang et al. address the problem of uncertainty in image quality assessment (IQA).
method,train on multiple datasets,A method is presented to simultaneously train on multiple datasets using image pairs as training samples.
su et al.,semantic features,Su et al. try to separate semantic features from image quality features.
adaptive hyper network,semantic information,An adaptive hyper network is trained to capture semantic information.
transformer architectures,global quality information,Recent works adopt transformer architectures to extract global quality information on IQA datasets.
works,transformer architectures,Recent works adopt transformer architectures for IQA datasets.
portrait quality assessment (pqa),lack of research,"Despite the lack of research, PQA solely focusing on evaluating portrait quality is recognized."
portrait quality,beauty of the portrait,Redi et al. define attributes to evaluate the beauty of a portrait.
kanafusa et al.,standard portrait image,Kanafusa et al. propose a method to define a standard portrait image for evaluating color rendering and other attributes.
standard portrait image,color rendering,Standard portrait images are used to evaluate color rendering and other attributes across various media.
standard portrait image,iq dataset,Standard portrait images are used as subjects for IQA and are compared with existing IQ datasets.
face attributes,pqa metric,Specific face attributes are evaluated as a separate metric for PQA on realistic mannequins.
portrait photo retouching dataset,smartphone pqa dataset,"A large-scale portrait photo retouching dataset has been developed, and PIQ23 is identified as the first smartphone PQA dataset."
annotation strategies,image content,Annotation strategies and image content can vary widely between different IQA datasets.
quality scales,domain shift,Quality scales being relative can lead to domain shift where similar scores may not indicate the same level of perceptual quality across different datasets.
image semantics,biqa models,Understanding image semantics is necessary for BIQA models that implicitly try to learn semantics and quality simultaneously.
multi-task learning,semantic information,multi-task learning is used to extract semantic information in some papers
multi-task learning,quality prediction,multi-task learning is used to adapt the quality prediction in some papers
hyperiqa,semantic information,HyperIQA is a hyper network that extracts semantic information implicitly
hyperiqa,quality prediction,HyperIQA adapts the quality prediction accordingly
piq23,semantic understanding,multitasking with HyperIQA is proposed to adapt the quality scale of each scene based on semantic understanding
piq23,dataset details,PIQ23 has legal aspects and dataset properties detailed in Dataset details
piq23,unrestricted access,It is crucial for public research to have unrestricted access to PIQ23
piq23,legal obstacles,Steps have been taken to address potential legal obstacles for accessing PIQ23
piq23,image rights,Individuals in the photos have given explicit permission for image rights for PIQ23
piq23,data protection laws,Dataset users are contractually required to comply with relevant data protection laws for PIQ23
gdpr,protection laws,GDPR is a specific type of protection laws
piq23,annotation biases,PIQ23 is constructed with the intent of reducing annotation biases
lighting,quality of a portrait image,lighting is a primary element influencing the quality of a portrait image
lighting,lighting conditions,"lighting conditions are separated into four groups: outdoor, indoor, low light, and night"
lighting,lighting homogeneity,lighting homogeneity describes the reflection of the light on the subject
subject characteristics,age,age is a characteristic of the subject
subject characteristics,skin tone,skin tone is a characteristic of the subject
subject characteristics,gender,gender is a characteristic of the subject
subject characteristics,framing,framing is a characteristic of the subject
subject characteristics,face orientation,face orientation is a characteristic of the subject
subject characteristics,movement,movement is a characteristic of the subject
subject characteristics,subject-to-lens distance,subject-to-lens distance is a characteristic of the subject
fitzpatrick skin type (fst),skin tone ruler,skin tone ruler is based on the Fitzpatrick skin type (FST)
smartphone devices,brands,a sizeable chunk of smartphone devices and brands utilized over the past decade are covered
smartphone camera,lens focal lengths,"diverse smartphone camera lens focal lengths such as zoom, wide, and selfie are included"
smartphone camera,camera modes,distinct camera modes such as night and bokeh are included
dataset augmentation,high-quality images sourced from dslr cameras,the dataset augmentation includes the possibility of augmenting with high-quality images sourced from DSLR cameras
comparability,dslr images to photos taken by smartphones,artificially distorting DSLR images to ensure comparability with photos taken by smartphones is a challenging task
dslr images,smartphones,DSLR images are distorted to ensure comparability with photos taken by smartphones. DSLR cameras are excluded from the dataset.
dataset,dslr cameras,DSLR cameras were excluded from the dataset.
dataset,portrait scenarios,A collection of 50 distinct portrait scenarios was designed as part of the dataset.
portrait scenarios,scenes,The portrait scenarios were captured in predetermined locations referred to as 'scenes'.
dataset images,smartphones,The dataset images were taken with about 100 smartphones from 14 brands and different price segments.
piq23,larger dataset,PIQ23 was subsampled from a larger dataset that was collected over a couple of years.
piq23,engineering and photography,PIQ23 is a result of cumulative efforts in engineering and photography.
portrait quality,person depicted,"In a portrait, most attention is given to the person depicted, known as the human region priority (HRP)."
portrait quality,application,Portrait quality may vary significantly depending on the application.
portrait quality,beauty,Quality in portrait photography is strongly correlated with beauty and aesthetics.
beauty,aesthetics,beauty is strongly correlated with aesthetics
fiqa,quality assessment,"In FIQA, quality assessment is a measure of utility to filter out poor quality faces from face recognition systems"
fiqa,face recognition systems,Quality assessment in FIQA is used to filter poor quality faces from face recognition systems
pqa,research,"The research on PQA is intended to be broadened by studying a group of attributes including face detail preservation, face target exposure, overall image quality, and global color quality"
face detail preservation,face target exposure,Face detail preservation and face target exposure are two attributes being studied in relation to PQA research
face detail preservation,overall image quality,Face detail preservation is one of the attributes being studied in relation to overall image quality
face target exposure,overall image quality,Face target exposure is one of the attributes being studied in relation to overall image quality
global color quality,annotation,Global color quality attribute has been excluded from the dataset due to difficulty in annotating it through pairwise comparisons on different content
perception-based iqa experiments,image quality annotations,Perception-based IQA experiments aim to deliver image quality annotations obtained from impartial and unbiased observations
perception-based iqa experiments,difficult,Perception-based IQA experiments present a high degree of difficulty
perception-based iqa experiments,subjective,Perception-based IQA experiments are usually subjective
opinions,vary widely,Opinions can vary widely depending on multiple factors
observer's cultural background,image content,The observer's cultural background and image content can influence opinions on image quality
piq23,deliver,The objective of PIQ23 is to deliver image quality annotations
active sampling technique,pwc,The active sampling technique is combined with PWC to achieve good annotation consistency with a minimal number of comparisons.
region of interest (roi),attribute,The region of interest (ROI) is fixed for each attribute for details preservation and target exposure.
face area,retinaface,The face area is extracted using RetinaFace for details preservation and target exposure.
images,full hd resolution,The images are resized to an approximate Full HD resolution while keeping the original aspect ratio for color and overall attributes.
photographers,experts,Professional photographers and experts with a solid background in photography and image quality were reached out to help annotate the dataset.
internal pwc tool,experts,More than 30 experts' opinions were gathered using an internal PWC tool.
viewing conditions,human eye,The viewing conditions are aligned with those of a human eye to ensure accurate assessment.
benq 32º 4k monitor,pixel pitch,A BenQ 32º 4k monitor with a pixel pitch of 0.185 is used for display.
eye-to-screen distance,monitor,The eye-to-screen distance is fixed at 65cm for calibration with the monitor.
srgb settings,d65 white point,The display is calibrated to standard sRGB settings with D65 white point for accurate color representation.
srgb,d65 white point,The display is calibrated to the standard sRGB settings with a D65 white point for accurate color representation.
images,dci-p3 color space,All images are converted from DCI-P3 color space to sRGB for consistency.
sessions,attribute,Short sessions of around five minutes per attribute are conducted to reduce fatigue and stress on the observers.
sessions,observers,Short sessions are designed to reduce the fatigue and stress on the observers.
comparison,pairwise,"Around 4k pairwise comparisons were collected for each scene and attribute, resulting in a total of 600k data points."
comparison,noise,Noise and outliers are commonly encountered in a limited number of comparisons due to the subjectivity of the task.
statistical analysis,noise,A new statistical analysis method is presented in Section 4 to rectify the noise encountered in comparisons.
quality scores,pwc experiment,Quality scores are extracted from a PWC experiment to quantify image quality.
quality scores,uncertainty,Uncertainty in quality scores can be estimated using bootstrapped confidence intervals.
confidence intervals,statistical analysis,A new statistical analysis strategy in Section 4.2 goes beyond the calculation of confidence intervals to quantify uncertainty in IQA experiments.
image quality,statistical distribution,The image quality requires modeling the statistical distribution
image quality,thurstone case v observer model,The quality of an image is described by the Thurstone Case V observer model
image quality,gaussian distribution,The quality of an image is described as a Gaussian distribution
gaussian distribution,average,The average represents the actual quality in the Gaussian distribution
gaussian distribution,perceptual variance,The perceptual variance is represented by σ2 in the Gaussian distribution
perceptual variance,intra-variance,The perceptual variance encompasses the intra-variance and inter-variance of the perceptual quality
intra-variance,uncertainty,The intra-variance represents the uncertainty of one observer when the observation is repeated multiple times
intra-variance,observer,The intra-variance represents the uncertainty of one observer
perceptual quality,inter-variance,The inter-variance represents the uncertainty across multiple observers
psychometric scaling methods,comparison matrix m,Psychometric scaling methods transform the comparison matrix M into a continuous scale of image scores
comparison matrix m,pwc experiment,The comparison matrix M is constructed from a PWC experiment
image scores,average opinions,The image scores represent the average opinions across multiple observers
just-objectionable-difference (jod) units,75% of observers,Two images are 1 JOD apart if 75% of observers choose one as better than the other
psychometric scaling method,mikhailiu et al.,The psychometric scaling method proposed by Mikhailiu et al. is adopted in the work
active pair selection technique,approximate message passing,The authors propose an efficient active pair selection technique via approximate message passing
active pair selection technique,information gain maximization,The authors propose an efficient active pair selection technique combined with information gain maximization
active pair selection technique,trueskill scaling algorithm,The authors propose an efficient active pair selection technique combined with the TrueSkill scaling algorithm
pwc experiment,incomplete design,M is typically a very sparse matrix with a limited number c of non-zero elements in an incomplete design
iqa limitations,choice of image,The choice of image and observer sam-
jod scores,image and observer samples,The accuracy of JOD scores is influenced by the choice of image and observer samples. Sampling images and observers from infinitely large populations affects the quality of the comparison task and experiment.
inexperienced observers,noisier annotations,"A sample of inexperienced observers generally leads to noisier annotations compared to a sample of experts, requiring more observers for accurate results."
psychometric scaling algorithms,estimation error,"Psychometric scaling algorithms introduce an estimation error that is inversely proportional to the size of the data, impacting the precision of the experiment."
difficulty of the comparison task,image sampling,"Estimating the difficulty of the comparison task is linked to the process of image sampling, where similarities between images affect the required number of comparisons."
quality of the experiment,observer sampling,"The quality of the experiment is linked to the process of observer sampling, where the expertise of observers influences the precision of the experiment."
experiment error,jod score estimation error,"Factors such as image sampling difficulty, observer sampling quality, and psychometric scaling algorithm precision contribute to the experiment error, which impacts the estimation of JOD scores."
ci (confidence interval),jod scores,"The confidence interval (CI) of JOD scores can quantify the experiment error, providing a measure of uncertainty in the IQA process."
