node_1,node_2,edge
pwc experiments,error introduced by image sampling,"The original formulation of confidence interval (CI) does not directly apply to PWC experiments due to the error introduced by the image sampling process, requiring practical alternatives for computation."
error,image sampling process,The error introduced by the image sampling process is not taken into account [38].
cis,bootstrapping,A practical alternative for computing CIs is bootstrapping [8].
cis,percentile method of bootstrapping,We follow the approach proposed in [42] and resort to the percentile method of bootstrapping [6].
jod scores,observer comparison matrices,"We repeatedly generate JOD scores by sampling, with replacement, the observer comparison matrices."
ci boundaries,jod scores,The CI boundaries for each image are then defined as the 2.5th and 97.5th percentiles of the JOD scores.
ci limitations,confidence intervals,CI limitations. Confidence intervals represent well the sample mean error for independent variables and samples [42].
image jod scores,cis,"This behavior makes the image JOD scores somewhat interdependent, which is not apparent in the CIs [42]."
images,quality,"To identify which images have a significant difference in quality, we need to analyze the overlap of their confidence intervals [42]."
overlap,significance,"Do we consider the overlap of 20%, 30%, or 60% to be significant? [42]."
multiple overlaps,techniques,What to do in case of multiple overlaps? We address these issues by combining two techniques.
images,cis,We first cluster the images using their CIs.
images,variance analysis,We use variance analysis to identify.
techniques,cluster,The techniques mentioned are used to first cluster the images based on their CIs.
images,cis,Images are clustered based on their Confidence Intervals (CIs) which indicate quality differences.
cis,quality similarity,Overlap in Confidence Intervals (CIs) may indicate quality similarity between images.
ci,distance,Each CI is represented as a point in a subspace where the Euclidean distance between two CIs is calculated.
k-means algorithm,quality groups,K-means algorithm is used to define preliminary quality groups of the images.
pwc matrix,cis,Confidence Intervals (CIs) are generated from the PWC matrix.
quality groups,rmanova,"Within each quality group, RMANOVA is applied to detect significant differences in JOD scores."
image pairs,p-value,Weighted undirected graph is constructed using the p-value of paired t-tests between image pairs.
sub-clusters,louvain community detection,Louvain community detection is used to extract sub-clusters of similar images.
paired t-tests,image pairs,paired t-tests are conducted between the image pairs
louvain community detection,sub-clusters,Louvain community detection is applied to extract sub-clusters of similar quality
boxplots,bootstrapped image scores,boxplots represent the bootstrapped image scores generated
preliminary quality groups,jod range,number of preliminary quality groups is determined by dividing the total JOD range by the median size of the CIs
jod clustering,variance analysis,variance analysis is used for JOD clustering
anova,rmanova,"ANOVA is used for the analysis of variance, particularly repeated measures ANOVA (RMANOVA)"
continuous variable,dependent variable,continuous variable is the dependent variable in the statistical test
categorical variable,within-subject factor,categorical variable serves as the within-subject factor in the statistical test
independent variable,images,images are considered as the independent variable in the experiment
dependent variable,image quality,image quality is the dependent variable in the experiment
sparse comparison matrix,x,sparse comparison matrix (M) is defined and X is a set of matrices
matrix,sec. 4.1,The matrix is defined in Section 4.1.
matrix,x,The matrix X is defined as a set of vectors inferred from comparison matrices bootstrapped from M.
x,comparison matrices,X consists of vectors inferred from comparison matrices.
x,n,"X is related to the number of images, denoted as n."
hypotheses,h0,"Two hypotheses are defined: H0 (null hypothesis) and H1, where H0 states that all mean scores are equal."
h0,h1,H0 and H1 are hypotheses related to image score differences.
h0,image scores,H0 is related to the scores of images in the test.
images,quality,The quality of the images is mentioned in relation to image scores and hypothesis testing.
groups,images,The analysis is conducted on preliminary groups and image differences are deduced.
significant difference,images,A significant difference is found in some groups based on the image analysis.
pairs,cluster,Paired t-tests are conducted on all possible pairs in the given cluster.
significant difference,weighted undirected graph,"For groups with significant differences, a weighted undirected graph is created based on the p-values of paired t-tests."
weighted undirected graph,louvain community detection algorithm,The Louvain community detection algorithm is applied to the weighted graph.
paired t-tests,louvain community detection algorithm,The paired t-tests results are used as input for the Louvain community detection algorithm to group dense regions of nodes into communities.
louvain community detection algorithm,method,The method involves applying the Louvain community detection algorithm to group dense regions of nodes into communities.
graph,sub-clusters,The graph is separated into sub-clusters which are then assigned average scores and variance corresponding to the images.
statistical analysis,scenes,"Results of the statistical analysis on 20 scenes show interesting observations related to clusters, groups, JOD range, and median CI size."
jod range,quality coverage,"A wider JOD interval indicates a wider quality coverage, leading to a higher number of quality levels."
confidence interval,images,"A smaller confidence interval indicates images can be more easily separated, resulting in a higher number of quality levels."
images,quality levels,The number of quality levels is influenced by the quality of the images.
detail preservation,exposure,"Detail preservation and exposure have smaller confidence intervals compared to color, indicating differences in annotating difficulty."
color,difficulty,"Color has the largest confidence interval, suggesting a greater difficulty in annotating this attribute."
piq23 dataset,biqa method,The deep BIQA method (SEM-HyperIQA) is introduced based on the PIQ23 dataset.
sem-hyperiqa,method,SEM-HyperIQA is a proposed approach that adapts to the specific structure of the dataset.
sem-hyperiqa,biqa methods,SEM-HyperIQA is compared to existing BIQA methods from the literature.
semantics,quality,SEM-HyperIQA involves aligning the predicted quality with the semantics of the scene.
sem-hyperiqa,piq23,SEM-HyperIQA aims to address domain shift in the PIQ23 dataset.
sem-hyperiqa,hyperiqa architecture,SEM-HyperIQA combines the HyperIQA architecture with semantic information.
sem-hyperiqa,multitasking,SEM-HyperIQA integrates multitasking to allow scene-specific rescaling.
sem-hyperiqa,semantic features,SEM-HyperIQA concatenates the semantic features of multiple random crops for prediction.
sem-hyperiqa,scene category,SEM-HyperIQA predicts the scene category by feeding the semantic features to a multi-layer perceptron.
sem-hyperiqa,quality score,SEM-HyperIQA adapts the predicted quality score of each patch to its respective scene scale.
sem-hyperiqa,loss function,SEM-HyperIQA loss function includes the sum of ℓ1-norm loss and cross entropy.
quality score,patch,"The quality score of a patch is mentioned, indicating a relationship between patch and quality score."
ℓ1-norm loss,cross entropy,"The loss is defined as the sum of ℓ1-norm loss and cross entropy, implying a relationship between them."
sem-hyperiqa-so,sem-hyperiqa-co,"Two variants SEM-HyperIQA-SO and SEM-HyperIQA-CO are proposed, indicating a relationship between them."
scene category prediction,mlp,"Instead of scene category prediction, scene information is directly fed to the MLP, indicating a relationship between scene category prediction and MLP."
rescaling part,scene prediction,"In the second variant, the rescaling part is omitted and only the scene prediction is kept, implying a relationship between rescaling part and scene prediction."
individual importance,scene-specific rescaling,"The two variants explore the individual importance of scene-specific rescaling and semantic prediction, indicating a relationship between individual importance and scene-specific rescaling."
training strategy,training configurations,"Different training configurations are tested for all proposed methods, indicating a relationship between training strategy and training configurations."
images,patches,"Images are cropped to patches of different sizes, implying a relationship between images and patches."
adam stochastic optimization,learning rates,"Adam stochastic optimization is used with different learning rates between 10^-6 and 10^-4, indicating a relationship between Adam stochastic optimization and learning rates."
training epochs,learning rate decay factor,"Training is fixed for 300 epochs and a learning rate decay factor of 0.05 is adopted, indicating a relationship between training epochs and learning rate decay factor."
training,epochs,The training is fixed for 300 epochs
training,learning rate decay factor,A learning rate decay factor of 0.05 for every 10 epochs is adopted during training
image quality score,patch scores,The final image quality score is computed by averaging the individual patch scores
image quality score,model outputs,The Spearman's rank correlation coefficient is computed between the model outputs and the JOD scores to evaluate performance
scene,correlation,Correlation is computed over the scores for each individual scene to evaluate performance
sem-hyperiqa architecture,semantic representation,The semantic representation acquired by HyperIQA for multiple patches is combined in the SEM-HyperIQA architecture
patch quality,scene category,The predicted category is used to rescale the patch quality in order to predict the scene category
scene category,scene,The predicted category is used to rescale the patch quality
baselines,spearman's rank correlation coefficient,Comparison of the baselines is done according to their average scene Spearman's rank correlation coefficient
baselines,error margin,Comparison of the baselines is done with their error margin across the scenes
deep learning methods,performance,"The deep learning methods tested perform significantly, as shown by the table"
jod scores,error margin,JOD scores and their error margin are compared across scenes
deep learning methods,classical counterparts,Deep learning methods tested perform significantly better than their classical counterparts on PIQ23.Baseline methods
sem-hyperiqa,existing biqa models,"SEM-HyperIQA is compared with BIQA models including BRISQUE, NIQE, ILNIQE, DB-CNN, HyperIQA, and MUSIQ"
niqe,ilniqe,NIQE and ILNIQE do not require any training
db-cnn,musiq,"DB-CNN and MUSIQ are pre-trained on LIVE Challenge and PaQ-2-PiQ, respectively"
hyperiqa,imagenet,HyperIQA is pre-trained on ImageNet
niqe,ilniqe,NIQE and ILNIQE do not require any training
deep learning methods,classical counterparts,"Deep learning methods tested perform better than classical counterparts, indicating a difficulty to adapt to high-resolution images, scene-specific scales, and attribute-specific annotations"
sem-hyperiqa,hyper-iqa,SEM-HyperIQA method improves upon the original Hyper-IQA
sem-hyperiqa,scene semantics and multitasking,Improvement of SEM-HyperIQA indicates the effectiveness of scene semantics and multitasking in quality prediction
sem-hyperiqa-so,scene-specific rescaling,"SEM-HyperIQA-SO with scene-specific rescaling achieves the best performance, notably enhancing the detail preservation attribute"
detail preservation attribute,limited information available in face crops,The detail preservation attribute is enhanced possibly due to the limited information available in face crops for scene analysis.
deep biqa models,detail preservation and exposure,Deep BIQA models perform significantly better for detail preservation and exposure than overall.
deep biqa models,task’s difficulty and the uncertainty of the annotations,The performance of deep BIQA models directly reflects this task’s difficulty and the uncertainty of the annotations.
piq23,new dataset for portrait quality assessment,"PIQ23 is a new dataset for portrait quality assessment with a wide variety of smartphone cameras and use cases, annotated by image quality experts using pairwise comparisons."
training strategy and deep neural network architecture,high-resolution images of piq23,The training strategy and deep neural network architecture are adapted to the high-resolution images of PIQ23 to adjust to the per-scene quality scaling of the dataset.
training strategy and deep neural network architecture,semantic information and multitasking,The training strategy and deep neural network architecture profit from semantic information and multitasking to adjust to the per-scene quality scaling of the dataset.
quality scale quantification and clustering of similar quality images,contain annotation uncertainty,Quality scale quantification and clustering of similar quality images help contain annotation uncertainty.
semantic information,training iqa models,"Semantic information plays a crucial role in the training of IQA models, as it helps in understanding the context and improving the accuracy of image quality assessment."
iqa models,portrait images,"The development of IQA models opens up new possibilities for the application of IQA on portrait images, indicating a potential advancement in this domain."
iqa datasets,annotations,"Higher caliber annotations in IQA datasets are expected to result from this work, leading to improved quality assessment and benchmarking."
french government,agence nationale de la recherche,"This work was funded in part by the French government, managed by Agence Nationale de la Recherche, showcasing the support from these entities in the research."
investissements d'avenir program,prairie 3ia institute,"Reference to ANR-19-P3IA-0001 (PRAIRIE 3IA Institute) indicates the involvement in the 'Investissements d'avenir' program, highlighting the collaborative efforts in this field."
louis vuitton/ens chair,artificial intelligence,The collaboration between Louis Vuitton/ENS chair in artificial intelligence signifies a partnership focused on advancing research in this area.
inria/nyu collaboration,research,The Inria/NYU collaboration demonstrates a joint effort towards conducting research and enhancing knowledge in various domains.
nc,dxomark/prairie cifre fellowship,"NC was supported in part by a DXOMARK/PRAIRIE CIFRE Fellowship, illustrating the recognition and assistance provided to individuals within the field."
dxomark engineers,photographs,Acknowledgment of DXOMARK engineers and photographers for their contributions signifies the importance of their expertise and insights in the discussions about image quality.
image quality,discussions,Fruitful discussions about image quality indicate a collaborative effort towards enhancing understanding and knowledge in this specific area of interest.
