node_1,node_2,edge
bounding boxes,templates,Bounding boxes are used to obtain templates and search regions with some data augmentation such as jitter and brightness change.
templates,search regions,"Templates and search regions are obtained with some data augmentation such as jitter, brightness change, and then resized to 128 × 128 and 256 × 256 pixels, respectively."
search image,template,"During the tracking phase, the search image and template are resized to a fixed size for feature extraction and correlation."
feature extraction,correlation,Feature extraction and correlation are performed before the prediction head outputs 256 bounding boxes and classification scores.
prediction head,bounding boxes,The prediction head outputs 256 bounding boxes and classification scores after feature extraction and correlation.
diction head,256 bounding boxes,diction head outputs 256 bounding boxes
diction head,classification scores,diction head outputs classification scores
penalty window,distractors,penalty window is employed to filter distractors
comparison experiments,32gb tesla v100 gpu,comparison experiments executed on a single 32GB Tesla V100 GPU
uav onboard processor,nvidia jetson nx xavier,UAV onboard processor NVidia Jetson NX Xavier is used for onboard tests
experimental settings,evaluation principles,experimental settings follow the evaluation principles in long-term RGBD tracking from VOT challenge
one-pass evaluation (ope),trackers’ performance,OPE is used to test trackers’ performance on D2Cube
prediction confidence score θt,classification threshold τθ,predicted θt compared with classification threshold τθ
precision-recall,whole test set,precision-recall calculated over the whole test set
state-of-the-art rgb aerial trackers,d2cube dataset,performance comparison of state-of-the-art RGB aerial trackers on D2Cube dataset
state-of-the-art rgbd trackers,d2cube dataset,performance comparison of state-of-the-art RGBD trackers on D2Cube dataset
etm,udat,ETM outperforms UDAT on F-score by 15.4%.
etm,tctrack,ETM outperforms TCTrack on F-score by 19.8%.
etm,hcat,ETM outperforms HCAT on F-score by 6.9%.
etm,dal,ETM is proposed to be compared with DAL.
etm,tsdm,ETM is proposed to be compared with TSDM.
etm,det,ETM is proposed to be compared with DeT.
etm,dmt,ETM is proposed to be compared with DMT.
etm,protrack,ETM is proposed to be compared with ProTrack.
etm,nvidia nx xavier,The proposed EMT is tested on the UAV platform with Nvidia NX Xavier.
emt,uav platform,EMT is tested on the UAV platform
emt,nvidia nx xavier,EMT is tested on the UAV platform with Nvidia NX Xavier
tracking results,ground truth,tracking results and ground truth are marked with red and green box respectively
emt,rgbd trackers,EMT is compared with state-of-the-art RGBD trackers and beats most of them in tracking accuracy
emt,protrack,EMT is on par with ProTrack in tracking accuracy
emt,det,EMT outperforms DeT by 3.3% on F-score
emt,dmt,EMT outperforms DMT by 5.4% on F-score
emt,macs,EMT achieves comparable performance with a significant reduction in MACs compared to other RGBD trackers
emt,parameters,EMT achieves comparable performance with a significant reduction in parameters compared to other RGBD trackers
emt,tracking speed,EMT achieves a significantly higher tracking speed compared to other RGBD trackers
emt,real-world uav tracking circumstances,EMT is tested on a commonly-used UAV onboard processor NVIDIA Jetson NX Xavier to simulate real-world UAV tracking circumstances
trackers' real-time capabilities,evaluated and verified,trackers' real-time capabilities can be evaluated and verified through onboard tests
tests,challenging scenarios,"tests cover multiple challenging scenarios, e.g., dark scenes, fast motion, similar objects, etc."
emt,on-board speed,EMT can perform successful tracking with an on-board speed of 25 fps
emt,tracking,EMT can perform successful tracking with an on-board speed of 25 fps.
center location error (cle),predictions,Center Location Error (CLE) refers to the center error between the predictions and groundtruth.
error,successful tracking,The error is set to be within 40 pixels for successful tracking in real-world applications.
template features,dimension,Ablation study on the dimension of template features show that 16-dimension embedding gives similar performance to 32-dimension one.
template features,modality information,"Both 16-dimension and 32-dimension embeddings are much higher than the 4-dimension one, confirming that the modality information is redundant."
template features,compact representation,The compact representation for template is efficient and effective.
one-way attention (owa) modules,numbers,"Table 7 gives the performance comparison with different numbers of OWA modules, showing that 2 OWA modules perform best, exceeding the one-module approach by 19% with high speed."
one-way attention (owa) modules,model performance,The model performance decreases as the number of OWA modules increases to 4.
owa modules,attention,OWA modules may force the model to aggregate the attention
owa modules,invalid information,OWA modules may force the model to aggregate the attention on invalid information
rgbd aerial tracking task,aerial perception,definition of a new RGBD aerial tracking task to explore aerial perception in overhead space
rgbd aerial tracking task,drone-based perception,new task enables more complex drone-based perception
models,dataset,models validated using a large-scale dataset covering more scenarios and categories
baseline,rgbd aerial tracking task,strong baseline proposed for the RGBD aerial tracking task
research,preliminary stage,research still at preliminary stage in the first work dedicated to RGBD aerial tracking
dataset,method,dataset used for an ablation study on different ways for cross-modal fusion
rgb,depth,"Add, Mean, Max operations are performed on RGB and Depth data for cross-modal fusion."
rgbd trackers,rgb-only trackers,"RGBD trackers outperform RGB-only trackers in all attributes, especially in dark scenes and illumination change."
rgbd trackers,emt,EMT achieves comparable performance with ProTrack while being 10× smaller in model size and 20× faster in speed.
emt,protrack,EMT achieves comparable performance with ProTrack while being 10× smaller in model size and 20× faster in speed.
emt,rgbd trackers,"EMT outperforms other state-of-the-art trackers in terms of UAV-specific challenges like low resolution, camera motion, fast motion, viewpoint change, and sensor failure."
rgb,rgbd trackers,RGB and RGBD trackers are compared against difficulties in UAV scenarios for performance evaluation.
depth,rgbd trackers,Depth information enhances the discriminative ability of RGBD trackers in complex environments.
common operations,emaf,"Common operations (add, mean, max) show lower performance compared to EMAF for cross-modal fusion."
score degradation,emaf,"score degradation compared to the proposed EMAF, showing a decrease of over 10%"
module,importance of two modalities,module can determine the importance of two modalities dynamically
module,perform fusion,module can perform an effective fusion in different environments
dimensions,template embedding,different dimensions of template embedding are discussed
