node_1,node_2,edge
anomaly detection models,normal samples,"Anomaly detection models are learned using normal samples in an unsupervised way, which may result in ambiguous decision boundary and insufficient discriminability."
anomaly detection models,known anomalies,Utilizing a few known anomalies during training may cause another issue that the model may be biased by those known anomalies and fail to generalize to unseen anomalies.
known anomalies,unseen anomalies,Model may be biased by known anomalies and fail to generalize to unseen anomalies.
supervised anomaly detection,anomaly models,We learn AD models using a few anomalies with the objective to detect both the seen and unseen anomalies.
anomaly detection models,explicit boundary guided semi-push-pull contrastive learning mechanism,"We propose a novel explicit boundary guided semi-push-pull contrastive learning mechanism, which can enhance model's discriminability while mitigating the bias issue."
explicit separating boundary,feature learning,We find an explicit and compact separating boundary as the guidance for further feature learning.
normal feature distribution,boundary guided semi-push-pull loss,The bias problem caused by a few known anomalies can be alleviated.
normal features,abnormal features,A boundary guided semi-push-pull loss is developed to pull the normal features together while pushing the abnormal features apart from the separating boundary beyond a certain margin region.
model,decision boundary,Our model can form a more explicit and discriminative decision boundary to distinguish known and unseen anomalies.
model,decision boundary,The model can form a more explicit and discriminative decision boundary to distinguish known and also unseen anomalies.
anomaly detection,anomalies,Most previous anomaly detection methods are unsupervised and pay much attention to normal samples while inadvertently overlooking anomalies.
decision boundaries,anomalies,"Without anomalies, the decision boundaries are generally implicit and not discriminative enough."
anomaly detection models,knowledge about anomalies,The insuffient discriminability issue in unsupervised anomaly detection is due to the lack of knowledge about anomalies.
real-world applications,anomalies,"A few anomalies are usually available in real-world applications, which can be exploited effectively to address or alleviate the insuffient discriminability issue."
semi-supervised anomaly detection,available anomalies,Semi-supervised anomaly detection methods focus on those available anomalies to learn knowledge from them.
anomalies,one-class classification,Anomalies are utilized as negative samples in one-class classification for learning knowledge.
anomalies,supervised binary classification,Anomalies are utilized in supervised binary classification for learning knowledge.
anomalies,deviation loss,Anomalies are used to optimize one anomaly scoring network through deviation loss.
detection performance,known anomalies,Detection performance can be significantly improved even with a few known anomalies.
known anomalies,unseen anomalies,Known anomalies may bias methods and fail to generalize to unseen anomalies.
supervised anomaly detection,known anomalies,Supervised anomaly detection aims to effectively train models with known anomalies to improve detection performance.
supervised anomaly detection,unseen anomalies,Supervised anomaly detection aims to generalize well to unseen anomalies.
unsupervised ad,supervised ad,Supervised anomaly detection is more meaningful for real-world applications compared to unsupervised anomaly detection.
detected anomalies,discriminability and generalizability of the model,Detected anomalies can be used to further improve the discriminability and generalizability of the model.
detected anomalies,real-world ad applications,Detected anomalies can be used to improve real-world anomaly detection applications.
boundary guided anomaly detection (bgad) model,discriminability,The BGAD model is designed to improve the discriminability of the model.
boundary guided anomaly detection (bgad) model,generalizability,The BGAD model aims to enhance the generalizability of the model.
bgad model,novel,BGAD is described as a novel model.
bgad model,two core components,The BGAD model consists of two core components.
unsupervised ad models,anomaly score distribution,unsupervised AD models typically involve analyzing anomaly score distributions to detect anomalies in data.
anomaly score distribution,decision boundary,"The anomaly score distribution usually has ambiguous regions, making it difficult to find an ideal decision boundary."
decision boundary,false negatives,The left decision boundary may result in many false negatives.
decision boundary,false positives,The right decision boundary may induce many false positives.
normal feature distribution,decision boundary,"With the normalized normal feature distribution, explicit and compact decision boundaries can be obtained easily."
proposed bg-spp loss,boundary optimizing,The proposed BG-SPP loss enables boundary guided optimizing in anomaly detection.
boundaries,normal distribution,Boundaries can be obtained easily close to the normal distribution. Explicit Boundary Generating employs normalizing flow to learn a normalized normal feature distribution.
proposed bg-spp loss,boundary guided optimizing,"With the proposed BG-SPP loss, boundary guided optimizing can be implemented to obtain an unambiguous anomaly score distribution."
normal feature distribution,explicit separating boundary,We employ normalizing flow to learn a normalized normal feature distribution and obtain an explicit separating boundary. The obtained explicit separating boundary only relies on the normal distribution.
normal feature distribution,hyperparameter β,"The explicit separating boundary obtained from a normalized normal feature distribution is controlled by a hyperparameter β, representing the normal boundary."
normal features,explicit separating boundary,"With the BG-SPP loss, only the normal features whose log-likelihoods are smaller than the boundary are pulled together to form a more compact normal feature distribution."
abnormal features,explicit separating boundary,"With the BG-SPP loss, abnormal features whose log-likelihoods are larger than the boundary are pushed apart from the boundary beyond a certain margin region."
model,boundary,The model forms a separating boundary to distinguish anomalies effectively.
rarity,anomalies,Rarity is a critical problem for anomalies and may cause inefficient feature learning.
randaugment-based pseudo anomaly generation,anomalies,Method proposed to simulate anomalies by creating local irregularities in normal samples to tackle the rarity challenge.
method,normal samples,Method utilizes both normal and abnormal samples effectively.
bg-spp loss,features,The loss function helps in learning more discriminative features by pulling normal features together and pushing abnormal features apart from the boundary.
mvtecad benchmark,sota results,Achieved state-of-the-art results on the MVTecAD benchmark with high performance.
anomaly detection methods,unsupervised,Most anomaly detection methods are unsupervised and only learn from normal samples.
autoencoder,gan,Examples of anomaly detection methods that are unsupervised.
unsupervised,autoencoder,unsupervised methods such as AutoEncoder are used to learn from normal samples
unsupervised,gan,unsupervised methods such as GAN are used to learn from normal samples
unsupervised,one-class-classification (occ) based methods,unsupervised methods are related to one-class-classification (OCC) based methods
pre-trained deep models,deepknn,pre-trained deep models include DeepKNN as a significant method
pre-trained deep models,gaussianad,pre-trained deep models include GaussianAD as a significant method
pre-trained deep models,spade,pre-trained deep models include SPADE as a significant method
pre-trained deep models,padim,pre-trained deep models include PaDiM as a significant method
pre-trained deep models,patchcore,pre-trained deep models include PatchCore as a significant method
anomaly detection methods,knowledge distillation,some anomaly detection methods are based on knowledge distillation
anomaly detection methods,feature reconstruction,some anomaly detection methods are based on feature reconstruction
anomaly detection methods,normalizing flows,some anomaly detection methods are based on normalizing flows
knowledge distillation,feature reconstruction,knowledge distillation and feature reconstruction are related methods in anomaly detection
knowledge distillation,normalizing flows,knowledge distillation and normalizing flows are related methods in anomaly detection
feature reconstruction,normalizing flows,feature reconstruction and normalizing flows are related methods in anomaly detection
anomaly detection methods,explicit separating boundary,anomaly detection methods differ from explicit separating boundary and BG-SPP loss by focusing on different aspects
out-of-distribution detection,unsupervised anomaly detection (ad),out-of-distribution detection is different from unsupervised anomaly detection (AD)
supervised ad,out-of-distribution detection,supervised AD focuses on a different task compared to out-of-distribution detection
supervised ad,unsupervised anomaly detection (ad),supervised AD differs from unsupervised anomaly detection (AD)
existing works,ad with outlier exposure,existing works include AD with outlier exposure as a similar approach
existing works,deep semi-supervised ad,existing works include deep semi-supervised AD as a similar approach
oe samples,state-of-the-art results,Utilizes thousands of OE samples to achieve state-of-the-art results on standard image AD benchmarks
deepsad,few anomalies,DeepSAD is the first deep model utilizing a few anomalies by generalizing the unsupervised DeepSVDD method to a semi-supervised AD setting
deepsad,"ruff, et al.","Ruff, et al. further modify the DeepSAD based on cross-entropy classification that concentrates nominal samples, this modification significantly improves the performance of DeepSAD"
fcdd,pseudo-huber loss,FCDD proposed in [24] extends the pseudo-Huber loss in [34] to construct a semi-supervised anomaly localization framework
deviation loss,anomaly scoring network,"Some works utilize the deviation loss to optimize an anomaly scoring network, in which the anomaly scores of normal samples are imposed to approximate scalar scores drawn from the prior while that of anomaly samples are enforced to have significant deviations from these normal scores"
dra,generalization to unseen anomalies,"The DRA model is the most similar to ours, which also considers the model’s generalization to unseen anomalies"
dra model,disentangled representations of anomalies,The DRA model can learn disentangled representations of anomalies to enable generalizable detection
anomalies,generalizable detection,Anomalies are mentioned in the context as a key concept and their detection is discussed in relation to enabling generalizable detection.
supervised ad,training set,"In supervised anomaly detection (AD), the training set consists of normal images and anomalies, denoted as Itrain = In ∪ Ia, where In = collection of normal samples and Ia are abnormal samples."
m0 anomalies,seen anomaly classes,"The M0 anomalies are randomly sampled from the seen anomaly classes Ss ⊂ S, where S = Ss ∪ Su represents all the seen and unseen anomaly classes."
model m,anomaly scores,The goal is to learn a model m : I → R that can assign larger anomaly scores to both seen and unseen anomalies than normal samples.
feature extractor f,conditional normalizing flow (cnflow),"The model consists of four parts: Feature Extractor f : I → X , Conditional Normalizing Flow (CNFlow) ϕθ : X → Z, Explicit Boundary Generating, and Boundary Guided Optimizing."
input features,training procedure,"The features extracted serve as input features for CNFlow, divided into normal and abnormal features, respectively, in the training procedure."
testing procedure,log-likelihoods,"In the testing procedure, the CNFlow assigns corresponding log-likelihoods for input features, which can be converted to anomaly scores."
learning normal feature distribution,normalizing flow,Normalizing Flow is discussed as part of learning normal feature distribution in the context.
anomaly scores,sec. 3.2,anomaly scores are related to Section 3.2 as mentioned in the context.
normal features,normalizing flow,normal features are learned using normalizing flow in the method described in the context.
normalizing flow,conditional normalizing flow,The method employs Conditional Normalizing Flow for learning normal feature distribution.
normalizing flow,coupling layers,"normalizing flow is made up of coupling layers, which implies a strong relationship between them."
input distribution,change of variables formula,The input distribution is calculated using the change of variables formula in the context.
parameters,log-likelihoods,The parameters are obtained by optimizing log-likelihoods across the training distribution.
coupling layers,fully connected layers,"coupling layers are usually implemented by fully connected layers, which suggests a direct relationship between them."
feature maps,spatial position relationship,Relationship between feature maps and spatial position is highlighted as being potentially impacted by the implementation of coupling layers using fully connected layers.
fully connected layers,spatial position relationship,The spatial position relationship is destroyed due to the flattening of 2D feature maps by fully connected layers.
spatial position relationship,positional information,"To preserve the positional information, 2D-aware position embeddings are added following [15]."
normalizing flow,normal feature distribution,Normalizing flow is employed to learn the normal feature distribution through maximum likelihood optimization.
latent variable distribution,multivariate gaussian distribution,The latent variable distribution is assumed to follow the multivariate Gaussian distribution as described in [15].
normal features,latent variables,Latent variables for normal features are assumed to follow a Gaussian distribution for simplicity during training.
logarithm function,derivative,The derivative of a logarithm function is calculated as the reciprocal of the argument of the logarithm function multiplied by the derivative of the logarithm function.
derivative,jacobian determinant,The Jacobian determinant is used in the calculation of the derivative of a function with multiple variables.
derivative,multivariate function,The derivative is applied to multivariate functions to calculate the rate of change in multiple dimensions.
jacobian determinant,matrix,The Jacobian determinant is represented as a matrix in computational mathematics.
jacobian determinant,partial derivatives,The Jacobian determinant involves the computation of partial derivatives with respect to the variables involved.
model,feature maps,The model overview mentions that the extracted feature maps are transformed into a latent space using a conditional normalizing flow (CNFlow). This indicates that there is a relationship between the model and feature maps.
feature maps,latent space,"The extracted feature maps are transformed into a latent space, as mentioned in the model overview. This suggests a relationship between feature maps and the latent space."
latent space,conditional normalizing flow (cnflow),"The latent space is transformed using a conditional normalizing flow (CNFlow), according to the model overview. This shows a relationship between the latent space and CNFlow."
anomaly score,feature,Anomaly scoring involves generating an anomaly score for each feature based on the log-likelihood distribution.
training procedure,two phases,The training procedure can be divided into two phases: explicit boundary generating and boundary guided optimizing.
normal sample,ml loss,Normal samples and ML loss are utilized for model training in the first phase to obtain a stable normal log-likelihood distribution.
explicit separating boundary,learned distribution,An explicit separating boundary can be obtained based on the learned normal log-likelihood distribution in the first phase of training.
normal feature distribution,maximum likelihood loss function,The maximum likelihood loss function is used for learning the normal feature distribution during training.
compact separating boundary,anomaly score distribution,The compact separating boundary is found based on the anomaly score distribution derived from the learned normal feature distribution.
normalizing flow,log-likelihood,Normalizing flow allows for estimating the exact log-likelihood logp(x) for each input feature x.
log-likelihood,input feature,The log-likelihood logp(x) for each input feature x can be estimated through a specific formula.
log-likelihood,likelihood,The log-likelihood logp(x) can be converted to likelihood using exponential function.
log-likelihood,anomaly score,The log-likelihood logp(x) can be converted to an anomaly score using a specific formula.
anomaly score,exponential function,The anomaly score is calculated using the exponential function s(x) = 1 - exp(logp(x)).
log-likelihood,separating boundary,The separating boundary in log-likelihood distribution is equivalent to the boundary in anomaly score distribution.
separating boundary,log-likelihood distribution,The separating boundary is obtained based on the log-likelihood distribution of features.
normal distribution,abnormal,Instances in the tail of the normal distribution are more likely to be misclassified as abnormal.
position hyperparameter β,distance from the boundary to the center,We define a position hyperparameter β to control the distance from the boundary to the center.
feature learning,hyperparameter τ,"To make the feature learning more robust, we further introduce a margin hyperparameter τ (e.g., τ = 0.1)."
boundary bn,normal false positive rate,"We select the β-th percentile (e.g., β = 1) of sorted normal log-likelihood distribution as the normal boundary bn, which also indicates the upper bound of the normal false positive rate is β%."
abnormal boundary ba,boundary bn,"We provide hyperparameter sensitivity analysis for β and τ in App. Table 12, it shows that our model is not very sensitive to β and τ."
normal,abnormal,"With the explicit normal and abnormal boundary, we propose a boundary guided semi-push-pull (BG-SPP) loss for more discriminative feature learning."
bg-spp loss,lbg−spp,The BG-SPP loss is defined as Lbg−spp in the given context
bg-spp loss,log-likelihood,The formulation of BG-SPP loss encourages the sparse log-likelihood distribution in the margin region
margin,region,The formulation of the BG-SPP loss focuses on the margin region for log-likelihood distribution
log-likelihood,anomalies,The extremely small log-likelihoods can be excluded outside the BG-SPP loss as they represent anomalies
log-likelihood,bg-spp loss,Minimizing the BG-SPP loss will encourage all log-likelihoods to distribute in specific regions
objective function,lml,The objective function in the second training phase includes Lml as part of its formulation
binary classification tasks,anomalies,"Anomalies are considered as positive samples in binary classification tasks, but models can overfit known anomalies and fail to generalize to unseen anomalies."
known anomalies,our method,"The serious bias issue of overfitting known anomalies can be mitigated by our method, which relies on normal feature distribution and does not heavily relate to abnormal samples."
our method,normal feature distribution,"Our method uses normal feature distribution to determine anomalies and form a more discriminative distribution, which helps in detecting unseen anomalies."
normal feature distribution,decision boundary,"The final decision boundary mainly depends on the normal distribution rather than known anomalies, aiding in better anomaly detection."
semi-push-pull mechanism,anomalies,"The semi-push-pull mechanism in our method pushes anomalies outside the margin region without enforcing them to deviate greatly from normal distribution, preventing model overfitting."
anomalies,normal samples,"Anomalies are generally much less than normal samples, causing inefficient feature learning."
feature learning,randaugment-based pseudo anomaly generation,"To address inefficient feature learning due to fewer anomalies, RandAugment-based Pseudo Anomaly Generation method is proposed."
randaugment,pseudo anomaly generation,RandAugment-based Pseudo Anomaly Generation (RPAG) strategy is proposed to simulate anomalies by randomly creating local irregularities
randaugment,appendix,The whole procedure of RPAG strategy is shown in the Appendix
randaugment,randaugment,RandAugment first selects K available image transformations to construct an augmentation set
randaugment,binary thresholding algorithms,Grayscale binary thresholding algorithms are used to effectively locate the foreground objects in the context of RandAugment
binary thresholding algorithms,foreground masking strategy,Grayscale binary thresholding algorithms are used as part of the foreground masking strategy to locate the foreground objects
randaugment,augment,RandAugment randomly selects an augmentation subset to augment an abnormal sample
parsing locations,object regions,Pasting Locations are limited to object regions to guarantee the semantics of simulated anomalies
pasting locations,foreground masking strategy,Foreground masking strategy is adopted for selecting pasting locations in the context of anomalies
object regions,foreground objects,Foreground objects are located in object regions to avoid anomalous regions
pasting anomalies,cropping anomalies,Pasting Anomalies and Cropping Anomalies are part of the procedure in the context
abnormal sample,anomalous regions,The abnormal sample contains anomalous regions which are cut and pasted to generate a simulated abnormal sample.
anomalous regions,normal sample,The anomalous regions are pasted back to the normal sample at the selected location to generate a simulated abnormal sample.
augmented abnormal sample,cutting anomalies,The augmented abnormal sample involves cutting anomalies.
cutting anomalies,cut,The cutting of anomalies is done by applying the Cut operation.
cutting anomalies,anomalies,The Cutting Anomalies process focuses on dealing with anomalies.
cutting anomalies,cropped anomalous regions,The Cutting Anomalies process involves cropping anomalous regions.
cropped anomalous regions,abnormal sample,The cropped anomalous regions are pasted back to the normal sample to generate a simulated abnormal sample.
synthetic anomalies,rpag strategy,The use of synthetic anomalies in RPAG strategy is compared with strategies from DRAEM and NSA.
authors,rpag strategy,The authors compare their RPAG strategy with strategies from DRAEM and NSA.
experiments,real-world applications,Experiments are conducted focusing on anomalies in real-world applications such as industrial defect inspection and medical lesion detection.
experiments,datasets,Experiments involve evaluating different datasets for anomaly detection.
anomaly detection,auroc,AUROC is used as a standard metric for anomaly detection.
auroc,image-level auroc,Image-level AUROC is used for evaluating anomaly detection.
auroc,pixel-level auroc,Pixel-level AUROC is used for evaluating anomaly localization.
ground-truth anomaly regions,per-region-overlap (pro) curve metric,"In order to weight ground-truth anomaly regions of various sizes equally, the Per-Region-Overlap (PRO) curve metric is adopted."
experimental settings,multi-class setting,The Multi-Class Setting is designed to evaluate the performance of AD models in detecting known anomalies.
multi-class setting,experimental setup,Multi-Class Setting is a part of the experimental setup designed to evaluate the performance of AD models in detecting known anomalies.
known anomalies,abnormal samples,Known anomalies are a few abnormal samples randomly drawn from existing anomaly classes in the test set in the Multi-Class Setting.
one-class setting,generalizability of ad models,One-Class Setting is designed to evaluate the generalizability of AD models in detecting unseen anomaly classes.
known anomalies,randomly sampled,Known anomalies are randomly sampled only from one anomaly class in the One-Class Setting.
bgad,ten random abnormal samples per category,BGAD is trained with ten random abnormal samples per category by default for training purposes.
known anomalies,pseudo anomalies,Pseudo anomalies are generated by RPAG based on known anomalies for training the BGAD.
test set,original test set,The test set in the settings is different from the original test set after removing known anomalies.
comparison,unsupervised and supervised ad methods,"For a fair comparison, all compared unsupervised and supervised AD methods are re-run under the same experimental setup as BGAD."
bgad,sota ad methods,BGAD is compared with the State-of-the-Art AD methods in the results under the Multi-Class Setting.
msfd,patchcore,MSFD is compared with PatchCore in terms of performance and results in Table 1 and Table 2.
msfd,cfa,MSFD is mentioned along with CFA in the context and compared with supervised methods.
patchcore,cfa,PatchCore and CFA are both mentioned as comparison methods in the context.
fcdd,devnet,FCDD and DevNet are supervised methods mentioned together in the context.
fcdd,dra,FCDD is compared with DRA as supervised methods in the context.
bgadw/o,nfad,BGADw/o is compared with NFAD and shown to achieve better results in anomaly detection.
bgadw/o,bgad,"Comparison between BGADw/o and BGAD is made, showing the performance improvement with the boundary guiding mechanism."
