node_1,node_2,edge
nfad,btad,NFAD is mentioned in comparison with BTAD in terms of anomaly localization performance.
ae-mse,ae-ssim,Comparison between AE-MSE and AE-SSIM is made in the context.
ae-mse,vt-adl,AE-MSE is compared with VT-ADL as baseline methods for anomaly localization performance.
ae-ssim,vt-adl,AE-SSIM is also compared with VT-ADL as baseline methods mentioned in the context.
bgad,nfad,BGAD surpasses unsupervised NFAD by 4.6%
bgad,unsupervised kdad,BGAD is compared with unsupervised KDAD in the context of anomaly detection performance
bgad,devnet,BGAD is compared with supervised DevNet in the context of anomaly detection performance
bgad,flos,BGAD is compared with FLOS in the context of anomaly detection performance
bgad,saoe,BGAD is compared with SAOE in the context of anomaly detection performance
bgad,mlep,BGAD is compared with MLEP in the context of anomaly detection performance
bgad,dra,BGAD is compared with DRA in the context of anomaly detection performance
model,anomaly,The model shows best performance in detecting unseen anomaly
model,diverse application datasets,The model outperforms compared methods on diverse application datasets
model,contender,The model achieves about 3.3%-12.9% mean AUROC increase compared to the best contender
model,generalizability,The model shows substantially better generalizability in detecting unseen anomaly
anomaly detection,supervised ad methods,Anomaly detection is compared to supervised AD methods in terms of generalizability in detecting unseen anomaly classes.
supervised ad methods,unsupervised baseline,Supervised AD methods are compared to an Unsupervised Baseline in terms of bias towards seen anomaly.
supervised ad methods,seen anomaly,Supervised AD methods are often biased by seen anomalies.
nfad,bgad,"NFAD is implemented as a baseline model with the same network structure as BGAD, but without explicit boundary guidance."
added abnormal samples,test set,Abnormal samples are removed from the test set to reproduce all compared methods under the same experimental setup for a fair comparison.
metal nut,pill,Metal nut and pill are part of the category of objects mentioned.
screw,toothbrush,Screw and toothbrush are part of the category of objects mentioned.
transistor,zipper,Transistor and zipper are part of the category of objects mentioned.
mean image-level mean,draem,Mean image-level mean is compared to DRAEM based on AUROC and PRO results.
padim,msfd,Comparison of PaDiM and MSFD based on their respective AUROC and PRO results.
unsupervised ad methods,patchcore,PatchCore is a method under the category of Unsupervised Anomaly Detection Methods
unsupervised ad methods,cfa∗,CFA∗ is a method under the category of Unsupervised Anomaly Detection Methods
unsupervised ad methods,nfad,NFAD is a method under the category of Unsupervised Anomaly Detection Methods
unsupervised ad methods,bgadw/o (ours),BGADw/o (Ours) is a method under the category of Unsupervised Anomaly Detection Methods
supervised ad method,bgad (ours),BGAD (Ours) is a method under the category of Supervised Anomaly Detection Methods
mvtecad dataset,auroc and pro results,The MVTecAD dataset is the source of data used to measure the performance of different models through AUROC and PRO results.
supervised ad methods,auroc and pro results,"The AUROC and PRO results show the performance of Supervised AD Methods like FCDD, DevNet, and DRA."
supervised ad methods,ten abnormal samples,Supervised AD Methods utilize Ten Abnormal Samples to train and test their models.
bgad (ours),auroc results,BGAD (Ours) has AUROC results that measure the performance of the model in the one-class setting.
known class,flipscratch,Known Class and FlipScratch are categories used in the evaluation of anomalies and baseline performance.
nfad,auroc results,NFAD has AUROC results that showcase its detection capabilities in anomaly classification.
nfad,devnet,NFAD and DevNet are models compared for their performance in anomaly detection.
nfad,devnet,"NFAD and DevNet are mentioned together in the context, indicating a relationship in terms of anomaly detection methods"
bgad,ours,"BGAD (Belonging to Us) is mentioned in conjunction with 'Ours', suggesting a relationship in terms of ownership or authorship"
nfad,bgad,"NFAD and BGAD are compared in terms of performance scores, indicating a relationship of comparison in anomaly detection capabilities"
categories,ae-mse,"Categories and AE-MSE are mentioned together, indicating a relationship in terms of evaluation metrics"
nfad,unsupervised baseline nfad,"NFAD and Unsupervised Baseline NFAD are compared in terms of model performance, with the former outperforming the latter across all datasets"
model,baseline nfad,"Model and Baseline NFAD are compared, highlighting the better generalizability and performance of the model over the baseline NFAD"
bias issue,method,The bias issue can be alleviated by our method.
ablation study,hard subsets,Experiments on hard subsets show the effectiveness of our model.
model,anomalies,The ablation study demonstrates that our model is more beneficial for harder anomaly classes.
easy subsets,hard subsets,Generalization to hard subsets shows the generalizability of the model.
easy subsets,training set,The easy subsets are used as the training set.
hard subsets,validation set,The model is validated on the hard subsets.
auroc results,one-class setting,AUROC results are provided under the one-class setting.
bgad,anomalies,"BGAD can generalize well to hard anomalies with performance gain by 2.3% and 2.2% AUROC, and 6.7% PRO."
bgad,bgad†,"BGAD† performs less effectively than BGAD, and even worse than the baseline NFAD, especially for some complex categories, e.g., Capsule, Screw, Transistor."
bgad†,anomalous features,BGAD†'s full pushing mechanism will encourage the anomalous features to deviate from the normal distribution at least a large enough bound.
bgad,normal features,"BGAD may generate larger anomaly scores for normal features, which will significantly reduce the AUROC metrics."
bgad,bg-spp loss,"The semi-push-pull mechanism in BGAD only changes the ambiguous region, which has less impact on the full normal and abnormal distributions, making it not generate larger anomaly scores."
bg-spp loss,model,The BG-SPP loss doesn’t make the model have the inclination to generate larger anomaly scores.
bg-spp loss,over-fitting,BG-SPP loss is more conducive to alleviating over-fitting of the model to the known anomalies.
bgad,anomaly localization,Our BGAD can generate more accurate anomaly localization maps.
bgad,log-likelihood distributions,Our BGAD can generate log-likelihood distributions that diminish the ambiguous regions.
devnet,known anomalies,The supervised DevNet is biased by the known anomalies.
msfd,unseen anomalies,MSFD fails to distinguish unseen anomalies from the normal data.
method,features,Our method can generate more discriminative features than the unsupervised MSFD.
supervised devnet,bgad,The context mentions that the proposed model BGAD is more discriminative compared to supervised DevNet. This indicates a relationship where BGAD is an advanced version or improvement over supervised DevNet.
bgad,ad model,BGAD is referred to as a novel and more discriminative AD model in the context. This establishes a direct relationship between BGAD and being an advanced or improved version of a generic AD model.
bgad,anomalies,The context states that the proposed model BGAD can effectively exploit a few anomalies to learn more discriminative features for distinguishing anomalies. This indicates a direct relationship between BGAD and the concept of anomalies.
unbiased issue,bgad,The context mentions that the proposed model BGAD can mitigate the bias issue with the explicit separating boundary and semi-push-pull mechanism. This establishes a relationship where BGAD is designed to address or solve the unbiased issue.
boundary guiding mechanism,supervised ad,The context mentions that the boundary guiding mechanism in the proposed model can inspire subsequent studies of supervised AD. This indicates a relationship where the boundary guiding mechanism has implications for the improvement or development of supervised AD techniques.
national natural science fund of china,bgad,"The context states that this work was supported in part by the National Natural Science Fund of China, indicating a relationship between the funding source and the development or implementation of the proposed model BGAD."
