node_1,node_2,edge
transformer layers,dense representations,We adopt Transformer layers to predict the dense representations for image targets.
attention pooling layer,linear projection,An attention pooling layer followed by a linear projection is used to predict the category embedding (supervised) or text embedding (weakly-supervised).
internimage-h,image encoder,We utilize InternImage-H as image encoder in Sec 4.1 for large-scale model pre-training.
vit-b/16,image-text dataset,"ViT-B/16 is used for ablation study and fair comparison in other experiments for image-text dataset (e.g., YFCC-15M)."
12-layer transformer,image-text dataset,"A 12-layer Transformer is used for image-text dataset (e.g., YFCC-15M)."
yfcc-15m,transformer,YFCC-15M and Transformer are utilized as text target encoder.
bert-base,transformer,BERT-Base and Transformer have the same network architecture.
imagenet-1k,linear classifier weight,The linear classifier weight from ImageNet-1k is used as category embedding target.
transformer,attention pooling,"Transformer is employed as decoder for image representation target, Attention Pooling for category embedding or text global feature."
imagenet-1k,appendix,Please see Appendix for detailed pre-training hyper-parameters of ImageNet-1k.
internimage-h,convnet-based image backbone,"InternImage-H is employed as image backbone, a ConvNet-based structure."
laion400m,yfcc-15m,LAION400M and YFCC-15M are public image-text pairs.
yfcc-15m,cc12m,"YFCC-15M is used for pre-training on public image-text pairs, along with CC12M."
imagenet-22k,imagenet,ImageNet-22k is used for pre-training on public image-category pairs for ImageNet.
coco,lvis,State-of-the-art performance achieved on COCO object detection and LVIS long-tailed object detection benchmarks.
coco,ade20k,State-of-the-art performance achieved on COCO object detection and ADE20k semantic segmentation benchmarks.
imagenet,m3i pre-training,M3I Pre-training achieves competitive performance on ImageNet classification.
m3i pre-training,public datasets,M3I Pre-training only employs pubic datasets for superior transfer performance.
m3i pre-training,pubic datasets,M3I Pre-training only employs pubic datasets
m3i pre-training,transfer performance,M3I Pre-training exhibits superior transfer performance
m3i pre-training,swinv2,M3I Pre-training is different from SwinV2
m3i pre-training,beit-3,M3I Pre-training is different from BEiT-3
m3i pre-training,fd,M3I Pre-training is different from FD
m3i pre-training,single-stage training paradigm,M3I Pre-training is an all-in-one single-stage training paradigm
m3i pre-training,simplicity,M3I Pre-training brings the advantage of simplicity
m3i pre-training,supervision signals,M3I Pre-training could make use of all available supervision signals
m3i pre-training,training data,M3I Pre-training could make use of all available training data
swinv2,beit-3,SwinV2 is different from BEiT-3
swinv2,fd,SwinV2 is different from FD
beit-3,fd,BEiT-3 is different from FD
[47],[78],[47] and [78] incorporate redundant multi-stage pre-training pipelines
[47],training data,[47] uses the same training data in multiple pre-training stages
[78],pre-trained model,[78] picks the pre-trained model in the previous pre-training stage as the target network for the next pre-training stage
[47],catastrophic forgetting,[47] consists of multiple pre-training stages which may lead to catastrophic forgetting
[78],catastrophic forgetting,[78] consists of multiple pre-training stages which may lead to catastrophic forgetting
[81],catastrophic forgetting,[81] consists of multiple pre-training stages which may lead to catastrophic forgetting
catastrophic forgetting,m3i pre-training,M3I Pre-training naturally avoids the catastrophic forgetting issue by learning different representational attributes
m3i pre-training,catastrophic forgetting issue,M3I Pre-training naturally avoids the catastrophic forgetting issue by learning different representational attributes simultaneously in one-stage pre-training.
m3i pre-training,modelpipelinepublic data,M3I Pre-training is part of the ModelPipeline with access to Public Data.
m3i pre-training,internimage-h,M3I Pre-training involves InternImage-H in the model pipeline.
m3i pre-training,masked image modeling,M3I Pre-training involves Masked Image Modeling in the model pipeline.
m3i pre-training,image classification,M3I Pre-training involves Image Classification in the model pipeline.
m3i pre-training,clip,M3I Pre-training involves CLIP in the model pipeline.
m3i pre-training,public datasets,M3I Pre-training demonstrates competitive classification performance with only public datasets.
m3i pre-training,large-scale private data,M3I Pre-training shows a contrast with all other methods which utilize large-scale private data.
public datasets,large-scale private data,Public datasets are mentioned in contrast to large-scale private data.
wit-400m,imagenet-22k-ext,Reference to datasets used by other methods like WIT-400M and ImageNet-22k-ext.
imagenet-22k-ext,image classification,ImageNet-22k-ext is correlated with the task of image classification.
m3i pre-training,previous best results,Comparison of M3I Pre-training with previous best results on tasks using only public training data.
m3i pre-training,amoat,M3I Pre-training is related to aMOAT.
m3i pre-training,group detr v2,M3I Pre-training is related to Group DETR v2.
m3i pre-training,glipv2,M3I Pre-training is related to GLIPv2.
m3i pre-training,mask dino,M3I Pre-training is related to Mask DINO.
self-supervised pre-training,auto-encoder,Various methods mentioned under Self-supervised Pre-training like Auto-Encoder.
self-supervised pre-training,instance discrimination,Instances like Instance Discrimination are related under Self-supervised Pre-training.
self-supervised pre-training,novel view synthesis,Relation between Self-supervised Pre-training and Novel View Synthesis.
m3i pre-training,ablation study,M3I Pre-training is part of the ablation study on different self-supervised pre-training methods under the framework.
tuning,pre-training method,tuning is related to Pre-training Method in the context of exploring different pre-training methods for image classification
image classification,best intra-view ssp,Image Classification is related to Best Intra-view SSP in the context of evaluating performance metrics for image classification tasks
image classification,best inter-view ssp,Image Classification is related to Best Inter-view SSP in the context of comparing different self-supervised pre-training methods
pre-training method,m3i pre-training w/o mix,Pre-training Method is related to M3I Pre-training w/o mix in the context of evaluating different pre-training approaches
pre-training method,m3i pre-trainingtop1,Pre-training Method is related to M3I Pre-trainingTop1 in the context of comparing the top-performing pre-training methods
ablation study,ablation settings,Ablation Study is related to Ablation Settings in the context of specifying experimental settings for the ablation study
vit-b/16,image backbone,ViT-B/16 is related to image backbone as the architecture used for image processing in the ablation study
pre-training schedule,400 epochs on imagenet-1k,pre-training schedule is related to 400 epochs on ImageNet-1k as the duration set for pre-training on the ImageNet-1k dataset
pre-training methods,transfer performance,pre-training methods are related to transfer performance in the context of evaluating the effectiveness of different pre-training approaches
coco detection,lvis detection,CoCO detection is related to LVIS detection as datasets used for evaluating pre-training methods
fine-tuning schedule,100 epochs for imagenet-1k,fine-tuning schedule is related to 100 epochs for ImageNet-1k as the duration set for fine-tuning on the ImageNet-1k dataset
fine-tuning,25 epochs,fine-tuning is related to 25 epochs as the duration set for fine-tuning on other datasets
ablation on self-supervised pre-training (ssp),mutual information framework,Ablation on Self-supervised Pre-training (SSP) is related to mutual information framework in the context of exploring various forms of SSP
mutual information framework,12 forms of ssp,mutual information framework is related to 12 forms of SSP as proposed types of self-supervised pre-training
masked input,full input,masked input is related to full input in the context of comparing the impact of masking on model performance
model's performance,gap for interview pre-training,"Observation shows that the gap for interview pre-training becomes smaller, which may be due to predicting another view constituting a more challenging task and reducing information redundancy to some extent."
dense feature,global feature target,"Compared to the global feature target, the dense feature target enables the spatial discrimination ability of the network."
dense feature,dense pixels,"Compared to dense pixels, dense features represent the target in high-level semantic space and thus bring semantic alignment capacity."
intra-view,inter-view,"The choice of intra-view or inter-view pre-training depends on whether the input data is masked or not. If full input is adopted, inter-view generally performs better than intra-view."
imagenet,fine-tuning,ImageNet is a dataset used for fine-tuning models in the context of deep learning
imagenet,linear classification,ImageNet is commonly used for linear classification tasks in deep learning
imagenet,top1 acc.,ImageNet Linear Classification has Top1 accuracy as a key evaluation metric
imagenet,zero-shot transfer setting,ImageNet without Fine-tuning is related to zero-shot transfer setting for weakly-supervised pre-training
deit-iii,supervised pre-training,DeiT-III is a supervised pre-training method compared with other state-of-the-art methods
data2vec,ibot,data2vec and iBOT are compared in terms of their performance
siameseim,clip,SiameseIM and CLIP are compared as self-supervised pre-training methods
m3i pre-training,single-input single-target pre-training methods,"Comparison between M3I Pre-training and single-input single-target pre-training methods shows that M3I Pre-training w/o mix can achieve superior or comparable results on all tasks, especially on LVIS and ADE20k benchmarks."
m3i pre-training w/o mix,single-input single-target pre-training methods,"M3I Pre-training w/o mix compared with single-input single-target pre-training methods demonstrates its superior or comparable results on various tasks, particularly on LVIS and ADE20k benchmarks."
m3i pre-training w/o mix,image classification pre-training,"M3I Pre-training w/o mix shows high results on LVIS and ADE20k datasets due to Image Classification pre-training focusing on better semantic information, essential for understanding long-tail classes."
m3i pre-training w/o mix,intra-view ssp,"M3I Pre-training w/o mix benefits from Intra-view SSP's excellence in spatial sensitivity, leading to good performance on the COCO dataset."
m3i pre-training w/o mix,m3i pre-training,"M3I Pre-training w/o mix leverages the benefits of M3I Pre-training by combining multiple pre-training methods effectively, resulting in better performances on all tasks."
m3i pre-training,vit-b/16 image backbone,Comparison between M3I Pre-training and previous methods using the same ViT-B/16 image backbone is discussed in Tab. 4 for system-level comparison.
m3i pre-training,previous methods,Comparison between M3I Pre-training and previous methods using the same ViT-B/16 image backbone
m3i pre-training,sp,"M3I Pre-training achieves comparable results with previous methods on all tasks, showing its effectiveness"
m3i pre-training,wsp,"M3I Pre-training can achieve zero-shot transfer learning, not achievable by other pre-training methods"
m3i pre-training,ssp,"M3I Pre-training demonstrates better localization ability, important for dense prediction tasks"
single-stage pre-training,mainstream pre-training approaches,The single-stage pre-training framework proposed in the context unifies mainstream pre-training approaches.
multi-input multi-target setting,previous multi-task pre-training methods,The multi-input multi-target setting shows that previous multi-task pre-training methods are optimizing a lower bound of the mutual information.
all-in-one pre-training method,m3i pre-training,"The all-in-one pre-training method, M3I Pre-training, surpasses previous pre-training methods in various transfer-learning settings."
vision-centric pre-training,other domains,The proposed framework for vision-centric pre-training can be applied to other domains like natural language processing or visual-linguistic tasks.
national natural science foundation of china,national key r&d program of china,The work is partially supported by the National Natural Science Foundation of China and the National Key R&D Program of China.
national natural science foundation of china,shanghai committee of science and technology,The work is partially supported by the National Natural Science Foundation of China and in part by the Shanghai Committee of Science and Technology.
