node_1,node_2,edge
degpr,relative error for iel counts,"DEGPR leads to a drastic reduction of 18-43% points in RELATIVE error for IEL counts, showing effectiveness"
degpr,consep dataset,"DEGPR performs stronger than baselines on the CoNSep dataset, but counting results are generally weak due to high cell density"
degpr,model predictions,DEGPR is qualitatively illustrated in model predictions
image,bounding boxes,Bounding boxes are annotations that define the boundaries of objects in an image
image,predictions,Predictions are the output of a model that attempts to classify or detect objects in an image
yolov5,baseline model,Yolov5 is compared to a baseline model in terms of predictions and performance
predictions,baseline model,Both predictions and baseline model are used to evaluate the performance of the models
q-ratiomeasure,accuracy,Accuracy is a key metric based on Q-RatioMeasure for evaluating the performance of a model
muced,consep,MuCeD and CoNSeP are datasets used for counting and localization
unet,countception,UNet and Countception are counting models used for detection
yolov5,degpr,Yolov5 with DEGPR is a model used for counting and localization
degpr,patient samples,DEGPR is used to improve prediction accuracy and F1-score for patient samples
cells,misclassification,Improvement in predicting missing cells results in a reduction in misclassification errors
patient samples,q-histology ratio,Patient samples in MuCeD are classified based on the Q-histology ratio
counting,detection,Performance comparison between counting via detection (Yolov5+DEGPR) vs density map based methods
models,class,Models are trained separately for each class.
approach,methods,The approach outperforms all other methods by vast margins.
detection,setting,Detection in a multi-class setting is computationally convenient.
counts,cell types,Counts of all cell types are obtained from a single object detector.
mcspatnet,performance,Comparison with MCSpatNet shows improved performance with DEGPR.
ablation analysis,components,Ablation analysis is performed to understand the relative contributions of different components in the final performance.
study,muced,Study on MuCeD is run using Yolov5 and the results are reported in Table 4.
features,performance metrics,"Introduction of explicit features improves precision and mAP, while implicit features improve mAP and reduce MAE."
features,information,Implicit and explicit features capture complementary information.
encoder,pre-training,Class imbalance is mitigated during contrastive pre-training of the encoder.
batches,data augmentations,"Class-balanced sampling is performed while creating batches, along with additional data augmentations for robustness."
error analysis,model,"Error analysis is performed for the best model on MuCeD, identifying common failure modes."
error analysis,best model,Error analysis was performed for the best model on MuCeD.
error analysis,common failure modes,Error analysis revealed common failure modes associated with misclassifying IELs as ENs.
best model,error analysis,The best model was analyzed for errors in error analysis.
best model,muced,The best model was tested on the MuCeD dataset.
common failure modes,more errors in misclassifying iels as ens,Common failure modes highlighted more errors in misclassifying IELs as ENs.
common failure modes,reverse,More errors were observed in misclassifying IELs as ENs rather than in reverse.
common failure modes,iels,Common failure modes mentioned that more errors occurred in misclassifying IELs as ENs.
common failure modes,ens,Common failure modes mentioned that more errors occurred due to misclassification of IELs as ENs.
iels,ens,Misclassification of IELs as ENs was highlighted in the error analysis.
iels,ens,The error analysis pointed out that more errors happened when classifying IELs as ENs.
iels,ens,Misclassifying IELs as ENs was more frequent than vice versa according to the error analysis.
iels,ens,Misclassification of IELs as ENs was more common in the error analysis.
iels,circular,"When an IEL overlaps an elongated EN, errors may occur due to the shape appearing elongated."
en,circular,The overall shape may appear elongated when an IEL (circular) overlaps an EN (elongated).
darker stained images,more errors,"Darker stained images generally lead to more errors, possibly due to diminished intensity differences between cell types."
image,more errors,Images with darker stains tend to have more errors in the predictions.
intensity differences,cell types,Intensity differences between cell types may influence the errors in prediction.
cell types,diminished intensity differences,Errors may be more prevalent when there are diminished intensity differences between cell types.
en cells,lightly stained,EN cells may be missed when they are very lightly stained.
mc2dc,multi-class cell detection and counting,The study focused on multi-class cell detection and counting problems (MC2DC) over medical histopathological images.
mc2dc,limited data setting,The study investigated multi-class cell detection and counting problems in a limited data setting.
degpr,deep guided posterior regularization,The solution utilized by the study was Deep Guided Posterior Regularization (DEGPR).
degpr,additional regularization terms,DEGPR imposed additional regularization terms to incentivize the model for outputting posterior distribution of features over predicted bounding boxes.
model,posterior distribution,The model outputted a posterior distribution of features over predicted bounding boxes as guided by DEGPR.
degpr,ground truth,DEGPR aimed to output posterior distribution of features similar to that of ground truth for each cell class.
degpr,features,DEGPR utilized two types of features: explicit and implicit.
degpr,explicit features,DEGPR included explicit features generally provided by a domain expert.
degpr,implicit features,DEGPR used implicit features trained automatically using supervised contrastive loss over labeled data.
dataset,55 duodenum biopsies,The study contributed a novel dataset of 55 duodenum biopsies for predicting celiac disease.
dataset,improvements,The novel dataset led to improvements in the performance of object detection backbones.
dataset,predicted celiac disease,The dataset was useful for predicting celiac disease.
dataset,experimenting,The dataset was used for experimenting on two publicly available datasets.
degpr,effective,DEGPR was effective in enhancing the performance of object detection backbones.
degpr,detection and counting metrics,DEGPR showed substantial improvements in both detection and counting metrics.
model,f-score,The F-score of the model in predicting celiac was improved as a consequence of using DEGPR.
model,predicting celiac,The model's F-score in predicting celiac disease was enhanced by implementing DEGPR.
detection metrics,counting metrics,"Both detection and counting metrics are mentioned in the context, indicating a relationship in terms of metrics evaluation."
f-score,model,"The F-score of the model in predicting celiac disease is mentioned, indicating a relationship between the F-score and the model."
f-score,celiac disease,"The F-score of the model in predicting celiac disease is highlighted, indicating a relationship between the F-score and celiac disease."
model,prediction,"The model is involved in predicting celiac disease, indicating a relationship between the model and prediction."
code,data,"The code and data are released for further research, indicating a relationship between code and data."
iitd-aiims multi-institutional faculty interdisciplinary research project,icmr grant,"The support for the work is mentioned to be primarily from the IITD-AIIMS Multi-Institutional Faculty Interdisciplinary Research Project and an ICMR grant, indicating a relationship between the two sources of support."
icmr grant,automated grading of duodenal mucosal biopsies,"The ICMR grant is mentioned in the context of automated grading of duodenal mucosal biopsies, indicating a relationship between the grant and the process."
jai gupta chair fellowship,iit delhi,"The Jai Gupta chair fellowship from IIT Delhi is mentioned, indicating a relationship between the fellowship and the institution."
yardi school of ai,travel and honorarium grants,"The Yardi School of AI is mentioned to provide travel and honorarium grants, indicating a relationship between the school and the grants."
iit delhi,hpc facility,"The IIT Delhi HPC facility is thanked for computational resources, indicating a relationship between the institution and the computational resources."
