node_1,node_2,edge
image-based editing method,blended diffusion,"The image-based editing method, including Blended Diffusion, reaches a high CLIP score."
image-based editing method,dccf,"The image-based editing method, including DCCF, reaches a high CLIP score."
stable diffusion,quality,The generated result from Stable Diffusion is much more plausible according to the FID and QS.
approach,best performance,"Our approach achieves the best performance on all of these three metrics, verifying its ability to generate high-quality images and maintain the conditional information."
user study,user's subjective evaluation,"In order to obtain the user’s subjective evaluation of the generated image, a user study is conducted."
user study,subjective evaluation,The user study is conducted in order to obtain the user’s subjective evaluation of the generated image.
user study,participants,The user study is conducted on 50 participants who were students without relevant backgrounds.
user study,image quality,Participants in the user study rank the score from 1 to 5 on two perspectives independently: the image quality and the similarity to the reference image.
image quality,reference image,Users are asked to rank the image quality and the similarity to the reference image from 1 to 5.
image quality,ranking score,The average ranking score of image quality and semantic consistency is reported in Table 2.
dccf,reference image,The image harmonization method DCCF is most similar to the reference image since it’s directly copied from it.
users,results,Users prefer the results of the study more than others given the realistic quality of the results.
content bottleneck,classifier-free guidance,The content bottleneck is mentioned as a part of the process and later classifier-free guidance is used to improve performance.
image quality,semantic consistency,The average ranking score includes both image quality and semantic consistency rated by users.
image quality,semantic consistency,"Both are key aspects of evaluating images. Users rated the image quality as the best, and semantic consistency is second only to the image harmonization method which copies from the exemplar image."
image quality,image harmonization method,"The image quality was rated as the best quality, with the image harmonization method being mentioned in comparison to semantic consistency in terms of ranking."
semantic consistency,image harmonization method,Semantic consistency was mentioned in comparison to the image harmonization method which copies from the exemplar image.
image editing,techniques,"Key techniques are introduced to achieve high-quality exemplar-based image editing, which include leveraging image prior, strong augmentation, content bottleneck, and classifier-free guidance."
exemplar-based image editing,key techniques,"Key techniques are introduced to achieve high-quality exemplar-based image editing, which include leveraging image prior, strong augmentation, content bottleneck, and classifier-free guidance."
image editing,setting,Five gradually changed settings are performed to validate the key techniques introduced for achieving high-quality exemplar-based image editing.
baseline solution,boundary artifacts,"The baseline solution contains obvious boundary artifacts, resulting in the generated image being extremely unnatural."
image quality,fid score,"By leveraging the image prior, the image quality improved according to the lower FID score."
image quality,fid score,The image quality improved according to the lower FID score.
image quality,copy-and-paste issue,"However, it still suffers from the copy-and-paste issue."
augmentations,copy-and-paste issue,Adding augmentations can partially alleviate the copy-and-paste issue.
content bottleneck technique,boundary artifacts,"When we further leverage the content bottleneck technique to compress the information, these boundary artifacts could be completely eliminated."
mask region,quality of this region,"As the mask region should be generated instead of directly copied, the quality of this region will decrease."
generator,quality of this region,The quality of this region will decrease because the difficulty of the generator increased significantly.
classiﬁer-free guidance,generated region,"Finally, we add the classifier-free guidance to make the generated region more similar to the reference, it greatly boosts the overall image quality and achieves the best performance."
classiﬁer-free guidance,generated region,Effect of classifier-free guidance scale λ. A larger λ makes the generated region more similar to the reference.
framework,source image,Our framework can synthesize realistic and diverse results from the same source image and exemplar image.
framework,reference image,"Key identity of the reference image. e.g., all the dogs have yellow fur, white chests and drooping ears."
exemplar-based image editing,paint by example,Introduces a novel image editing approach that semantically alters image content based on an exemplar image
boundary artifacts issue,group of techniques,"The boundary artifacts issue is solved by proposing techniques such as leveraging image prior, strong augmentation, content bottleneck, and classifier-free guidance"
algorithm,editing,The algorithm enables precise control over editing
editing,in-the-wild images,Impressive performance of editing is achieved on in-the-wild images
work,baseline,The work serves as a solid baseline for future research in exemplar-based image editing area
work,support,The work helps support future research in exemplar-based image editing area
national key r&d program of china,grant 2020aaa0108600,The work was supported in part by the National Key R&D Program of China under Grant 2020AAA0108600
national natural science foundation of china,grants 62076230 and 62032006,The work was supported in part by the National Natural Science Foundation of China under Grants 62076230 and 62032006
scale,result,"Investigation shows that the scale λ affects the result, with larger values making the generated region more similar to the reference input"
experiment,λ = 5,"In the experiment, the scale λ is set to 5 by default"
language,image condition,A comparison of controlla between language and image condition is provided
language,image,"Comparison of controllability between language and image, as language becomes more precise, generated results become more similar to the reference image"
language,reference image,"As language becomes more precise, generated results become more similar to the reference image"
image,reference image,"Comparison of controllability between language and image, as language becomes more precise, generated results become more similar to the reference image"
language,image-guided result,Existence of a large gap between language and image-guided result
generated results,reference image,Generated results become more similar to the reference image as language becomes more precise
image-guided result,generated results,Large gap exists between image-guided result and generated results
our method,stochasticity,"Benefiting from the stochasticity in the diffusion process, our method can generate multiple outputs from the same input"
our method,multiple outputs,Our method can generate multiple outputs from the same input
our method,diverse generated results,Showing diverse generated results
synthesized images,diverse generated results,"Although the synthesized images vary, all of them keep the diverse generated results"
