node_1,node_2,edge
image editing,language-guided image editing,"Language-guided image editing is the abstract concept mentioned in the context. It has achieved success recently, leading to further investigation into exemplar-guided image editing."
image editing,exemplar-guided image editing,Exemplar-guided image editing is the focus of the investigation in the context for more precise control of image editing.
image editing,editing process,"The goal is to achieve more precise control in the image editing process, requiring disentanglement and re-organization of source images and exemplars."
image editing,diffusion model,"The whole framework of image editing involves a single forward of the diffusion model without any iterative optimization, showcasing impressive performance and controllability."
image editing,ai-based techniques,"AI-based techniques significantly lower the barrier of fancy image editing, making it more accessible without specialized software or manual operations."
editing process,exemplar image,"To ensure controllability of the editing process, an arbitrary shape mask for the exemplar image is designed to increase similarity to the exemplar image."
editing process,content bottleneck,A content bottleneck and strong augmentations are proposed to avoid trivial solutions like directly copying and pasting exemplar images in the editing process.
editing process,classiﬁer-free guidance,"Classifier-free guidance is leveraged to increase similarity to the exemplar image in the editing process, ensuring controllability and precise editing."
editing process,solutions,"The proposed framework aims to avoid obvious fusing artifacts and trivial solutions in the editing process, highlighting the importance of precise control and disentanglement."
image editing,specialized software,Specialized software is traditionally required for fancy image editing operations.
deep neural networks,low-level image editing tasks,Deep neural networks can produce compelling results for various low-level image editing tasks.
image editing,image inpainting,Image inpainting is one of the tasks that deep neural networks can produce compelling results for in image editing.
image editing,semantic image editing,Semantic image editing manipulates the high-level semantics of image content while preserving image realism.
semantic image editing,generative models,Semantic image editing relies on the semantic latent space of generative models for manipulating high-level semantics of image content.
gans,semantic image editing,Generative Adversarial Networks play a role in semantic image editing by utilizing the semantic latent space of generative models.
large-scale language-image models,complex images,Large-scale language-image models have shown unprecedented generative power in modeling complex images.
large-scale language-image models,image manipulation tasks,Large-scale language-image models enable various image manipulation tasks.
text prompt,image editing,Text prompt can guide image editing for general images.
fine-grained object appearances,plain language,"The context mentions that fine-grained object appearances are hard to specify by plain language, indicating a relationship between them in terms of difficulty in description."
intuitive approach,fine-grained image editing,"It is crucial to develop an intuitive approach to ease fine-grained image editing, suggesting a relationship between the two in terms of necessity for simplification."
image content,exemplar image,"An exemplar-based image editing approach allows accurate semantic manipulation on the image content based on an exemplar image provided by users or retrieved from the database, indicating a direct relationship between them."
picture,thousand words,"The saying 'a picture is worth a thousand words' implies that images convey desired image customization more effectively than words, indicating a relationship of efficiency and expressiveness between them."
image harmonization,color and lighting correction,"Image harmonization focuses on color and lighting correction when compositing foreground objects, contrasting with the more complex task of semantically transforming exemplars in image editing, indicating a difference in scope between the two."
diffusion model,exemplar image,"The diffusion model mentioned in the context is conditioned on the exemplar image, suggesting a direct relationship between them in terms of model training."
triplet training pairs,"source image, exemplar, editing ground truth","Collecting triplet training pairs comprising source image, exemplar, and corresponding editing ground truth is a challenge, indicating a relationship of difficulty in data collection between the two."
image,exemplar,Images are referred to as 'image' and 'exemplar'. The exemplar serves as a reference during training the inpainting model.
image,editing ground truth,The editing ground truth is associated with the input image in the context of training the inpainting model.
exemplar,input image,Exemplar and input image are mentioned together in the context of training the inpainting model.
input image,inpainting model,"The input image is referenced when training the inpainting model, indicating a relationship between them."
model,self-reference setting,The model is trained in a self-reference setting where the reference object is copied and pasted into the final output.
self-reference setting,generative prior,A generative prior is utilized in the self-reference setting to avoid copy-and-paste solutions.
model,content bottleneck,A content bottleneck is introduced to the model for self-reference conditioning to understand high-level semantics and prevent trivial results.
self-reference image,aggressive augmentation,Aggressive augmentation is applied to the self-reference image to reduce the training-test gap.
approach,training,The approach focuses on improving editability through training with irregular random masks.
training,random masks,The training uses irregular random masks to mimic the casual user brush used in practical editing.
classiﬁer-free guidance,image quality,Classiﬁer-free guidance is proven to boost both the image quality and the style resemblance to the reference.
classiﬁer-free guidance,style resemblance,Classiﬁer-free guidance is proven to boost both the image quality and the style resemblance to the reference.
paint by example,image editing approach,"The proposed method, Paint by Example, well solves semantic image composition problem and offers fine-grained control while being convenient to use."
paint by example,exemplar image,Paint by Example semantically alters the image content based on an exemplar image.
diffusion model,image-specific optimization,"The editing just involves a single forward of the diffusion model without any image-specific optimization, which is necessary for many real applications."
image editing approach,self-supervised manner,"The problem is solved with an image-conditioned diffusion model trained in a self-supervised manner, offering fine-grained control while being convenient to use."
techniques,degenerate challenge,A group of techniques is proposed to tackle the degenerate challenge in image editing.
approach,prior arts,"Our approach performs favorably over prior arts for in-the-wild image editing, as measured by both quantitative metrics and subjective evaluation."
image composition,foreground,Cutting the foreground from one image and pasting it on another image into a realistic composite is a common and widely used operation in photo editing.
image composition,pasting,Cutting the foreground from one image and pasting it on another image into a realistic composite is a common and widely used operation in photo editing.
image,foreground image,Foreground image is a specific type of image used in semantic image composition
foreground image,semantic generation pyramid,Semantic Generation Pyramid achieves semantic image composition by combining the deep features of the foreground image
semantic generation pyramid,background image,Semantic Generation Pyramid combines the deep features of the foreground image and background image in semantic image composition
foreground image,background image,Foreground image and background image are both part of semantic image composition
foreground image,human comprehensible neural filters,DCCF proposes four human comprehensible neural filters in a pyramid manner for color harmonization
background image,semantic generation pyramid,Semantic Generation Pyramid achieves semantic image composition by combining the deep features of the background image
image,composite,"Composite image is formed by pasting one image on another, a common operation in photo editing"
image,image editing,Image editing involves operations like pasting one image on another to achieve desired results
image,semantic image editing,"Semantic image editing focuses on editing the high-level semantics of an image, of great interest in vision and graphics community"
semantic image editing,gan’s latent space,Semantic image editing dissects the GAN’s latent space to find semantic disentangled latent factors
gan’s latent space,semantic disentangled latent factors,The GAN’s latent space is carefully dissected to find semantic disentangled latent factors.
attribute classifier,face recognition model,Research efforts leverage the discriminant model like attribute classifier or face recognition model to help disentangle and manipulate images.
semantic mask,image editing,Works utilize semantic mask to control the editing of images.
model,general and complex images,The focus is on introducing a model that works for general and complex images in a high-precision manner.
semantic image editing,text-guided image editing,Text-guided image editing has been attracting increasing attention recently among various kinds of semantic image editing.
pretrained gan generators,text encoders,Early works leverage pretrained GAN generators and text encoders to progressively optimize the image according to the text prompt.
gan-based manipulation approaches,editing images of complex scenes or various objects,GAN-based manipulation approaches struggle on editing images of complex scenes or various objects due to the limited modeling capability of GANs.
diffusion models,synthesizing high-quality and diverse images,The rapid rise and development of diffusion models have shown powerful capability in synthesizing high-quality and diverse images.
diffusion models,text-driven image editing,Many works exploit diffusion models for text-driven image editing.
diffusionclip,dreambooth,These are methods mentioned in the context for performing local manipulation using a user-provided mask.
blended diffusion,language guidance,"Blended Diffusion proposes a blended process to perform local manipulation, and the language guidance is mentioned as lacking precise control."
blended diffusion,images,"The work discusses that while Blended Diffusion achieves impressive results, the authors argue that images can better express concrete ideas."
exemplar-based image editing,text-based image editing,The context contrasts exemplar-based image editing with the recent success of text-based image editing in expressing complex and multiple ideas.
images,verbal descriptions,It is mentioned in the context that verbal descriptions are difficult to use alone to express complex and multiple ideas compared to images.
images,people's intentions,The proverb 'a picture is worth a thousand words' is referenced to highlight that images can be a better alternative for conveying people's intentions.
edit region,binary mask,The edit region is represented as a binary mask specifying the editable positions in the source image.
source image,reference image,The source image is merged with the reference image in exemplar-based image editing.
image synthesis,source image,The goal is to synthesize an image from the source image given a reference image containing the desired object.
synthesize,image,"The goal is to synthesize an image from xs, xr, m in a way that the region with m=0 remains the same as xs while the region with m=1 depicts the object similar to xr."
model,understanding,The model needs to understand the object in the reference image capturing both shape and texture while ignoring background noise.
model,synthesizing,"The model enables synthesizing a transformed view of the object (different pose, size, illumination) that fits nicely in the source image."
model,inpaint,The model needs to inpaint the area around the object to generate a realistic photo with a smooth transition across the merging boundary.
model,super-resolution,The model should involve super-resolution in the process as the resolution of the reference image may be lower than the edit region.
training,self-supervised,"Due to the impossibility of collecting and annotating paired data, self-supervised training is proposed to simulate training data for exemplar-based image editing."
training,simulate,"To simulate the training data, given an image and the bounding box of an object in the image, self-supervised training is performed."
image,bounding box,An image is associated with a bounding box to define the location of an object within the image.
binary mask,complementary mask,"The binary mask is used to represent the object in the image, while the complementary mask represents the part of the image not covered by the object."
image patch,reference image,The image patch within the bounding box is considered as a reference image for editing and manipulation purposes.
source image,original image,"The source image is the original image on which editing is performed, and the editing result should ideally resemble the original source image."
naive solution,diffusion models,"Diffusion models are mentioned as a solution to a problem in image editing, and a naive approach is described to directly replace certain conditions with reference images."
markov forward process,diffusion model,"The diffusion model involves a Markov forward process for generating images, where noisy images are gradually reversed to create the final image."
noisy image,condition,The diffusion model progressively denoises a noisy image based on a given condition by minimizing a loss function.
original image,patch,The patch from the original image is mentioned in the context.
model,trivial mapping function,The challenge is to prevent the model from learning a trivial mapping function.
model,self-supervised training,The challenge is to facilitate model understanding in a self-supervised training manner.
content bottleneck,network,The content bottleneck is introduced to force the network to understand and regenerate the content of the reference image.
strong augmentation,train-test mismatch issue,Strong augmentation is adopted to mitigate the train-test mismatch issue.
network,transformation,The network learns the transformation from the exemplar object and the background.
exemplar-based image editing,controllability,Controllability is a critical feature for exemplar-based image editing.
control,shape,Control over the shape of the edit region and the similarity degree is enabled.
edit region,reference,Control is enabled over the shape of the edit region and the similarity degree between the edit region and the reference.
text condition,image condition,Difference between text condition and image condition is re-analyzed.
(cid:3365),(cid:2195),"The two concepts are related to the description of an image processing or computer vision technique, possibly involving data augmentation."
(cid:2206),(cid:3046),These terms are linked to the concept of manipulating or enhancing the shape of a crop mask in the context of image processing.
cropmask shape augmentation,(cid:2207),"The first term is directly related to the action of augmenting the shape of a crop mask, which likely involves altering the size or contours of the mask."
(cid:2207),(cid:3047),"These terms are connected in the process of modifying or improving the shape of a crop mask, potentially through transformation or distortion techniques."
(cid:2879),(cid:2869),"The two concepts refer to a training pipeline or process for a certain task, likely involving the utilization of models or algorithms."
augmentation,class token,The augmentation process appears to utilize the class token of a pre-trained CLIP image encoder to enhance or change certain features of the image data.
dimension 1024,high-frequency details,"The dimension of 1024 is related to ignoring high-frequency details in the compressed representation, indicating a trade-off between data size and level of detail."
semantic information,high-frequency details,"The semantic information is maintained by the compressed representation while ignoring high-frequency details, highlighting the emphasis on meaning over specific visual details."
network,generator,"The network is responsible for understanding the reference content, while the generator is prevented from directly copying and pasting, indicating different roles in the training process."
generator,optimal results,"The generator's behavior of copy-and-pasting is restricted to achieve optimal results in training, suggesting a need for creative synthesis rather than direct replication."
expressiveness,additional fully-connected (fc) layers,"The consideration of expressiveness leads to the addition of fully-connected layers to decode features and enhance the diffusion process, suggesting a focus on capturing complex information."
feature,diffusion process,"The feature is injected into the diffusion process through cross attention, indicating a mechanism for incorporating specific characteristics into the overall data flow."
image prior,trivial solution,"The concept of an image prior is introduced to avoid the trivial solution of directly remembering the reference image, implying a strategy to prevent straightforward copying in favor of more nuanced approaches."
diffusion model,well-trained,"The diffusion model is highlighted as being well-trained, suggesting a level of expertise or optimization in the model's ability to diffuse information effectively."
"text-to-image generation model, stable diffusion [51]",latent space,"The text-to-image generation model is associated with the latent space, indicating a connection between textual descriptions and visual representations in the generation process."
pretrained clip [44] model,language information,"The pretrained CLIP model is utilized for extracting language information, suggesting a role in bridging textual and visual data for processing and analysis."
pretrained clip model,language information,"The pretrained CLIP model is utilized to extract the language information, which shares a similar representation to our adopted CLIP image embedding, making it a good initialization."
data augmentation techniques,reference image,"To reduce the gap between training and testing scenarios, data augmentation techniques such as flip, rotation, blur, and elastic transform are adopted on the reference image to break down the connection with the source image."
mask region,bounding box,"The mask region from the bounding box ensures that the reference image contains a whole object, leading the generator to learn to fill an object as completely as possible."
curve,point,Points are sampled uniformly on the curve and connected to form a mask.
offsets,coordinates,Offsets are added randomly to the coordinates of the points on the curve.
mask,random distortions,Random distortions on the mask break the inductive bias.
mask,training and testing,Random distortions on the mask reduce the gap between training and testing.
mask shape augmentation,control over mask shape,Mask shape augmentation increases control over mask shape in the inference stage.
rectangle mask,mask area,A rectangle mask may not represent the mask area precisely.
irregular mask shapes,training,Involving irregular mask shapes in training helps the model generate photo-realistic results.
edited area,reference image,Controlling the similarity degree between the edited area and the reference image is important.
s,conditional reference input,A larger scale factor s means the fusion result relies more on the conditional reference input.
reference conditions,learnable vector v,20% of reference conditions are replaced with a learnable vector v during training.
denoising step,modified prediction,Each denoising step uses the modified prediction formula.
"t, ¯m(cid:3)xs",omitted,Parameters t and ¯m(cid:3)xs are omitted here for brevity.
framework,method,The overall framework of the method is illustrated in Figure 3.4.
text-to-image generation model,stable diffusion,"A powerful text-to-image generation model, Stable Diffusion, is utilized as initialization for manipulating real-world images."
training dataset,openimages,"OpenImages is selected as the training dataset, containing a total of 16 million bounding boxes for 600 object classes on 1.9 million images."
image resolution,512×512,"During training, the image resolution is preprocessed to 512×512."
model training,40 epochs,"The model is trained for 40 epochs, taking about 7 days on 64 NVIDIA V100 GPUs."
semantic image edit,exemplar-based,No previous works target exemplar-based semantic image editing.
nvidia v100 gpus,test benchmark,NVIDIA V100 GPUs are used for running the test benchmark.
semantic image editing,pre-vious works,No previous works target at exemplar-based semantic image editing
semantic image editing,test benchmark,The test benchmark is built for qualitative and quantitative analysis of semantic image editing
source images (xs),mscoco validation set,Source images are manually selected from the MSCOCO validation set.
source images (xs),bounding box (m),Each source image contains only one bounding box.
mask region,source image,The mask region in a source image is no more than half of the whole image.
reference image patch (xr),mscoco training set,The reference image patch is manually retrieved from the MSCOCO training set.
coco exemplar-based image editing benchmark,reference image,The COCO Exemplar-based image Editing benchmark involves combining a reference image patch with a source image.
evaluation metrics,generated images,Evaluation metrics are used to evaluate the generated images.
fid score,generated images,FID score is used to evaluate the generated images.
clip model,fid score,The CLIP model is used to extract features and calculate the FID score.
quality score (qs),generated images,Quality Score (QS) is used to evaluate the authenticity of each single image.
quality score,image authenticity,Quality Score aims to evaluate the authenticity of each single image.
quality score,overall quality of generated images,Average of Quality Score is used to measure the overall quality of generated images.
clip score,similarity between the edited region and the reference image,CLIP score evaluates the similarity between the edited region and the reference image by calculating their cosine similarity.
clip score,edited region,Higher CLIP score indicates that the edited region is more similar to the reference image.
previous works,editing images semantically and locally based on an exemplar image,No previous works aim at editing images semantically and locally based on an exemplar image.
previous works,four related approaches as baselines to our method,"Considering that no previous works aim at editing images semantically and locally based on an exemplar image, four related approaches are chosen as baselines to the method."
blended diffusion,clipsource image,Blended Diffusion leverages the CLIPSource image model to provide gradients to guide the diffusion sampling process.
blended diffusion,text prompt,A text prompt 'a photo of C' is used to compute the CLIP loss in the Blended Diffusion.
reference image,calculate the clip loss,The reference image is used to calculate the CLIP loss in the Blended Diffusion.
stable diffusion,text prompt as condition,Stable Diffusion uses the text prompt as a condition to represent the reference image.
text prompt,condition,The text prompt is used as a condition to represent the reference image.
text prompt,reference image,The text prompt is used to represent the reference image.
reference image,mask region,The reference image is inpainted into the mask region.
state-of-the-art image harmonization method dccf,baseline,The state-of-the-art image harmonization method DCCF is chosen as the baseline.
foreground image,background,The foreground image is fused to the background.
image inpainting model lama,mask region,The image inpainting model LAMA is used to inpaint the whole mask region.
foreground,reference image,The foreground of the reference image is extracted.
foreground,source image,The foreground is harmonized into the source image.
state-of-the-art image harmonization method dccf,reference image,The state-of-the-art image harmonization method DCCF is applied to the reference image.
image harmonization,exemplar image,The image harmonization generates a result almost the same as the exemplar image.
exemplar image,background,The appearance of the exemplar image does not match the background.
exemplar image,source image,"The generative model should transform the shape, size or pose automatically to fit the source image."
generative model,shape,The generative model transforms the shape of the image to fit the source image.
generative model,size,The generative model transforms the size of the image to fit the source image.
generative model,pose,The generative model transforms the pose of the image to fit the source image.
method,photo-realistic result,The method achieves a photo-realistic result while being similar to the reference.
table 1,quantitative comparison,Table 1 presents the quantitative comparison results of different methods.
